starttime, endtime,message
1:48:20,1:49:47, Zuma didnt like to follow rules but to instruct what he already agreed with his own gupta circle so anyone who calls for rules will be removed. In essence zuma was incompetence @Thishan Naicker you don;t seem to understand racism in context of South Africa and Africa as a whole. You have a bookish approach to understanding racism in the African context. @zizoh.....the comments or commission of inquiry?? JESUS WOULD NEVER LIKE WHAT HE SEE'S WHEN HE SEE'S HOW MUCH LAND WMC HAS AND THE BLACK HAS WMC!!!!! @Lucky Dlamini please help me to breakdown this testimony. Many fools here who just can't focus lol. @Thishan Naicker you are the same people who argue BBBEE is racist? Ahem "ZUMA IS ORGANIC YES WATER 
1:50:00,1:51:14, @thato M ......racism is all over the world not only in SA..... "@Zizoh Umm @Thishan Naicker Dar! Now that is a revelation "YES WMC!!!!!!! zuma doesnt have brains and so it seems of eff The phamacist(Gordhan) still going in circles.... YES WMC the WMC narrative is simplistic nonsense 
1:51:16,1:53:43, @Thando Nkutha you can't quote a dictionary to the exclusion of lived daily realities of how racism manifests itself @Wilhelm5381 so are you. WMC!!!!! Three prizes in as many minutes I LIKE ALL RACE GROUPS BUT I DONT LIKE WMC blacks need land . Tthe government had a perfectly operational SARS to deliver it . Zuma destroyed SARS JESUS WILL NEVER LIKE SUCH INJUSTICE 😀 You must be so jealous that you are not as intelligent and gifted as Gordhan nhe @Andrew Mabele​The phamacist(Gordhan) still going in circles.... "I am an African first. All settler minorities come last. In America blacks born there are referred to as African Americans My FIRST love is Africans from Cape to Cairo 
1:53:44,1:55:22, "still brain wash How about you refrain from spewing your racial vomit on this chat "he sound miserable  @anton arjunan how about you tell all listed companies in the JSE who fail to transform their comp 24 yrs in? Anyone who will reason that zuma was competent must ask why he paid back about R7m for nkandla saga. He cant even read economic indicators;can understand rating agencies etc "So vele vele @Aneila Maharaj 😀😀 @Ewald why are you having itchy balls when i say he is a pharmacist? 😀🤣😀 IS THIS GUY REALLY PRESENTING GUPTA LEAKS FROM THE MEDIA AS EVIDENCE? 
1:55:30,1:56:33, @Thando Nkutha its an assumption my brother. But I forgive you WMC IS CONTROLLING U "You wasting your time with this guy 😀 @Andrew Mabele​@Ewald why are you having itchy balls when i say he is a pharmacist? Why is him being a pharmacist pulling your wire?? Why doesn't he just say it outright that 'YES I HAVE EVIDENCE OF ZUMA being corrupt. DO YOU HAVE ANY EVIDENCE OR NOT PRAVIN. DON'T TELL US WHAT YOU HAVE A BETTER GRASP OF. Avoiding the CNN's Amanpour question lol! 😀😀😀😀 "STHAKATHI 
1:56:35,1:59:37, @Aneila Maharaj Gordhan's brass band is here for the lullabies. bro hugs "HE CANT SAY HE HAS EVIDENCE ON ZUMA "NO  i think Julius and SHivambo are all directly implicated... but he is bringing it out very sensatively "t looks like some people are threatened that if Pravin continues to be in SOEs asking questions for answers already provided 100% "em D Then he would contradict himself after that CNN interview where he mentions 
1:59:54,2:00:58, PRAVIN HAS ONCE AGAIN ADMITTED THAT HE HAS NO EVIDENCE. HE IS WASTING OUR TIME. @Aneila Maharaj somebody is touch touchy over political engagements but claims superior logic. Mayibabo! Zizoh what are you on about? "SHALE UDAKILWE can this man give us evidence not the 'dots' @Motsamai Shale You one of the few who understand what's happening 😃 "@Motsamai Shale What do you think about Anisha Gordhan @Luxolo Nogobela i agree.. we need hard and fast facts.... Pravin though is not helping us!! 
2:00:59,2:02:11, PRAVIN IS HERE TO HELP US CONNECT THE DOTS @Sthakathi Khumalo aren't his DOTS connecting. I'm starting to think it's bones and not DOTS. I'm so disappointed by PG. Thando sorry you are not debatable material. You are apathetic beibng😀 Who are you reffering to??? @Thato M Anisha is either corrupt or very smart.... lets wait and see ... lol "HAYI Pravin @Ewald Kruger and the rest don't. You guys are amazing this guy doesn't have evidence to implicate Zuma this pravin is a waste of Oxygen 
2:02:13,2:03:13, "I DONT CARE WHAT PPL THINK Who means who....names papa They expect him to come out spitting like a snake em D I just don't understand why he is not revealing what he has and even bothering to come here and saying he is assisting us!1 nothing against anyone bcos he benefitted himself this Roti head "From the info so far GHORDAN IS WASTING OUR TIE yet he believe the relationship was OK @Zizoh i hope not 
2:03:20,2:04:36, "@singhashon she will be an exceptional case @Zizoh EFF IS NOT THE FUTURE! EFF DEFENDED PRAVIN LAST YEAR AND THEY CHANGING THEIR TUNE LIKE THEY ALWAYS DO. FLIP FLOPPERS!! So you assume EVERYBODY does @Thato M​@Ewald Kruger and the rest don't. You guys are amazing 😀 😀 😀 I love the way you guys are not entertaining this one called Zizo "WE THE BLACK MAJORITY why dont you go and look after your goats before your comrades steal it YOU forgot MAMpara "STHAKATHI LOL 
2:04:46,2:06:18, @Zizoh Haw you vote for everyone? Eff has put amagwala in their place...the man will soon pee in his pants...no childs play.He is contradicting himself "@Ewald Kruger tell me how Anisha Gordhan can score huge gov contracts through CDC Who was in office when what happened 😀 👍 Gordhan "YES @Ewald Kruger Pravin Gordhan & Mcebisi Jonas were the head of National Treasury. A principal of a school....want to implicate Governing body about missing funds...he is so clean...himself..we not fools Gordhan @Zizoh When you wear an ANC T-shirt everyone will tell you they will vote ANC. That is human nature EFF IS THE FUTURE 
2:06:22,2:08:14, "Zizoe shame I feeling for your community we need to be diffrent to Europe and have a beautiful multicultural country "RACISM IS A REALITY IN SA "“Those who are making allegations outside this forum should make them under oath and subject themselves to cross-examination. I am not a commodity for sale and think the Guptas learnt that "WHY DO PEOPLE WANT TO DODGE RACISM "@Ewald Kruger if you are insinuating that the then President would've sight over all SOE deals Three days for this? mayebabo! "no one is dodging 
2:08:24,2:09:28, THE PERSON WHO WAS RUNNING UP AND DOWN ABT STATE CAPTURE HAS NO EVIDENCE @Thato M​@Ewald Kruger Pravin Gordhan & Mcebisi Jonas were the head of National Treasury. 😀 Which planet you arrived from?? WE MUST TALK ABT RACISM UNTIL ITS RESOLVED. DODGING IT WOT SOLVE IT "Can PG please name that ""Person"" he mentions was so devastating between 2009 and 2017" Eh.... war President who? please say the name sir "@Ewald Kruger hypocritical. We didn't do that for other families. The commissions isn't the be all and end of dealing with the issue. Pravin must be dealt first PRAVIN WASTED 3 DAYS ONLY TO TELL THE COMMISSION TO CONNECT THE DOTS!! there we go he has just implicated zuma 
2:09:37,2:10:36, Racism is rife throughout the world it starts with our kids.... they will resolve it... but we must give our kids a none racial upbringing... the existing racists you cant change them "THE NUCLEAR DEAL WAS THE BEST SOLUTION TO OUR PROBLEM "Are there we go He must mention name please "AS A BOT @Thato M​@Ewald Kruger if you are insinuating that the then President would've sight over all SOE deals 😀 Tell me why waste your time here if you can't grasp what's being said??? Pravin is wasting time and the commission's money "@Ewald Kruger this is a political terrain 
2:10:53,2:12:01, Nuclear..... lol Julius made money from the Nuclear deal Why is this JD spending the valuable time instead serving the nation - putting the puzzle together @Ewald Kruger just put your points across man and engage. We will name call when we are done on materiality of arguents PRAVIN IS A WASTE OF TIME *arguments @singhashon have you been listening to the testimony of PG??? nuclear deal never happened... still on the desk🙄 and SA is running out of coal Thando think of evidence and testimony he laid bare how rules were flawed in running the government by the administration he served under. The comm is not gunning for one act by one person 
2:12:51,2:14:17, @Ewald Kruger explain the rationale that a political contestation must be taken to the Commission as Gordhan alleges? Please tell me on what basis this should be done "@Thato M​@Ewald Kruger just put your points across man and engage 😀 I made my point "There was a State Capture. The golden question is ""Who are the players of state capture??""" @singhashon I hope you heard that the nuclear deal never happened! including him.. chair what could they have done to prevent it "@Ewald Kruger and that is supposed to a logical @Edward Buta ASK PRAVIN. "em D  jail the thieves 
2:14:22,2:16:45, "I thought ""State Capture"" was a surecase thing and clear evidence was available that's why Zuma was oust... why are people being asked to come forward with evidence 🤔" "Key moment "Can someone that will reveal it all @Thato M yes Pravin is a wizard who sees everything Thando @Thando Nkutha my point exactly. The entire national spend "@ singhashon but you have ideas of who made money in the ""DEAL"" WHERE do you get that from so we can also go read it up?" "@Thato M​@Ewald Kruger and that is supposed to a logical @Ewald Kruger what are you saying? What are you arguing? Say it. Let's engage 
2:16:57,2:18:44, the media told us that we should march against Zuma... there is clear evidence of state capture... 9 months down the line nothing has happened... was it just propaganda to oust Zuma? intrested i think Pravin is not naming names because if he does.... there is a gun waiting to be offloaded this state capture inquiry is a clear sign that ANC will not be governent 2019 "@Ewald Kruger don't tag my responses @Thato M I am interested to listen to Zondo. lol Pravin is a frontman fo the Ramaphosa cabal/faction it's not different from the NKDZ faction/cabal "@Ewald Kruger great 
2:18:56,2:19:53, EFF WILL COME BACK MARCHING IF HE TELLS ALL lol Pravin Gordan is a criminal... finish en klaar biggest lie and manipulater must be fired so dat he can be let out the truth "Mpho Mashigo I would imagine that the people who suspected didn't have the necessary proof - only heresay only those disillusioned will think that this fake inquiry will work no one will be implicated and s.a will continue as business as usual "sorry The ANC failed to prevent state looting because it was divided and senior members were directly involved esp the head zuma with guptas. The aim was no more transformation but personal gain "and that the ones who had proof 
2:19:58,2:20:57, PRAVIN IS THE BIGGEST MANIPULATOR "This whole things reads much like aSteven King novel How did Gordhan reach the R100bn losses he purported to have caused the country without citing financial flows or atleast one contract? Pravin is right ^ Was it a thumbsuck? "I AM A BOT I AM HERE TO SHOW U THE TRUTH ABT YOUR COUNTRY "I think where Zondo is going Pravin is to say pravin should be ashamed to use duplicity to hide his agenda 
2:21:23,2:22:25, INDIANS WERE TRANSPORTED HERE TO SLAVE IN SUGAR CANE FARMS BY WMC ♥ Zondo 😃 "@Mpho Mashigo That's what I was thinking about also WMC!!!!!! It's been so long. @Keryn where's proof of his allegations? We must just take his word for it? Unfortunately Anisha Gordhan is heavily involved and he didn't disclose this. His words are empty rhetoric! "Pravin is not a hero he is anti-hero yey... Pravin fired Dudu Mnyeni for telling the truth in the SAA enquiry... she said Pravin has shares at Bidvest and it's a supplier to SAA making billions a month at SAA and the Indians improved their lot considerably since then... per capita they are the wealthiest people in SA despite apartheid. "@Ewald Kruger I see you are sidestepping. When all else fails 
2:22:49,2:24:14, But why do not we hear just one instance where Pravin warned or acted against state capture within ANC stages at all. Why is it not because he was also its role player as well WMC!!!!!!!! @Wilhelm5381 in your view blacks and Indians were treated the same? Muppet! The Question was what did he and the ANC do when they discovered state capture. ANSWER is Mantashe's Diagnostic Report a few weeks before the ANC elective conference. So this was all politics that was not the question pravin WMC!!!!! wmc? Pravins Nephew has a business that leases planes to SAA... the Same planes that use to be owned by SAA but sold of... wake up people... PG is the State capturer😡😡😡 Vote ff+ for a prosperous and corrupt free south africa!! 
2:24:21,2:25:19, your mother is a product of WMC... what bull... ANC must boot him out. He is not a man of integrity! Kettle calling the pot black @ Lufuno Mudau I think he didn't hear the question lol although we heard it lol Thing is Pravin wants to distance himself from the rot of ANC But he too has contributed to State of Capture RACISM IS A PRODUCT OF WMC this will be the norm if ANC is elected back into power "SAM The country owes pravin a massive debt of gratitude GERMANY IS TOPS👏 
2:25:42,2:26:36, Viva FF+ coalition with D.A @Mpho Mashigo Floyds brother has shares in 4 companies that provide coal to Eskom.... from the earlier ZUma days PRAVIN HAS DONE NOTHING BUT GIVE US A LECTURE @Walter Spatula for enriching his daughter over millions of people. Afriforum and DA will thank him. futsek Arrest Pravin Gordan mahn he is the one who captured the state😡😡😡 wake up people EFF and ANC are fighting each other through populism we know where this has happened and we know that it ends with violence why don't the blacks purchase black monopoly capital a d brand it "@Thato M Nope "THis is not even a lecture since a lecture is substantiated with facts 
2:27:01,2:28:44, @Mpho Mashigo it would be really nice if it was just 1 person who captured ... easier to fix @ Mpho please bring evidence EFF is playing games @Walter Spatula a criminal standing for another criminal. Your logic is amusing! Pravin Gordhan endorses Cyril Ramaphosa yet the current president is the most secretive state man we have ever had. This man's ethics are unquestionable "Jesus It is political error to think that EFF and ANC can deliver to the masses of south africa Pravin testimony is not so direct as expected by many; he simply stove to exonerate himself from ANC mudslinging but he shared light on state was incompetently run 
2:28:47,2:29:26, "Anybody with a brain can see that @Kevin Davis  ANC Intergrity Commission must move with speed to deal and look into the allegations of a multi millionaire daughter. Lack of useful facts and names. EFF ARE THE FUTURE "Pravin Gordan gave Ivan Pillay R24mill hand shake at SARS. stole R72bill at SARS... now the want to ""Privatized"" (Steal) SAA..." lol LOOK AT OUR VALUES Diagrams at which compounds? "@Thato M Fake news 
2:29:32,2:30:41, EFF it's worse lol Can't wait for the cross examination. Hopefully we'll hear more legally useful material and not politics PLEASE DONT PRIVATISE Vive la difference Notshi... "@Walter Spatula political contestations aren't fought in a Commission "True "EFF IS THE FUTURE lol 
2:30:53,2:31:47, lol Failing by pravin to share light on his own flaws or weakness on state capture leads one to think that he is here to build his own personal standing in the society PRAVIN IS ALSO ADVISING THE COMMISSION "Under cross examination playing victim won't help... Public Protector is investigating you Pravin... you going down... pravin your words are rotten as like your integrity "True notshi lol what will the eff do if they lose there tobacco smuggler WHY DO PPL VOTE FOR A PARTY WHO STILL HIRES 70+ YEAR OLD PERSON 
2:31:58,2:32:53, EFF and ANC fights simply give FF+ and D.A opportunity to effectively fight corruption A practical manifestation can simply be named right folks. TELL us who's now attacking the commission? Hey this guy Corruption will never end in this country HOW CAN A CLEAR MINDED PERSON VOTE FOR GRANDPA "@Lesego Pitsoane ""Whiteness"" is not an insult" "Juju o tlo mo tlhasela gore it's wrong to associate whiteness with riches He talking politics in a commission. This won't save him. This is politics boss! You did the same to Zuma. Take it from whence it comes Liberal democracy allows for these things to happen!!! We need an African political dispensation. 
2:33:03,2:34:11, "why are people scared of PG... this guy is a crook... he was leading this state capture thing but hasn't ""connected the dots yet""" DALI MPOFU WILL GRILL THIS GUY he speaks what he wants lol 😴😴 Africa it's the graveyard of corruption "Gordhan forgets he remains a deployee ANC is in process of transforming itself to become what ZANUpf is today "PRAVIN SAID HE CANT REMEMBER IF HE MET THE GUPTAS 
2:34:15,2:35:23, Is he reading his closing remarks also hebana! PUBLISH ALL SUPPLIER CONTRACTS AND INVOICES AND LETS SEE STATE CAPTURE WENA 😡😡😡 The fact that he is addressing these factional issues here are testament of the balance of forces within the ANC. if you vote ANC 2019 you are also an enabler of corruption "ANC WONT LEAD NEXT YEAR pravin said he never had a meeting with the guptas that's what he said a d he never has nothing ever changed So what must we vote for Sam? cant wait for Dali to question PG "What evidence 
2:35:28,2:35:57, Branches and provinces won't take this lying down. Especially the aggrieved post Nasrec faction. Chickens will come home to roost You forgot Steinhoff and Bidvest 😡😡😡 Mara ogona motho Otlo votela ANC What Pravin is saying now he can submitt to the com later as zondo stated mos notsho do u smoke the eff cigarettes PRAVIN HAS A LOT OF SUGGESTIONS BUT NOTHING SOLID!! DALI IS GONNA BE CRASHED Why is he steering the committee to where he wants it to go... it has its TOR's we voting for EFF 
2:36:03,2:37:22, what about Anglo... Remgro... Barclays EFF is trying to hijack the fight against corruption whilst itself it forgets it is a enabler of corruption its pure deception by EFF to label itself as a champion of fighting corruption "No Please someone take that phone away from him let's not fool ourselves anc will lead like it or not He did the same to Duduzane & Thuthukile Zuma if you vote for anc or eff go and look at what zimbabwe is then apply it to s.a if anc or eff get in power ur daughter is benefiting MrPG Pravin is re-writing the terms of the commission. This is very sly. He's now testifying for his daughter 
2:37:27,2:38:12, all smokers and bank looters vote eff "Which have state contracts and signed multimillion ran deal while you were a Minsiters I CANT WAIT FOR ZUMA TO COME BEFORE THE COMMISSION. SOME PPL WILL BE SILENT FOR WHOLE WEEK 🙊🙉🙈 Your daughter must come before the commission suka!! he must defend the lues of malema lies EFF will not govern S.A next year "STOP SCARRYING US WITH ZIMBABWE 
2:38:14,2:38:56, Is this even allowed. Can one testify for someone else. WHAT! Who must we vote for Sam then? "Anisha's rise to Investec Exco is amazing Malema and Gordan is personal since when Malema was given millionaires tenders at Limpopo and Gordan was minister of Finance pushing to put Limpopo under administration WONT YOU AGREE THAT HIRING OLD GRANNY IS A BAD DECISION Why is PG setting himself up? "vote for FF+  promoting private capital @Zizoh. Listen to PG`s testimony about you & your cabal`s propaganda regarding PG`s daughter eating your tax 
2:39:13,2:40:34, Inoba unxilile kengo Sam 😂😂😂😂 "He is playing pity party u nt Zimbabwe bt u'll be like Zimbabwe soon HOW CAN YOU HIRE SUCH AS OLD MADALA TO LEAD YOU Is he reading ves from the bible Is this in the terms of reference of the commission. Zondo shouldn't be allowing this. This is not a family function. He banna! age is nothing but a number... if you are smart you are smart irrespective of age zicoh is malema the right man if so better give him a vuvuzela Zondo object to this trash man!! 
2:40:37,2:41:18, "but the truth that we don't want to hear Why is he talking on his son behalf. How I which Zondo will subpoena Malema to come with evidence he have about PG to the inquiry. He is using the Commission to answer questions in a wrong platform. @Kevin Davis Malema is exercising the politics of distraction. It's one of the things he does well. The other is giving gullible kiddies populist visions for the future Singh defending his home boy.. you bet ya the biggest lie is christianity PG pretends to be the holy one 
2:41:19,2:41:59, "It is his reading of the political landscape high five @Walter Spatula all quote the bible when in trouble😂😂😂 Another person would have been prevented from testifying for someone else. The commission can simple call em up PG WAS PART OF THE SELLOOUT IN 1994 Walter that man is dangerous as he advocates violence but he himself won't lift a finger just a coward A family is given leeway to air their personal views. goshhh and we fund this rubbish. Stand up fightters!! He is now crying for sympathetic support now he be reminded that he can do this at some stages not hear play the ball 
2:42:15,2:43:00, ta ta eff Bye sir!! EFF got him on Anisha Gordhan. give EFF to govern S.A 2019 it will be like giving Iran and North Korea go ahead to have Nuclear weapons vote FF+ for a safer S.A We AWAIT EEF COWARDS to make submission under oath & be subjected to cross-examination! EFF GOT HIM WHERE THEY WANT HIM lol no chance Clapping hands?? is it usual? 
2:43:15,2:43:42, EFF has bruised Minister Paraffin "People are dying in over crowded hospitals @Lucky Dlamini The man is a hero vote eff lucky nothing usual about the guptas and zuma and malema lol Lucky Dlamini I am just wondering who are the people clapping here?? ZONDO IS BEING SOFT PG is misleading us in some of his points 🙄 
2:43:46,2:44:40, im voting for the soccer party... the only honest party out there ijoo i will go to Zimbabwe eff "Zondo @Nkutha. Go make your submission to the inquiry and stop moaning on the sidelines Zondo next target on malema's radar PG is the next nene 😂 i tell you Anc WHO ARE THESE POLITICALS PARTIES 
2:44:50,2:45:35, FF+ IS A USUAL BUNCH "It is normal. Now we must all sung the same chorus from the same hymn book Is judge Zondo now expressing partiality. The PG factor got him hey. it will show the innocent eff followers have been following a liar viva ANC viva eff juju must go also EFF IS THE FUTURE the government must create jobs for people to get jobs 
2:45:37,2:46:24, vote Eff lol ZONDO IS SOFT @Nkutha. I have a Job! Thanx! zicoh with all 6 percent of the vote lol that's what you call Mickey mouse Zondo is professional... you dont have to be rude and abrupt to do your job "WE DONT WANT JOBS ANC fought enough for this country they must rule for ever "@Walter Spatula the aim isn't to insult 
2:46:29,2:47:12, This sound like CR response PG. What will be the new rectified statements. WE WANT THE LAND @singhashon poems chief! EFF IS MISLEADING right. WE DONT WANT JOBS @Thato M 😂 How will u survive when don't work? land first YEah... we dont want jobs 
2:47:12,2:47:35, Thank you cde PG we want the land we dont ever want to work those who are for EFF you have no ideas what COMMUNISM is! "WE DONT WANT JOBS eff is d way to go LAND OR DEATH land @singhashon YOu don't have to work if you have land? 
2:47:38,2:48:05, land Can't wait for Mr Fuzile. Maybe he will be more factual land @Zizoh​ ZONDO IS SOFT. ZIZOH IS STUPID. Will u use ur fingers to work out the land? i hate work banya 🤔 is lunch guys go n eat 
2:48:05,2:48:53, If you want land work for it and stop begging KRUGER; WE WANT LAND OR DEATH LAND OR IDIBALA "EFF is a false opposition motete wa nkoti "Omw. .....really? A poem is exactly that "em D I doubt Fuzile may have anything really i dont have land.. i want land too i want to build a house 
2:49:01,2:49:42, EFF must make submitting to the commission if you are really for the truth as you proclaim and Stop dancing on the wrong stage. They should us t i dont have a cow and i want one to for my children and grow crops and live off the land EFF = COMMUNISM "EXACTLY SING @singhashon Your children want a better life in the cities They should leave our land ... Gordhan ♥♥♥♥♥ 
2:49:52,2:50:45, EFF communism doesn't work farm equipments and go back LAND OR IDIBALA Viva comrade Gordhan Lands Grabs : Yes or No? @Thando Nkutha HAHAHAHAHA!!!!!!! rotten speech.... did u bought the farm equipments? vote FF+ or DA "NO 
2:50:46,2:51:30, @Thando Nkutha POWER TO THAT EFF is communism by the back door EFF will turn S.A into another zimbabwe No they want to re-invent the wheel again @Ayanda... and have their chance to loot tHIS IS WHAT WE WANT TO SEE BLACK YOUNG FACES Pravin is a liar! "If education policy of the Zuma governments was to blind with the darkness of ignorance Will SA become another Zimbabwe? "read ""animal farm"" communism doesn't work" 
2:51:38,2:52:42, EFF = EMPOWERMENT FOR FRIENDS I am the only pragmatic person who was underwhelmed by this conspiratorial testimony? I give up. "any one LAND OR DEATH @alain redcliffe IF EFF is voted into power S.A will become Zimbabwe EFF is communist party @Mthobisi Zuma You fill in a form and then WAIT.... Malema is a communist "THE PROCESS IS BLACK FIRST LAND FIRST 
