starttime, endtime,message
time,5:03,message They don't even say how was LUNCH!!?????? SABC Please fix Audio On time Audio Sound ok on my side Sound please it's fine on my side fine on full volume 
5:12,9:59, barely Who pays for all their lunches robust!!! Very soft Lunch is on the public purse like they don't have their own Lunch money Success Fee the same as bribery lol Sounds like a cooked deal "21% Success fee through another company 
10:24,14:03, Bombshells milking of funds 10.12.15.4 I see MONEY THERE HAHA "Not milking *fiscus I feel sick don't know how much longer I can listen to all this corruption Is Popo and Brian family members? Popo Molefe successfully challenged a 3.5 Billion Rands trains contract and saved the country some money. 'Swifambo loses SCA bid to retain R3.5bn 'tall trains' Prasa tender'. (NEWS24) "I would hate to represent these thieves as an attorney 
14:51,17:06, They will not mention the trains that were shipped to S.A that don't fit on S.African rail tracks (wrong size etc)? @Magda Seguin Thousands of pages = higher fees 😉 Zondo is getting tongue tied this is just crazy why are people not being dragged to court now. giving them time gets them formulating a strategy to beat the system or hide evidence. They are making a killing @Anne M. let all evidence come out @dm70 The commission already has the evidence before the witnesses give testimony. They intentionally disregarded the statutes pertaining to procurements and tenders. "The commission team are cross checking the evidence 
17:11,18:12, the public must hear they stole our money period Annie M. are you saying this inquiry is also a shamble on repeat lol 'locomotive supplier Swifambo Rail Leasing has lost a Supreme Court of Appeal challenge to a High Court order that stripped it of a R3.5bn tender with Prasa. "@Henk Le néant est un concept d'absence absolue i want to steal that amount and see how far it will get me "This "What have I missed here?? Are we on trains "@Henk No 
18:14,19:46, And the ANC makes as if nothing happened even taken the implicated to parliament @david jacobs do you think you will be happy? 🤣🤣 Molefe also led a move that sought to recoup R2.6bn paid to Swifambo. @David Jacobs there are people in jail for shoplifting food @Felix Muyoba eish @Magda Seguin Exactly the implicated members are also on the ballot paper all along I underestimated the rot in this capture. these guys are evil and should die in prison. 
19:48,23:35, they must take collective responsibilty for stealing the money Success Fee "Swifambo did not supply the full complement of trains as required under the contract "Sometimes I wake up at night and the first thing that comes to mind is the misery and poverty caused by this hi guys who's this man? "does the audience know that members of the SA public before being employed at any of the SOE's  Having worked among very poor and sick people in SA is a nightmare as there is no funding for social alleviation no they should not be trained regurly they should be JAILED more regularly am worried that some people fingered in the rot are on their way to parliament. how can you have thieves representing people in parliament. Cyril needs to get heads rolling 
23:41,26:16, thanks Mzalwane "I just couldn't anymore after eleven years @#dm70 Cyril cant do nothing his hands is tied "@#dm70 Douglas.. there are no checks and balances not even on the authenticity of qualifications Google online how many of the ANC politicians have criminal records the amount that have more then one convictions are above 50% of the entire party Who is that @dm70? @david jacobs Who are these people who implicated in this and are going to parliament? 
26:21,27:20, "The elections should have been delayed to deal with this crises Julius Malema has a pending criminal record just waiting for the corrupt NPA prosecutors to be removed. Mzalwane have you not seen the ANC list? @Mzalwane Mzala in reference to the ANC list they must go to Kokstad Prison Cmax these guys lol "ALL the SOE's are virtually bankrupt they must be moved out of South Africa Who are the people who are implicated in this case who are going to parliament? Do they have names? 
27:22,29:20, "@Kapn Krunch . that's my point exactly i dont want to feed them whilst in jail they have taken too much already Mixer Operator still can't grasp that Master Mute or Channel Mute function or Fader Position in between sessions. Amateurs. This election is not viable with all the thieves involved "Sitting in jail is not a solution @Magda Seguin . Its a farce already. "@#dm70 but kokstad you will learn lesson Gavin will find out how prisoners will treat him 
29:21,30:41, "crocodiles loves soft meat all types of it they are tired of 'CHICKEN""" I like this guy. straight thinker with a business mind. vote eff If the people were not so gullible the government would have fallen already Dudu gave her LV bag back to Gavin 'Bobo with his big stick awaits the convicted. THE QEUSTION is agrizzi was a thinker to but also a big crook please don't insult our intelligence by saying vote EFF Mzalwane we all know them. I will not name people before found guilty. 
30:46,32:34, viva DA viva for that he will spend time a long time with Papa in jail EFF = ANCYL "Yes This relocation is a travesty...I just read up on it I believe CR would have claimed many blue voters if he had fired all the dirty politicians and would not have needed the other faction eff =shareholders VBS floyd chairman How can you call for the punishment of people but you are scared of naming them before they are 'found guilty'. You insist that they have a right not to be named but hat have no right not be punished @Mzalwane Mzala dont you know ? 
32:37,34:19, he would have indeed talking as a da voter "do you know the name Malusi  I also believe the DA is a best option so far...they proved clean governance in the WC and clean audits from the AG I now know what kind of people I am discussing with. The next government will have to build more prisons @Mzalwane Mzala Nomvula received money since 2006 Is she implicated in this case? Monthly R50k payments @Mzalwane Mzala with gatvol south africans yes tired of thieving 
34:28,35:34, "Yeah no chance for da "Apart from all the other perks from Bosasa I would like UDM to be given a chance Even the EFF has vowed not to prop the DA into power again. @Mzalwane Mzala The ANC preached collective responsibilty a while ago oops must be a spelling fault Then they must collectively go to prison DA has no corrupt municipalities there is over sight with the DA. 
35:39,36:58, "we need to do away with this ANC they think nothing of the poor people @david jacobs Is there something called collective responsibility in law? mzalwane mzala some names myeni nomvula zwane gigaba gwede and the list go on 80% of nec 80% of list no shame no dignity @Mzalwane Mzala no its the ANC thinktank that thought about it The EFF has vowed to kick the DA out of those municipalities it supported them in I for one cannot believe this level of thieving was unknown by some in Parliament and most of the SOE Boards. Suspension prior to a fair trial would have worked. @Mzalwane Mzala You heard about that coming from Zizi Kodwa "The thieves even captured parliamentary committees 
37:20,38:54, "@#dm70 worry not you are only left with few hours to out vote them @david jacobs I thought we were dealing with criminaly punishing looters. This level of corruption is sickening and effects all of us. they stole money from us period I have already voted in UK. I live in Ireland All polls point to an ANC victory specialy from the poorest of the poor and who just want a job and a home "Zuma features large yet he says he did nothing wrong 
38:55,40:16, I mean this corruption is everywhere. lol All polls point to an increase in EFF support. i as a South African expect prosecutions to happen EEF will emerge victorious this time. It's imminent. people must be jailed "All SOE's are funded by you and I DA will get atleast 35% All polls point to an decrease in DA support. 
40:31,41:43, "I can't wait @david jacobs..we want to see justice Eff are not going to win that's a promise. It is written in the heavens. "All polls point to a decrease in DA support "@Thando Nkuna ANC will see a reduction in % to the 50s can't trust this guy. They will never govern ..... even less 
41:48,42:57, Where there is smoke there is fire and one of our political Parties is on fire. A win is 50% plus 1 @Marvel Ramatshela "If I had time and space I would tell you about the healthcare situation which is my specialty "No one will WIN this election "Mzalwane @Mzalwane Mzala Any other party that stole so much as the ANC "DA is obsessed with the ANC "FFE mzalwane mzala every elections the anc has been losing support now it will scrape through 
43:18,44:09, Let us quote the Polls @Douglas Beadle SA is rich in human and a host of other resources but thanks to Zuma it is in ruins the DA has service delivery that speaks for itself EFF will be a disaster for this country seems tha this person lnew a lot but did not eat shushi or curry but also did not do due diligence despite these corruption allegations against the ANC I still believe the ruling party will win these elections...i bless u ANC. Can someone still vote even if is not registered for this year voting. But I did vote in another province in 2009. I say that as a jozi boy that's visited capetown These people are so rotten and cruel.Ministers and CEO's were changed to facilitate this grand scale of looting.They knew someone at the top was protecting them thats why they are still arrogant. 
44:25,45:17, IRR place the ANC at 54.7% fire a xenophobic govt Perhaps let's pause the imaginary perception about the election results until the announcement is made next week. so you bles criminals hibo EFF are just noise makers but not ideal leaders "@Magda Seguin . 100% true Future generations and the youth will judge the ANC for stealing their future.It will take another 25 years to heal the country And what happens if 1 party gets 50% exactly or so? "ANC voters - you lose the right to complain about corruption 
45:22,47:34, the way the DA is seen is a result of the only way the ANC gets votes by making everything black and white "@Douglas Beadle you are right IRR which is led by pro DA liberals places the DA at 21.8% "DA isn't racist We have no guarantee that CR will fire the thieves ANC can only survive by dividing people - SA will not survive much longer The DA's list is made up of 58% white reps in a country that is over 70% black DA will even see a decline in the western cape because Aunt Patricia will gain votes from them "#dm70 it is due to the divisive race politics of the EFF 
48:01,50:37, "If the ANC win we DA supporters don't want to see you toytoying it is too late cancer can only be treated when detected early IRR poll says the EFF is likely to grow to 12.2. Ace was left to his own devices electioneering about race 1992 referendum "SA should adopt a diferent election policy @Thando Nkutha At some point I thought you were an EFF supporter my brother. has there been a change of attitude or was I wrong? EFF doesn't have a strategy beyond Zuma and land grabbing Eff will bring about another Zimbabwe .... 
50:51,56:19, NO TAX = NO BUGet to waste. What i can not argue against is that the EFF is likely to govern the City of Tshwane after these elections and the DA have acknowledged that by placing the current mayor on their provincial list. I will not be shocked if they bring Floyd to be the mayor. There is no brain matter in the EFF just simple minded thugs. we need to think economically and stop this locality business. ANC is looting resources and I don't see them being sent to jail because all of them have smolanyana skeletons "4th industrial digital be ready world is changing said mr Ramaphosa honestly EFF can't move beyond land grabs and Zuma. ask them what their strategy is moving forward and you will get dololo answer. 😀 "I once saw her at CT airport prancing around 
56:25,59:50, "Dm70 @Prinasha Mothilal You still have to learn that what you want does not necessarily drive politics. I did not say I want. I am analyzing based on the balance of forces. I leave 'want' to you. "ANC is about to move with you for next destinations forward with factory "Egni my problem with eff is they want to nationalize everything after we just had to sell eskom and telkom just to make the infrastructure function and he wants everything to be government run The EFF is a simple minded party of hoodlums that think that everything will be free as we know otherwise and i do not say that it is political mitivated bur hienays crimes and eff and blf helping along with hate speech you can't lead a nation when you have no respect like EFF and BLF The small business minister was always the most vocal in parliament supporting Zuma and calling the DA racists...I really hope she is on the CR list of thinning out ..her name is still on the list 
1:00:30,1:03:31, they advocate for government owning all business when government cant handle their current responsibilities it's simply madness "Malena himself is guilty of tax evasion who is paying the blf "By voting ANC and depending on one man is very risky EFF are just on cloud 9. they strategy is not feasible. it's just a 2 year old dream Remember Cyril won at Nasrec on a very narrow margin Val Speirs I thought Mizzotti was a cigarette smuggler or something Now there are rumours that NDZ may become deputy president..maybe it's just speculation but one can never know what they are planning behind the scenes but you need regitration money for each ward you are runnung for and a lot of money and then the 1 taxi they had to hire for their suporters 
1:04:09,1:06:53, Genk he is also a drug smuggler "Who said that? One President malema "@Magda Seguin they cannot remove Ramaphosa masses on the ground will fight for Ramaphosa no matter what as long as he free from corruption we support him That was not on my news Val Speirs but I'll do my homework RIP earphone users from me i hate DA and Eff son of rc ate curry 400k of it there is no problem for anc winning the election as long as they don't get the two third majority 
1:07:37,1:10:21, i already bought a single plane tivket if they do "Top contenders in S.A for tomorrow seem to be ANC nkuta de wll bring anthr zim "Ramaphosa once a fighter for working class today people earned better because of him they call it corruption as the meter long paper now cost 40 times more I can't believe how one can still believe in the ANC after they ruined everything and sold the soul of the country to a foreign family.But I respect freedom of choice. Is PRASA and TRANSNET One entity? "@Danie Nilsen you have it We don't deny that CR is an honourable man but he is up against a gang of evil people intent on power and lining their own pockets 
1:10:23,1:12:47, @makhosi nobhatyi if what CR keeps saying is anything to go by we are likely to see a better ANC government. Technically he states that the auditing system is also corrupt? "When I see children still being taught under tress The problem is that these guys do business with the same SOEs through their children. Most of them feel entitled to everything in SA resources because of struggle credentials. All of them are eating! Magda Seguin ANC never send anyone to corruption they did that to enrich themselves so as we hear testimony @Magda Seguin you are correct but seemingly their days are numbered otherwise it will be the demise of ANC "@Henk  These crooks better not think they can hide in European countries "Better government with a pack of thieves in control? A leopard never changes his stripes 
1:13:17,1:15:47, Cheers @funicanz 👍 mandela had the vision but sadly he was when still alive side tracked to make the rainbow nation a reality stoooooooooopid "@Thando Nkutha Remember he adopted the current cabinet So many honest people's lives were destroyed by state capture..I think a class action will be in order hesitations means you ate curry I wonder how will south Africa be like after tomorrow This guy testifying seems to be hiding a lot @Thando Nkutha just recently he said those who are implicated on state capture wont be in his cabinet 
1:15:56,1:18:08, Thabo same as yesterday😂 the same xenophobiaic coruppted as it is now sadly "Thabo kau it will be more jobs created @Thando Nkutha so i am saying he is making the right noises and i would like to see him walk the talk "Ace "how does he know about all the wrong doings  If you have money and influence in South Africa you can do anything. The notion of corruption is a colonial one. Does this word corruption exist in any indigenous local language? I don't think so. "Henk Even Mbablula had a nice family holiday in Dubai paid for by the Estina money to the amount of R160k 
1:18:23,1:21:54, ". "Give Ramaphosa a chance then take him to task imdians calles it batering afrikaners calls it busness the africans calls it ubuntu ....i think lol nobody calls it coruption I just checked 15 hours and 39 minutes to go to the 8th.The time of truth is close. "@Thando Nkutha yes you are right but he cant be humble in the mist of corrupt individual True that Thabo Kau even CR will want to eat like the others how can he be ligit while others rolling in money "Things won’t just change over night 
1:22:00,1:24:07, listen to the amounts and eiskom is bankrupt why new trains and not bail out eishkom sies man It's called a Success Fee is the new word for corruption "It will be another tragedy if people voting for CR is disappointed lol Val Speirs Ramaphosa is the second wealthiest African in South Africa his brother in law is the first. ace magashule and 4 others in the big 6 are busy to work him out """..but for us the matter is closed"" eish" @Magda Seguin he is an ANC member so no one is using him rather he is working foe the ANC and the brother is not corupt inlaw i mean 
1:24:33,1:27:00, Well done Popo! Now lay criminal charges against alla concerned! "The earlier the ANC remove Ace Mashagule the better @Thando Nkutha I get you They are both involved in mining and many other businesses. will have to research. "@Carnoth Ngomane there is a faction gunning for him "Kay kay wait and see after elections zizojika izinto things will change he knows to much he got away with killing freestate and got redeployed wich he orginized himself as premier of the freestate he could not do that "CR has to reign in Ace and others every time they make contrary statements in public Oh lord I can't stand Maxine Waters what a no brainer. 
1:27:03,1:28:42, when they going to charge and jail the people that made the purchases and corruption. jail or death penalty is the only way to stop them @Magda Seguin i konw that but i dont see that faction succeeding When is Transnet going to pay the pensioners the money stolen from their pension fund?? she is like mambole in shushter s movie We hope so @Carnoth Ngomane Maxine Waters you are the real deal.. planet of the.. @Thando Nkutha i dont mean he should jail them rather keep them out of his cabinet What next lol Maxine when are you going to give Donald a break? 
1:28:43,1:30:58, she is already dead must just fall over but the demon rats keeps her upright "Magda Seguin sometimes leave the idiots think he is killing you while he is heating finger with a hammer Creepy Joe Block this racist A troll appeared after decent convo..eish @Thando Nkutha that's great They want to block you Maxine "I sincerely hope that you are right "Ace 
1:31:14,1:34:45, you are alowed please proceed Maxine.. Trump is the greatest. Victory will be Trumps 2020 i like the green piece deal so smoking it will be legal in usa This is South Africa.. Maxine.. blacks hate whites here. @Val Speirs and vice versa In the USA there is no racism Maxine how did you escape out of Disneyland Apparently JZ and Ace help formulate ATM party policies and manifesto... Those are serious allegations especially against Ace @Danie Nilsen you are correct but it shouldnt be condoned 
1:35:11,1:38:05, i do not condone it Maxine you should be thankful your ancestors were stolen from Africa.. just look at Africa today we don't follow the POpe he likes little boys @Danie Nilsen thats great they all do futere pipes lol Maxine.. why don't black Americans want to return to their native land?? I think Ben Carson should be our next President I have so much respect for Ben. The second poll to consider is that of CSDA My head is spinning with all the millions and billions...jislaaik 
1:38:19,1:40:53, @ kay kay I totally agree with you 100% it will be worse when SAA come up on the stand that austronaut was black because his space ship burned out but if you nknow that i will not dispute it Maxine.. Ben Carson should be South Africa's President CSDA places the ANC at 56% "@Kay Kay they did have a meeting HILLARY SHE IS PROFESSIONAL CROOK hillary is nothing compared to zuma "why is this chat so US centric 
1:40:56,1:42:50, SHE SHOULD BE WIFE NO6 @Michael Wild Dudu is very quiet...it's a Pandoras box..SAA was bailed out with our money so many times yet they never recovered.Remember she is also the Chair of the Zuma Foundation Anyone else experiencing buffering? Not me @Anne M. IT IS BRCAUSE THE TREND IS RUNNING THERE ONLY IT IS DONE BY THE MINORITY IN FEDERAL GOVERMENT CSDA poll says the DA's electoral support has decreased to 13 % MY DAPS ARE REFUSING TO GO SMALL Chris HAni would have moered Zuma for the way he corrupted the ANC "My kop draai 
1:43:13,1:45:55, "yes it is very scary. that will really open the pandora Maxine wow Popo Molefe talking truth here DO NOT FORGET THAT HANI was out of jail when mandela was in and aunty winni was not hanis grandmother "Imagine the millions who lost their jobs "Maxine.. Obama was America's worst President ever i heard it was measels Obama was born in Kenya so what is it... 
1:46:06,1:47:25, All this leads back in a straight line to one man:ZUMA val spiers lol keep smoking meth it makes your bones strong Obama was not born in Kenya then by law he cant be USA president. some of his family come from Kenya "My mother would turn in her grave if she had to hear me swear True story. Christianity was out the window until Trump win. Centre for Social Development in Africa (CSDA) @Thando Nkutha say it loud @ Anne flaffa is better i hear al this money stolen or did we get value out of it 
1:48:25,1:51:48, @Maxine Waters what is your problem? do you want our attention or what? CSDA poll says the EFF's electoral support has increased to 9 % @Anne M. it's enough to want to the oneself in chains to a lamppost @Magda Seguin True. viva ANC keep voting yourselves into poverty while the politicians line their pockets. They are goo people in the ANC who ousted some cleaners and those who throw out eff in parliament 
1:52:45,1:54:08, @Joe what you sniffing? you CHOOSE NOT TO KNOW THEM bye bye bull shyte speaker Maxine you been blocked "@david jacobs CR I did the same to that fool @Michael Wild @Carnoth Ngomane it will take a long while to trust Cyrl Geoffrey Ramaphosa I saw the name list but if it was me I would have resigned and not take the R1m plus salary @david jacobs may i ask why? @Magda Seguin bad habits die hard 
1:54:39,1:55:40, @Carnoth Ngomane because we are where we are now puu puu in.. puu puu out ...master de puu puu ! They could have made it easy by resigning they lost my trust.No honour or moral compass now its peace on the chat where was Cyril when this happened oh where oh where All reasonable people must have been angry or disappointed to learn that the SIU investigated Bosasa and its report and recommendations were not acted upon by the NPA for 10 years. @david jacobs is he the reason why we are where we are? "To ensure that SIU reports are quickly dealt with 
1:55:48,1:58:24, marikana maybe? Cyril was making his billions "Now the SIU need not "@Carnoth Ngomane yes my reason he didnt do anyrhing under Zuma  "@Thando Nkutha yes i am looking at the ANC holistically not based on factionalism @Carnoth Ngomane now after 9/10 wasted years he want to say corruption hurt the country Why we don’t have the Guptas arrested yet ? Dumbfounds me Interpol and the Indian Government must arrest these rats ??? @Thami Ngwenya is that phrase of yours correct? @david jacobs at least he knows better so he should act differently 
1:58:39,2:00:32, Indian government has arrest warrants for them if they step in India. "@Carnoth Ngomane  "Yes because if blacks has a million @Carnoth Ngomane Cyril hands is tied he cant move like he wants to And Dubai should arrest the Guptas Cyril is hurting "@Kirk gemmelll b @Thami Ngwenya no man..you should rather say some blacks and not just blacks.. 
2:00:38,2:02:27, who siphon da puu puu ? @david jacobs it wont happen over night but it will I am sure Maxine Waters isn't her real name. It is a congress woman from America And she cannot spel the next poll to consider is that of Markdata donald trump Maxine Waters is a troll "I blocked Maxine Waters I have - informing Madelein and Margareth 
2:02:30,2:04:00, i missed the news vote eff for the hope of Africa Thank you Honourable Sir Popo Molefe He is referring to Julius Malema.. cheap talk and ignorant people "Yes This guy is great - respect to him we need more of him "Thx No leave Maxine alone The Markdata poll places the ANC support at 60.6% 
