starttime, endtime,message
time,8:21,message what's time they are starting what time are they starting? "Supposed to be now Supposed to be 10 am here we go "Morning everyone i like this lady Beautiful American accent south African accent well spoken English 
9:30,26:15, We should go after the Guptas amazing 🦏🥛 "Mr Tsotsi "This Lady again @Bedazzled Quite a fitting name for an ANC member. my favourite advocate is back 🤗🤗 New evidence leader. He looks confident. I like it. Adv bae 
27:14,30:04, The bae of law has arrived. definitely bae hey hey hey "Lets give her dat name Hopefully witness will not burst into tears Adv bae with a soft voice. Yummy thang. "All these baeble baes are too young for me. 10 years too early speak up "@He lives in you I had to look it up 
30:13,33:05, IS THAT THE RUNNING MANS PAPA "this guy 31 years at Eskom sound @sabc please? Different surname @Mikey Likesit I assume you're referring to Oscar Pistorious. This man's surname is Pretorius. this guy must speak up we need to bring som guys out of retirement and who have emigrated to other countries to run Eskom. you cannot take a guy out of school really sound is too soft sounds the SAME we might now really find out why we getting Load shedding 
33:14,35:26, doubt the qualifications I don't think they wanted help to eat the money. "@Jabu Malinga I stand to be corrected "Times have changed @SABC Digital News Please check the sound level. Volume seems a bit low. Voluuuuuuuuuuuuuuuuuuuuuuuuume is this not about EWN chanel @Jabu Malinga Agree - it should be all hands on deck to try and sort out the problem. "nope Dannie 
35:58,38:28, Can this guy maybe direct us to the saxonwold shebeen >? "@Danie Nilsen It's about TNA wow PEOPLE GET PAID TO BE ON FACE BOOK @Anne M. thank you i thought i heard that it was a media thing today it is Danni TNA compare Thabethe giberish yesterday to this guy today..night and day The New Age advertising maybe it is gupta owned? 
38:37,41:07, @He lives in you - you always have negative stories about white people being turned down. Stories that only yourself can confirm. Thabethe came to just talk nonsense to try and avoid responsibility. Im sure the chair has already made findings against him It was Gupta owned @Danie Nilsen lol WHY ADVERTISING FOR A POWER COMPANY THAT OWNS 98% of market share??? the guilty ones evidence is all over you compete with yourself money laundering between eskom and guptas is this abour apartheid? 
41:12,43:55, Volume please otherwise we will leave you for the loud ENCA. @Mikey Likesit Exactly my question. GUPTA FAMILY IS SANCTIONED Yup I WOULDN'T WANT OUR TREASURY AFTER ME Trump is the antichrist. THEY GET PAID WITH BRIBERY "Strategic Marketing Dept advertised special programmes. Eg The bulb swap programme (you could swap your normal bulb for efficiency bulbs) why on earth would Eskom need to advertise. They are the only service provider and electricity is an absolute need amongst all South Africans. 
44:04,45:01, It is a valid and necessary function @Jesse Mix FO to USA democrat The problem is the corruption which occured they all liers Jesus will defeat antichrist Trump and his space force. YUP... BUT WHO ELSE SANCTIONED THE GUPTA FAMILY?? The Advocate and witness look like they’re conversing between themselves. They’ve forgotten they need to massage the Chair’s ego every now and again. i am going over to ewn where you can hear "I myself 
46:08,48:00, TRUMP JUST DELETED THE KING OF ISIS i am thinking of sactioning this guys from ASIA u know them "shouldn't Eskom want us to use more elc to make more money. they work in reverse When the chair is happy with the evidence leader he keeps quite and listen more especially when the witness is not one of the implicated ones. Trump did 911. ASia?? no not TRUMP Bush "Ndivhuwo "The CIA said that they killed him ""in spite"" of Trump not because of Trump. They said Trumps actions in the past few weeks made the job harder and dangerous.Almost as if he didn't want him killed." 
48:34,49:38, i mean those guys who looted our Tax revenue bad audio "Anyways can they fix the volume? "Hamza @Hamza CIA did not "Trump is going to hear these words soon: ""YOU'RE FIRED!!!"" 🤣" Those were soldiers already captured and in Prison. Trump let them go. @Hamza CIA did not stop lying. 
49:54,51:52, DELETING GADAFI WAS A HUGE MISTAKE @Derek Main on the trol train again grow up derek do you believe that ISIS leader is really dead? Well the CIA and Military killed him not Trump. Trump was actually playing golf at the time. When Osama was killed at least Obama was in the control room. MOST LIKELY NOT hmmmmmm and OSAM? I mean OSAM BIN LADEN osam is dust by know marketing 101 lesson given 
51:56,53:40, yea OK 1ST TIME I HEARD BARRY WHITE TODAY... "Trump was shown a Call of Duty video his son also bite the dust are free from ISIS MAYBE "@Hamza You must have reference of what you discuss here THEY ARE COO COO FOR COCO PUFFS 
54:17,56:27, isis as a terrorist group stil exsist bit leaderliss now but still there will be a devil apointed and then trump can have some exersise again There was a video wer young boys wer being taught to hate other and laughing at other religions in mosqs in Britain somwer.imagine what is happening here and asia America are silence about BOKO HARAMA why @Jabu Malinga Islam is the second biggest religion in the world. There are Billions of muslims in the world. You are judging billions of people because of a few kids. The biggest threat the world faces today is the rogue state of america. BOKO HARAM are nearly defeted they are running like rabits YOU ARE CORRECT NO MORE NUCLEAR what about Alshabab 
57:04,58:54, BOKO IS IN NIGERIA? @Derek Main stop talking crap NUCLEAR REACTORS = GLOBAL WARMING Especially with someone as unstable as Trump being in charge of nuclear weapons. @Derek Main Theres no way the military and the CIA gave him real nuclear codes. They know he is not capable of that responsibility. HOW DARE YOU...YOUR TAKING MY CHILDHOOD NUCLEAR FALLOUT = BIRTH DEFECTS yes and others country around the nigerian borders HOW DARE YOU 
59:29,1:01:36, "@Danie Nilsen If you have something worth commenting on to say @Derek Main i just did learn to read @Danie Nilsen Not worth it - learn to debate. @Hamza I very much doubt that Trump is a mere puppet in the USA Whitehouse as you are insinuating I SAILED OVER FROM SWEDEN... HOW DARE YOU 75 YEARS OF NUCLEAR INEPTITUDE MADE US ALL SICK hey we have not been consulted nor were there any contracts entered into seeing that we have sponsored Eskom for years with bailouts "@Neil Fraser He is not a puppet of the white house. He 100% control the white house and the executive. However gotta role one up. brb 
1:01:40,1:04:53, @Derek Main to debate you is to come DOWN to your intelect and i am not in the mood for that Hope heaven is Happy for MAIMENE to comeback full time as a pastor The millitary and CIA are seperate from the white house adn @Danie Nilsen So lame - how old are you? @Derek Main to old for you to catch up @Danie Nilsen You can't even spell intellect 🤣 @Derek Main is it compulsary on this post to spell corectly "@Hamza Whether they trust him or not @Derek Main AND Danie Nilsen grow up guys 
1:05:08,1:06:57, ITS 5am. who can even think BEFORE coffee?? Lets talk about the subject of the matter and stop fighting do HUGS NOT DRUGS "@Derek Main You are lying though thumb up for mhlongo @Buyani Mhlongo I refuse to keep quiet when anyone sings Trump's praises. @Buyani Mhlongo About what? @Danie Nilsen I understand @Derek Main MAGA MAGA MAGA 
1:07:09,1:08:12, DOES ANYONE REALLY TRUST THEIR GOVERNMENT??? @Derek Main CIA is not the one that killed ISIS leader. "he wants said ""i want to make America great again""" @Buyani Mhlongo Where did I say that? I DON'T chair i need protection from the live chat @Derek Main. I've heard enough of your crap. I'm muting you @Simon Davies Great! THIS GUY HAS THE BEST VOICE 
1:08:39,1:10:27, Be nice to each other people. Peace. Love and Happiness SOUNDS SO MUCH LIKE BATRY WHITE Mikey!!!!!? Hello @Pastor J. I wondered if you were watching today. @Buyani Mhlongo Then who was it? The CIA obtained and confirmed the info (from the kurds and Turkey) then the Military carried out the operation. Trump wasn't even invited to watch in the control room YRS? @Pastor J trying to be but sometimes some people make it difficult ACCOUNTABILITY. CONTENTS KINDA SLOW BUT STILL ENTERTAINMENT 
1:10:30,1:12:01, @Anne M. I am always here My Dearest Friend Anne. I will miss you all too much otherwise. @Thando Nkutha Exactly - Trump is KKK. @Danie Nilsen Sometimes people lose the plot and become angry and intolerant of people they never ever met in their lives. That bad stuff brother mikey smelling blood DIDNT HE BLOW HIMSELF UP WILL YOU ATTEND THE 2020 TOKYO LEUKEMIA GAMES ? somma call tea "last week Russia said they development plan for Africa @Hamza read the news he was in the ops room and saw most of it and prepared the speech for the nation america is an inspiring nation and run by mostly competant people repuklicans 
1:12:02,1:14:37, Advocate Kate Hofmeyer is a brilliant lawyer. I CAN'T SMELL ANYTHING. I HAVE A COLD 😆 Adv Vae is coughing on the mic. @Danie Nilsen Trump was seen out playing gold at 3:30. Bagdadi was killed at 3. How was he middway through a golf game and in the control room at the same time???? @Hamza ask him MAYBE @Danie Nilsen Theres also tons of evidence to suggest that the picture of him in the control room was staged. The ethernet cables aren't even plugged in. @dANE @Hamza You're wasting your time - that's like trying to get the truth out of Trump. 
1:15:03,1:19:01, @Danie Nilsen You're the same as Zuma supporters who defend him even when all the evidence shows otherwise. Exactly the same. This just shows the idiocy has no race. @Hamza Yes - America have their own Zuma to deal with. I THONK TJAT APPLIES TO MOSTLY ALL PRESIDENTS @i am ocupied with the witnes so please chat to the rest on the chat about your hate for trump WHY HATE ANYONE? WHAT DOES IT SOLVE?? "Even the evasion tactics employed by trump are similar to Zuma's. The 'Whataboutism' THATS YOUR OPINION WHAT POLITICIAN DOESN'T DODGE THE TOTAL TRUTH 
1:19:22,1:22:13, That was supposed to be trumps entire MO I SEE MYSELF IN THE MIRROR 😆 @Thando Nkutha in a country that have more jobs than people to fill it made possable by republican gov compare it to us and the frogman "@Mikey Likesit What president has made over 13 Teabreak I'll have 2 sugars please. Thank you Exactly like Zuma supporters Same whatsapp group Why call him a racist when there are so many other things you can call trump out on that have been proven? @Mikey Likesit and all of them should be considered as bad presidents shpul 
1:23:19,1:27:29, WHEM YOU SAY HE...ARE YOU REFERRING TO ME?? that he doe not take his salary and does not make distinction about his countryma all in america is americans @Mikey Likesit I think he's referring to Trump. Did you guys know that Trumps dad financially supported the KKK and was actually arrested at one of their rallies? yeah he smoked too much weed that day 😃 or MAYBE NOY ENOUGH. LOL Trump victory 2020 "lol "Oh i guess we can just say that the Guptas and Zuma are innocent of corruption I doubt trump will even win the republican nomination 
1:27:47,1:28:50, Trump has guts and is able to take on the crooked establishment. MAYBE MAYBE NOT @Born free Trump is the establishment. oom witness maak net jou bek oop en judge jy kan ook maar @Born free 🤣 You've bought the BS hook-line-and-sinker. No doubt Trump will be victorious in 2020 His head of education supports cuts to public schools. Trump won't even get the nomination from his party. @Born free some intelegent people here 
1:29:09,1:31:01, HE HAS A SLIGHT LEAD? @Born free i agree with you Are you even following the impeachment proceedings? His own party is turning away from him because they can't disagree with the facts. You have no idea about American politics and the reptilian demonicrats How can you oppose Zuma and support Trump? - they are the same. YEAY...BARRY IS BACK... Derek there is no comparison and you know it. Zikhiphani la "@Born free Yes i do. My opinion is that they democrats are corrupt clowns. However 
1:31:18,1:33:34, Trump is winning Republicans are the silent majority as they were in 2016. "@Born free If I didn't think there was ZUMA IS A SMART MAN...LAUGHING ALL THE WAY TO THE BANK L0L """silent" Republicans didn't even win the majority vote in 2016??? They received less votes than Democrats. They won due to the undemocratic electorate college. You obviously don't know the facts of what you are speaking about. .MR ZONDO HAS THE SMOOTHEST VOICE ON EARTH They weren't even the majority in 2016 and that number has extremely declined since 2016. The Demonicrats are unbelievably crooked and this Investigation will turn on their heads and expose their Quid Quo Pro in 2016. QUESTUS QUIDEM.. Trump will get them and expose them . 
1:33:47,1:35:26, Lol you speak like trump Rubbish what rot Saying nothing with big words @Born free Have you got small hands? 🤣 WHAT POLITICIAN ISN'T AT LEAST A LITTLE CORRUPT ? Hamza ​Republicans didn't even win the majority vote in 2016??? They received less votes than Democrats. They won due to the undemocratic electorate college. And more didn't even vote!!! Watch some real news CNN are paid to spread the false narrative @Born free i hpe bill barr will open up a can of worms when his investigation comes out @Mikey Likesit All politicians are corrupt but Trump and Zuma have perfected it. 
1:36:01,1:38:17, CAN OF GUMMY WORMS ARE 😋 """Donald Trump - you're fired!"" 🤣" @Born free and Fox?? They are imparital? The same Fox that supported Bush when he lied about Iraq having weapons of mass destruction? (He has admitted this so don't try and deny it) HE ABSOLUTELY LIED Bill Barr has appointed Durham and he is investigating these matters. The Demonicrats are terrified of the truth and are desperately trying to impeach Trump so they can stop his investigation in 2016 Mikey i would imagine a dead one The same fox which Trumps ex press secretary works? Do you not see the conflict of interest / break of the seperation of powers? YUP. YOU ARE CORRECT... DEAD MAN TELL NO LIES Do you not see how that is similar if not worse than Zuma and ANN7? 
1:38:47,1:40:47, No there is no comparison at all. @Born free i do not think the demonratz will sucseed big mistake was to take the impeacment to closed doors and americans do not like it because it is not an clasified enquiry WORSE IS AN OPINION... MAYBE WORSE. MAYBE NOT Gigabite again I'm sorry but then you are an idiot. I guarantee you Zuma will say the exact same thing when on the stand about him and ANN7. "@Hamza @Born free ...May I ask RESPECTFULLY that we focus on SA and particularly the Inquiry. We are on the chat and we are being subjected to Trump @Hamza None so blind as those who do not want to see. @Pastor J Thats fair. @Pastor J i ahve my ears on the case and you are wright this is about our country and goverment 
1:40:57,1:43:37, I MISS MR AGGRESI? is this south African state capture commission or trumps impeachment discussion forum Derek.. you will see in 2020 @Hamza Thank you kindly. I appreciate and respect your kindness. MAYBE BOTH ? @Born free I said all I have to say on that subject. You are dissapointed in Trump because he refuses to give handouts to corrupt governments PLZZZvolume or just talk in to the mikes "We should put this country First and not Mozambique 
1:43:41,1:47:59, THE GUY FROM YESTERDAY WAS MORE INTERESTING Gijaba video was so disgusting IS ESKOM MORE OF A CHARITY THAN A MONEY MAKING BUSINESS. ? I just arrived. wazzup? LOADSHED AND STEAL EISHKOM WASS UP.... THE SKY ? "Mikey @Pastor J HOW IS THE VOLUME ON YOUR SIDE I AM SOME WHAT DEAF AND THAT IS BAD sorry for caps 😎... 
1:48:03,1:52:38, Yes Eskom is a charitable organization it also supplies Mozambique and Zimbabwe sound is low SABC COME RIGHT PUT UP VOLUME WE HAVE CONTROL OVER IT TO LOWER IT pls @SABC Digital News Please check sound settings. Some of us are old brothers but also it is a boring day for us sofar BORING MORNING @Danie Nilsen This week is going to be fireworks. Mozambique and Zimbabwe likely pay for it where as alot of our people dont "Pastor J 
1:52:38,1:56:38, @Pastor J i hope so not to play the blame game or make narscitic remarks just the truth no matter who it was HLAUDI!!! Tell the brothers about the sound equipment please man @Kapn Krunch i hope zim pay in us dollars who are the customers that have all the spaghetti wires hooked up to the pole @Derrick saperstein Your help is always appreciated brother. We need to sort out these Eskom buggers kwik kwik "@Danie Nilsen We must demand subpoanea for Brian Molefe today we have somebody who makes too much sense our circus closed yesterday "@Kapn Krunch Considering the close relationship between the ANC and ZANU-PF @Pastor J i could not agree more and sooner than later 
1:56:50,1:58:44, Can't hear this @SABC come now I FEEL BAD FOR THE ZIM PEOPLE "Mikey @Danie Nilsen Sorry. I forgot the biggest skelms. Lynne Brown. Malusi Gigabytes etc @Mikey Likesit Me too - they have suffered too much with no end in sight. YOU ARE CORRECT i also feel sorry for them but who brought it upon them was it not like here the same thing where you put your vote ZIM GOVT DESTROYED THAT BEAUTIFUL PLACE """CLOSE THE DEAL""......." 
1:58:48,2:01:31, "@Heather Cotton Of course @Pastor J watsons ace malema WHY DO PEOPLE TRASH THE PEOPLE INSTEAD OF THE CROOKS IN THE GOVERNMENT... @Danie Nilsen Partially but the elections have been stolen a few times already. Definitely not free and fair despite what our government said. 👍👍👍 @Mikey Likesit They created their own problems "Not free and fair THE ELECTION WERE RIGGED FOR THE LAST 39 YEARS CREATED THEIR OWN PROBLEMS?? 
2:01:34,2:03:58, Elections rigged since end WW2 I THINK NOT @Derek Main we need a new dispensation like a federal state with fewer parties smaller governance and real acountabilaty and we should name the presidant candidate names so i do not vote for a NEC Zim people most patient in world YES... THEY STARTEF OUT STRONG BUT DEVOLVED INTO INSANITY Yes Danie No Thando. Mzwandile Radebe The essence of rational thinking in broader terms in matters of nation building WHY DID THE CROCODILE GIVE GUCCI GRACE THE BLUE ROOF MANSION??? 
2:04:22,2:07:59, "WHEN IS THE PRIVATE sector coming to confessions lol there is a lot HAIL MARY "Mikey stop shouting boet which minister are talking about TNA and SABC same pie Mphoko when is this going to end.when they all skip the country "With this snail pace YUP...they all have Swiss accounts and mansions in Dubai There was a lot of slab angering in advertising here hey? 
2:08:50,2:11:50, skebengering... how do you spell skebanga? IS it a nice day to swim in zuma's FIRE pool ? @Khaya Nomoyi they have a timeline and a budget the rest will be water under the bridge i think skebengha ? @Thanda Nyezi ty "Ah "@Danie Nielson DOES ANYONE know why Gucci grace was just Given the Blue Roof Mansion??? @Person of interest must have it lol 
2:11:51,2:14:19, how money did this guptas still from this country between the three of them the oral evidence should end around July next year as per Mr zondo .it will be another 6 months after that before some will be criminaly charged "Danie yes blue roof was bought under the name of Zanupf then when Mugabe died they are transferring it to her @Khaya Nomoyi hopefully they get it the commision is doing ground braking stuf for futere generations to make south africa great again "Ah I know THAT...my question is WHY thando thanks "Guptas target is only government to do business no other business Tjooo 
2:14:44,2:18:15, dee dee we have something to look forward to thrn i call it legspreading please do not ask what that means then Daniel what does that mean or cam I guess "Mikey @Danie Nilsen They use only four hours of their time per day. @Elvis Malakoane plz geus lol Yes as Mr zondo said he wants to make sure that those implicated have no place t menouver . so jail time . what a man he is .zondo for prez "Danie 
2:18:19,2:21:12, Gucci grace has too much knowledge in the pilfering of public assets from het husband and the crocodile please. sounds "ZONDO ROCKS. sorry Mikey corruption is in every country... the great usa as WELL @Person of interest i do agree with you but it seems it is more in the private sector and between countries "He was accused of being at the door of transformation from Eskom because he was questioning these programs DON'T be sorry...i can't see the tiny letters Mike likesit But south Africa is not capable of taking such big knock due to corruption "Was their BAcon at this breakfast 
2:21:27,2:23:44, breakfast... yummy... I'm in the mood now for McDonald's big breakfast 😆 Volume pleeeeeaaaase. Pap n vleis 1million for amabele. smileys would be great as everyone is smiling when did they care about spending taxpayers money??? 😊😊😊 @ Thando Nkutha I don’t understand why are treating Zuma and his son with kit gloves we must shoot them to death. Duduzane was not businessman b4 only when his father became president Are any of these African diplomats discussing anything about the genocide of white farmers in South Africa? 
2:23:45,2:25:40, @Pilot_Eyes Wiggett nou praat jy breakfast that expensive in SA? R1m wow🙄🌍 @Long Tall NO cause no such nonsense is happening in SA Listen to the skebengharing here!!!!! Breakfasts!!!! Mike likesit they really care they keep us in the dark and feed us rubbish 1million for amabele or oats. hippo eyes says. No white farmers have been killed...he said that with a straight FACE... what a lier Sure it isn’t Onie he said 7 million i think 
2:25:49,2:27:50, "Long Tall @Person of interest tell him/her @Long Tall that is very out place the socalled genocide is as phony as as the WMC an agenda driven by certian people who are profitting from it like the Zuidlanders if you ask about farm murders yes "Considering you lack the ability to even spell the word correctly no genocide is different than ZERO being killed... do you AGREE? lol your concern is spelling 🙄 You are a joke so if breakfast costs R1m how much does a buffet cost??? anyone know??👋 "Onie "@ Thando Nkutha exactly here for instance there those who glorify Zuma what he did 
2:27:52,2:30:58, "😂😂😂😂 IS MUGABE A Hero? @Long Tall I am not interested "This is the part of the conversation where you start playing the victim Onie no mugabe is dead @Long Tall victim of what?? Mikey he is not a hero to me "Long Tall @Goat ! hi goat how are you 
2:31:36,2:34:34, @Mikey Likes It It complicated to say he is a hero or not. Personally he not my hero. Is goat your name or surname? @ Thando Nkutha I think we need to fight for this. We were almost blinded by those whom implicated in various corruption saying Ramaphosa was not the right person to rule the country bt poor man is "I think I will block long Tall Trying upload More what if ia a name You never know since when was saving a concern of any soe Mr Prestorius is Somizi-ish. 
2:35:12,2:37:27, "POI trump 2020 how much is one million RAND if only i can hear him That’s my favorite part of the fantasy you’re telling @Mikey Likesit quite a lot should keep you comfy for a year i think "I'm so surprised that many of you are not listening to Pretorius's evidence for one breakfast? correct Paul 
2:37:38,2:39:28, "True Paul. sound v low "Thando Nkutha @Paul Buchel we do not have supersinic ears like you so we chat if we can not hear "America and Britain watch these proceedings every day "@Thando Nkutha  Paul Buchel who told you we are not listening? Are you not the one who is kaking? SUPERSONIC SORRY @Long Tall Thank you has Anyone gone to prison who were implicated? 
2:39:49,2:41:58, The I and the o are rather close on a keyboard. That’s a typo and not a misspelling Those are different Who knew I’d have to hold English class for all of you? not me... "@Danie Nilsen no only a concrete pillar and some 9 mm bullets long tall what a u all about @Paul Buchel i am on headphones does not help Was that cereal called “Kix”? 
2:42:17,2:43:18, who was the guy murdered going to the airport? watson Gavin Watson Watson more like cuicide to me nje Was he murdered Mikey? coincidence? Keep trying Danie 
2:43:35,2:45:17, or murdered yes he was cutting long story short "i say this because he was anc and had a lot of HAIL MARY what happened with watson guys..this accident story i realy dnt buy it I DON'T know...i wasn't there "Danie "Hey POI "Mikey "At least no one but me 
2:45:59,2:48:01, he accidentally suicide himself like the pervert in New York??? Exactly Mikey So when are you and Danie holding your soggy biscuit tournament POI? Peter Ndoro must come and testify. He was the host of these breakfast shows. "Yes Long Tall there might have been a spray bottle of a certian poisen used by russians in a ride by method if the windo was open You never know WINDOW sorry teacher maybe Mr Watson was going to implicate too many powerful people. ??? 
2:48:39,2:51:47, mr watson was not agrizzi made certian of that but Gavin was living double life as well Will Mr agrizzi be next? mr Watson lived a corrupted live period agrizzi is more awake than Gavin but a smart crook Watson is roaming around the streets of Dubai. a smart crook never admits he is a crook ask zuma who got that Louis vaton hand bag? Dudu Myeni 
2:51:47,2:53:44, grace ace magashule that's a nice gift lol he got a lot of dead cows This is by far a most trustworthy witness. "mandela's long walk to freedom ja Daniel! yes We hope so.. Martin 
