starttime, endtime,message
5:08:01,5:09:46, THERE IS MONEY IN THE ASBESTOS BUSINESS viva anc viva we will rule this country until cows come home yes """yes im sure""" OH SORRY THERE IS NO MONEY ANYMORE THEY LOOTED IT ALL @Inspiration Afri ......Let me explain.......When u get an education.....and you WORK hard.......you earn money.....then you can live etc....and perhaps buy nice things...etc WENA FUZILE UZOKHALA FUZILE DONT COME WITH YOUR ANC MENTALITY HERE Question. Have all the asbestos roofs in Soweto been replaced. I did electric house installation back in 1972. The roof tops were asbestos.? 
5:09:50,5:13:22, thats not capitalism "@Inspiration Afri Capitalism definition -""an ECONOMIC and political system in which a country's trade and industry are controlled by private owners for profit 15 august the liquor ban will be lifted Zakhele you will never live without ANC people in a country where the ANC governs with 57% vote. "who is private""" Anybody who is not in government. @Inspiration Afri ......let me explain again etc.....Money rules the world.........it is a fact....that's the way it is........no one can change it......that's it... THAT 57% WILL BE2% COME NEXT ELECTION money is not capitalism 
5:13:39,5:16:19, Where has that ever happened in the world in a space of 5 years? MZALWANE THE ANC WILL MAKE HISTORY WATCH THE SPACE @Inspiration Afri At last I can agree with you - money is not capitalism. How far can YOU stretch R350 in a month??? ask yourself that after you buy a bottle of whisky lol @Inspiration Afri ....Ok Bra.......u can think whatever u like .....ok.......free world Bra... Zakhele I gather that you are not a social scientist and believe that wishes control social outcomes. Anc will rule untill Jesus comes back again... #FutsekANC South Africans are firing from all cylinders.. we are tired of being abused.. Twitter is on steroid. 
5:16:24,5:19:07, @Sidney P Jesus already came back but nobody noticed. I was waiting for that #voetsekANC 🤣🤣🤣🤣🤣 @Dominic Go Hollywood... you have great imagination... Other way around - Capitalism can lead to money. @Nerissa people are gatvol. @Dominic Przybylski 😀😀 @Dominic Przybylski ....Mmmm.....ok...same difference.....heheh yes I'm with you on this we are way passed gatvol Before accepting why did you not make an arial count to see if it was feasible? 
5:19:36,5:22:39, Gatvol is a group in Western Cape @mzalwane 🤣🤣🤣🤣🤣🤣 What about Google maps mxm mzalwane Am I wrong? "at lunch time kwazi wena mzala There is a group called Gatvol and it wants to drive other people out of the Western Cape. Are you part of them? 8 
5:23:52,5:56:15, @Inspiration Afri ....Capitalism is an socio economic system based on private ownership of resources or capital............Money...Money...Money.... "Sidney fortnite has cars @Inspiration Afri ......Remember Bra's.....We don't want Commies/Socialists running OUR Country........ @Mzalwane Mzala ...Maybe they right.......they wanna get rid of the Commies and Socialists there etc etc we are about to be Zimbabweans in five years to come # watch this space imagine you are wanted in zondo commission and still you are part of suspect to PPE AND NO ARREST What time will they be resuming ? the late partner took the blame. 
5:57:14,6:03:48, Playing ignorant and blaming the dead guy did he already explain about the R600K on booze? """HOW DID THE ' PARTNER IN CRIME ' LOSE HIS LIFE??" this guy in snitching 😂 He was gunned down@joshua Convenient Dangerous work this asbestos business... indeed """ @ OREATLILE MOSIANE - THANK U 
6:04:43,6:20:32, All caps usually gets deleted Honest according to Myburg in his book gangster state this guys partner did no share the last 30 m with this guy. This guy threatned his partner. He was shot dead in his Aston Martin in Santon Bentley not Aston Martin I believe it was a Bentley @Eddie Reddy deadman tell no tales Is this the guy who paid 600 000? thanks for the correction The late dude bought 2million house cash next to N1 
6:20:37,6:32:31, let's hope that the stenographers are doing a better job than the subtitles smooth talker these guys with these nice ties and fly English grammar ADV.P got him by...........the bold head Oh........all schooled inside the Commie ANC university......... I agree @Carmen Ray Anderson they should also record in court....hopefully yes @knix fergus Looks like all these people belong to the ANC Theft Club.........very Elite club that....you have to have Connections to belong etc etc...... INJUSTICE IS BABYLON SYSTEM 
6:33:13,6:40:47, This guy can afford expensive legal counsel and will hire the best if it goes to court. Anf you can't just join the Club.......you gotto have the Right Stuff........ these guys have a network that goes to NEC of ANC and the main guy AM "@MIKE DURBAN  Heheheheh Yes Ace Ace and his pals are making it difficult for Ramaposa to make progress Hheheh......They change the chairpersons post every now and again ...to confuse all the normal members etc...... "NB....There are also ""Elite Members""......heheh" 
6:41:49,6:46:05, Ace and his band of thieves are watching at the moment munching steak sandwiches enjoying imported champagne laughing at this toothless commission as they count their I’ll gotten gains *in Reckon the Commie ANC are masters at brainwashing da peoples...etc etc.... "@MIKE DURBAN  Its friday evening and i cant stand serious news on a Friday evening "@Mike Clark  @Sidney P ...Don't worry Bra...it's Puza time.....cheers..... Act very dumb when this wants to "they create fear in the masses by stating if DA comes to power 
6:46:23,6:49:19, Castle...or Jack......is just fine... Cheers Bra's... @MIKE DURBAN No You must be arrested... where do you get booze during lockdown😂😂🤔🤔🤔 At eddy the masses are uneducated . They get promised all sorts with a R 5 Chinese skipper and a cap And a Mutton Curry Bunny would go down well also..... @Mike a double on the rocks of jack😋 MIKE DURBAN Pizza Friday for me by the looks of things We have ways and means to beat the ANC system.....hehehehe I see the lockdown has ended in Durban 😂 
6:49:46,6:52:42, @Sidney P ....Oh yes...nothing wrong with that.... DA is anc's biggest competition and I think those who realise this make DA to be anti-african i.e pro-aparthied. They think whatever opposes anc must be racist. When will they see the deception.. This anc must be flipping stupid to believe that the all the lockdown regulations are going to be carried out by all @TheTruthShall SetYouFree are you white? How many empty promises Zuma gave?? So many people wore t shirts with his face on it and yet we find that he is a treacherous thief. Even after Zuma people still support anc...BRAINWASHED! This oke acts stupid @Mike learned from the commies ANC. I say......its a free country........nothing will stop us to do whatever you choose to do.........legally of course...heheheheh Pioneer🤣🤣🤣 
6:52:48,6:55:16, @Mike You are breaking the law and yet you criticise Corruption... 🤔🤔😂😂 everybody wants to be the man until its time to man uo mlu We are born free....and we will die free.......true ne MIKE DURBAN Only Covid19 can talk to you and yiu listen. Yiu compromise your Immune system. "Someone here is getting offended. Are you aware that if you try to be a righteous leader there is a high chance you will get killed? Recently a Saudi ""prince"" ordered a hitman squad to kill a guy" how can you be free if you live in poverty? He knows his work atleast Heheheheh.....we gotta do.....what we gotta do.....heheheh 
6:55:48,6:59:49, So company with no financial muscle must not get work Cheers guys Im struggling to even follow whats happening with this guy boom One righteous person can send out the messages of truth but its all the civilians that have to put in effort. how can you be free when the constitution says that South Africa belongs to All that live in it... But in a practical sense it isnt so. @Derrick Paul .......We are at least free .....for now.....we are not like China........yet......... Projects comes with risks these lawyers must know that "Alot of people dont see the hardcore nature of many politicians because people are too busy being brainwashed by pop culture media are we really free? Dose race not allow things to some and not to others? 
7:00:06,7:02:35, ...Derrick Paul...poverty is in the mind ..get free in the mind and you will be able to make money ask the Somalis so what this man is saying is that its not his problem the state is incompetent @Makhosini government can use performance guarantees Fix your priorities poverty is a real life situation.. its not a fantasy The end of the age is closer than we think “Take it easy next time with your questions” 😂😂 In agrement @Sal SA When does commission continue? 
7:02:48,7:05:36, Repent your sins. Love. @Derrick Paul .....True....well at least we can do just about anything without Big Bra coming after you...aka..China... yes if you accept and embrace it...but you can be liberated from it if you start with yourself...dont wait fro gov to do things for you....criticism will get you now where I'm trying to make people aware @ Makhosini Cool brother But they treat politicians like celebrities and treat celebrities like gods There is only one Lord. @TheTruthShall SetYouFree ....Well said.......it is very true You best recognize the creations of The Lord and recognize the beauty and majesty of The Lord's glory. People are destroying many wonderful creations. So much to learn even for me.. 