starttime, endtime,message
time,30:06,message now you will hear the truth so the Zondo commission is still on. True Molato gao boli so the Zondo commission is still on. True Molato gao boli "did I hear correctly ??? Remember according to Ace Magashule there is nothing wrong to do business with the government while you're a leader or official of the state 😉 Duduzane became a Billionaire while his father was in office through government tenders via the Guptas. This country is not going to heal anytime soon. Pricing is like the cost of a new car - How much will the suckers pay? never mind cost plus margin 
30:19,46:21, سلام اینجا کجاست؟ :washhands: :yougotthis::socialdist::yougotthis::socialdist::oops::yougotthis::learning:‐ when dis people ar going to be arrested coz the evidence is thr فارسی بلد نیستید touched the files on their studio? howsbthe weather? freedom for Kashmir i am confused to politics of here. according to school and tv we are somewhat civil. 
46:59,1:16:43, trying to convince me i am deaf dumb and blind. seemed very real. how come no other hairy multiple legged monsters are around need support group SO THIS HAS TURNED INTO A RADIOSTATION my LASIZWE voice: my eyes are not deaf "morning guys evening guys "@Kgotso Mpete he is my brother "@Abel Matshediso :yt:Hi fellow South Africans. us this guy making sense or there's something missing🤔 
1:19:31,1:30:03, The current presenter and the expert earlier in the week is the same but differ with the approach to do assessment. Mr Manyike What happens here is that corrupt people worked with those knows the job so that they can beef up their corrupt activities and succeed in their looting. what has this verbiage garbage got to do to bring the anc criminals and guptas to book? :washhands::washhands: Explain we are listening. some body is going to take his watch when he gets outside 😁 its too much aced 
1:30:08,1:31:42, 🤔🤔🤔🤔 :elbowcough: @Heinz definitely his employees that never get paid s ur right :socialdist: what? anyone? yyaaa yyaa correct an engineer... but you said grade 10 hahaha really 
1:31:49,1:35:01, more like running out of lies! true David mm Nice Rolex body language its going away if he swallows any more out of guilt he will be swallowing the mic mmh nobody wears a watch anymore 
1:35:18,1:37:57, yyaa its going... yah thats correct 33 Mill PROFIT on 44 Mill quote! WOW!!! @brian - it needs to be shared to all the cadres 15mill profit 🤣🤣 I just want only one contract then I can go back to my daily hustle Can I get a JOB like that ? Nope. He said 33 Mill and expense +_ 10 mill 
1:38:20,1:40:47, R15M is more than enough for me chair. "It is clear here that the Mr Manyike knows the work "I wish the president appointed Advocate Thuli Mandonsela to chair the inquiry into the covid19 investigation rather RONALD LAMOLA "Show us the balance sheets He said his own profit was R15mill and he didn't even cringe? "@andrew - totally agree "we cant have ANC investigating ANC it is truelly like throwing a pig into a mud pit expecting it to be clean  u are right Andrew Mboweni. Thulie Madonsela would have acted without fear or favor I want to be the middle man! 
1:40:56,1:45:07, I agree with you Andrew Yoh this guy is about to spill the beans on Mastertrade "if cyril ramaphosa is serious about corruption people of south africa are watching and time will tell if there was a change in governance  There goes Mastertrade - thrown under the bus TN u the reason most of people work in sandton it is because since 1994 the ANC Produced businessman are self feeding themselves while hard working white south african are helping us more the ANC "'Social Facilitator"" this role is very interesting chair" A Social Facilitator = JZ's boeta "@Andrew not for ""Gomora"" only the entire Country." 
1:46:20,1:49:09, yhoo now social facilitation is about taking of politics. 🤔🤔 "Where can I apply for being a ""Social Facilitator"" to make up to R15M profit" "Most of south african citizens have their trust on our white fellow citizens they are very helpful and caring than the ANC led government  and he says Eey🤣🤣🤣🤣 I died 🤣🤣🤣 Social facilitator is nonsense created by government people to benefit from tenders nothing else. Stop scoring own goals Mr... "This man is too honest cartels "south africans must wake up now and be serious about leaders who steals from 1994 to 2020 this is a shame on the poor  
1:49:16,1:51:18, I'm afraid he will never gets any tenders from government hi Mr Zondo doing his great job but no actions has been taken so far. I found these Manyike is shifting a blame to other we need to arrest them all whether is defending himself or not High level social facilitator?? His honesty is needed as we know lot of people who are connected they benefit like that through these tenders. Social facilitator! "he does not need to work any more now is the time ANC LEADERS will face ANC members as it was quoted by former president Thabo Mbeki there are so many thieves stealing each an everyday he was paid. a lot of money just to facilitate lol 
1:52:22,1:56:35, "we need a new party and a new government  "I love this witness he's lying it the way it was The man is consuming water like a fish This guy is very honest vote eff vote eff drinking so much water - will be needing many comfort breaks later today no tea and lunch we want to concentrate other cases All part of the delay-plan Martin. Also it's free? 
1:56:53,2:15:04, "ı wanna be a ""Social Facilitator"" when I grow up" "R850 Ali you should aim a bite higher. There are senior social facilitators "The sad thing about this comm is it's reaching close to a billion rand now in costs.Even if the perpetrators go to ""JAIL"" the billions that have been stolen will not be recovered." "300 000 × R850 The Commie ANC can Fool most of the people all of the time ........But not fool some of the people all of the time.......or something like that....heheh you can fool most of the peoples all the times but you cant fool some all the times well said @MIKE DURBAN "You can fool some of the people some of the time And stealing continues 
2:15:35,2:22:15, @RICHARD PEFFER ...spot on.......the other version is for the Commie ANC.......heheh Who this guys cracks are showing...... Eeeeesh.....they built on a Ganja plantation....... "Martin Wipe the sweat "can i ask a question what is cyril ramaphosa like from a close look those who worked with him in businesses shanduka + 13 mm Scamdemic Fauxvid19 
2:23:12,2:28:44, Corona virus fraud "True......it affects the ""money"" area of the brain.......heheh" You aren't exposing pedophiles or health scams. Keep blaming "This clown is who should use a mask Can't cover mouth while coughing on mic with facemask on chin @Ralph Malph ....you start seeing money with little wings floating around......heheh heheheh @Ralph Malph some for me please:elbowcough: 
2:30:02,2:35:40, @g k Cheers!! Lunch everyone! @g k ....Heheh.......only the Commie ANC Bra's receive the floating dollars....... "Look at these fools in their masks 🤙 this guy is smoking his socks. they should ask a proper architectural professional what an assessment like this would cost! "Masks make men docile in the face of social injustice and poisoned by excessive co2 @Ralph Malph. In the UK you get dirty looks if you don't mask-up! Such a stifling country! 
2:39:51,3:38:26, This witness has integrity That's true Sekgololo...a man of integrity. We need more of such calibre. what time are they back 2 ENCA =EANC DA = Demonic Alliance Bring an end to the anc Ok let's go He's looking nervous 
3:42:43,3:55:20, "💣 I can feel it coming in the air for the ""man"" who had R6 hundred thousand debt of liquor" "agreed Gavin ANC = A NATION CAPTURED Hardly started but has to explain himself already. Edwin o mo ntšeng No experience of removing esbestos So there were 2 bids?? 1 for audit and 1 for eradication???🤔🤔🤔 I am not following... who's the witness 
3:55:44,3:58:05, Mr Sodi WHAT ARE U DOING AS A MIDDLE MAN AND U TAKE THE FAT CUT is he the 600000R booze drinker lol Appoint another contractor and he claims a referral fee of R10 million for doing nothing. "@Owen thank u OWNER OF BLACKHEALTH CONSULTANT It seems Mr. Sodi did not ultimately the subcontractor of the subcontractor who did the actual work 🤷🙈 The ONE depo oh I see thank u 
3:58:14,4:00:17, "these cheesekop guys of today are crooks which happen not to be that bright The one deposit R60000000 to smd in ballito so Mr Sodi was the main contractor or subcontractor of a subcontractor??? It seems Mr. Sodi did not pay the subcontractor of the subcontractor who did the actual work 🤷🙈 Blackhead Consulting Main contractor Taks Tshetlo 600 000 @ Owen Nyika... Because of his buddies in government 
4:01:05,4:03:14, Wow that timepiece. Waffle waffle waffle This tender not advertised for all companies to bid This thing of consultants doing work they’re not qualified to do is quite rife. It’s nothing new You are a bs It is a get Rich Quick Scheme to do nothing. "this crooks got money course they steal from the poor The man conceded ...end of story Anc = African national corruption 
4:03:17,4:05:21, "this guys accent is annoying me 'you know Misrepresentation on steroids. Yes smile you are are crooked Africa's National Corruptors they got him here "See article in news24 today - ""Nicole Fritz | We have become used to the ANC's cruelty""" THOSE COMPANIES MUST BE FROM MARS lol this one is admitting just like Mr Zulu African national concoction 
4:05:29,4:07:45, Mr Sodi is admitting to falsely bidding for work his company has no competencies in.. some much money spent..... arrests none WHICH NEED A THIRD PARTY TO FIND There will be no arrests They all in the same boat All flipping corrupt Government don’t have a challenge when it comes to stealing Corruption is all i smell here. 3 companies? Hayikhona! 
4:07:54,4:09:15, All these PHASE One-PHASE Two are just corruption lingo. No absolutely 🤣 As long as anc is in charge this country will always have it's public resources stolen. he is looking for excuses @TheTruthShall SetYouFree u said it WHY IS CORRUPTION CALLED STATE CAPTURE? because there will be no arrest Why aren't these cronies being charged for false information. crooked to the core Mr. Sodi is looking for Harry Houdini 
4:09:20,4:11:19, Wed key words= assume & context come to think of it these guys are Magashules advisors Are the black south Africans enjoying working in countries where doesn't exist B BBEE? SAPS should now be walking to Mr. Sodi and serving him with an arrest warrant. From his expensive suit he shud sleep later with some Orange overall. Ace Magashule footprints are bare for everyone to see 🙈🤷😂😅 WHY IS CORRUPTION CALLED STATE CAPTURE? because there will be no arrest PEDRO P YES WE R HAPPY WHERE WE ARE lol the word 'azzume' is tje key word of the week land was stolen too 
4:11:33,4:13:28, We must admit that we have failed to govern. This is so embarrassing. People talk about WMC when we are actually this selfish as blacks. "Yes Just wait until SA had to pay all the loans. SA will be another ZIM """i see that chair""..no more energy now. Concession speech to follow" Each person wants to accumulate as much wealth as he can for himself and family. We are not going anywhere as a country name a place in the world where caucasians are the natives? How can government allow the seizing of farmland without compensation? CORRUPTION! THIS IS WHY ALL PROFFESSIONALS R LEAVING SA BECAUSE OF THIS Caucasians are from Europe 
4:13:36,4:14:32, "This guy looks like he's 35 Afri... all Europe INCOMPETENT PPL AR OCCUPYING POSITIONS BECAUSE THE HAVE CONNECTIONS Blame game... "they bought nice rolex watches with our tax monies Late partner all the stories the lates cannot talk He is now taking cover about the late partner 🙈 "historically incorrect @Thabo Mokoaleli imagine the indignity 
4:14:35,4:16:09, Another witness in the grave They will answer for their crimes after the body dies and they are in the JUDGEMENT! @Thabo Mokoaleli The whole country is waiting for Ace Magashule to make his appearance at this commission. Ace the thug must go to jail as per Mr. Mxolisi Dukwana. blame it on the dead you can see this just a lie what this guy is saying Easy to pass blame to the dead "Follow up on the partner HOW DO U GET THE CONTRACT TO DO THE JOB IF U CANT DO THE JOB Guys! being corrupt is actually reasonable. Don't u think? 
4:16:29,4:17:13, Assets Forfeiture Unit should be ready to act on this man immediately and get back the millions stolen from taxpayers kitty. Vengeance belongs to The Lord. These criminals will receive the appropriate consequences for their actions. THE PPL R GIVEN TENDERS WHERE THEY KNOW NOTHING OF AND THEY OUTSOURCE IT "Rather than discussing what we all know  "Adv Pretorious is the player of the week for me partner and yet not party to discussions??? Being corrupt is more than reasonable if there is no accountability. """i was never involved""" Liquidation is the route 
4:17:43,4:18:52, Such a big contract and he knows nothing? doritos 3d It didn't take long for Adv P to crack Mr Sodi The worst people are those who made sure there is no accountability - Zuma and Ramaphosa come to mind. In RSA if you want BIG Money be INCOMPETENT Only corpse are corrupt in the ANC😱🤣 The is no doubt that Mxolise Dukwana was spot on 👌in all material times. Besides Mxolise knew the shenanigans of Ace. Ramaphosa is Ramapoes And belong to cANCer 
4:18:52,4:21:17, Ace must account. he was in charge The cracks on Mr Sodi's testimony are more than 3mm....🙈 cyril ramaPOESa ANC JUST ALLOW US TO ALL STEAL TO EAT EDUCATION WAS NEVER A KEY TO SUCCESS Blame Igo Mpambani boss. THE LEVEL OF INCOMPETENCE IS REALLY DISGUSTING @anwar am is the main guy. They must deal with him LOOK AT SAA LOOK AT THESE BEEE BOYS 
4:21:23,4:23:00, I lost faith "if i was Ramaphosa i would have made an example by putting Ace into jail. A leader need balls @Anwar Syed - I totally agree @Ghost tell me Mugabe was the most educated leader in Africa .Now you tell me what happend?? Without COMMON SENSE all the education in the world won't help!!! WE NEVER WANTED BEE WE JUST WANTED EQUAL OPPOTURNITIES Whoever votes for anc has no right to complain about corruption because it has been known for too many years that anc is severely corrupted. @skeetpetegibbs - not me "The Lord helps those who help themselves Jacob* 
4:23:02,4:26:13, your right education wont help against sanctions THE MOST ANNOYING THING THESE BEE BOYS THINK YHEY R INTELEGENT "We know that Jacob Zuma was stealing money Mr. Sodi just admit that you overcharged because that was actually TUNNELLING to Ace Akhonamandla Gala President Ramaphosa has no authority to fire Ace Magashule. Ace isn't a cabinet minister. He is the SG elected by the masses of the ANC. It's probably the NEC that could recall him Eeeeeerhm.... eeeeeerhm.... errrhm RAMAPHOSA CANNOT DO ANYTHING HIS DUCKS R NOT INORDER HIMSELF LOL "Zakhele say that again WE NOT FOR BABYLON MY BROTHER 
4:26:19,4:29:06, "But hey people This cheese boy is Ali "This world will end and a new world will be born. All of this corrupted society will never last HAVE U FOUND YOURSELF IN 1 ROOM WITH THESE BEE BOYS ULL REGRET IT Luthando then the NEC must do it's job because at the end of the day it is Ramaphosas leadership that is going to be blamed Mr. Sodi was trained in the ANC Crookery and Corruption School It tough for small business when you do not generate constant revenue. how do you pay your labour when you operate 6 month without a project. i am not making excuss simply stating the situation All manner of unholy sinful behaviour and creations will be eradicated. The Lord's will be done on Earth as it is in heaven. faced by Mr Sodi 
4:29:30,4:32:37, THE MOST PAINFUL THING THE ANC DOES IS THEY STEAL FROM THE VERY POOR @Makhosini are you by any chance related to Mosebenzi Zwane? Is Sodi the ANC or a business "@Akhonamandla Gala Very distant @Zakhele Tshabalala ...Very ..very true.....but also the whole of SA......how disgraceful .....and disgusting... Not all ANC are corrupt but the majority of the corrupt causes even the others to be called corrupt @Zakhele Tshabalala ....If you are connected......you can get anything ...... EH BABA ALL ANC IS CORRUPT From the Commie ANC....... 
4:33:42,4:35:07, Blaming the dead man AGAIN? Charge him for lying and non-disclosure to the Department. IF U HAVE 1 ROTTEN APPLE IN THE BAG LATER ALL THE APPLES WILL BE ROTTEN THE WHOLE ANC IS CORRUPT replace the entire cabinet and put in people who can take this beautiful country forward don't look at race there are a lot of people that can do better not the crooked cronies of the anc not only did they steal from the poor .Igo Mampani was gunned down in broad daylight. he was also involved in this project in question Policy of cadre deployment is aimed at state capture. No other explanation I can think of. This guy will sit here in front of the commission and blame everything to the late partner How come the parliament......never stopped the corruption etc etc......... LOL OK MAKHOSINI MFWETHU 
4:35:12,4:35:55, .. . ... .. ... MIKE THEY CANT THEY R ALL EATING ". .  . ..... . @Winston Paul you need a strong leader to carry the work SA IS A BANANA REPUBLIC 
4:36:05,4:36:53, .. . The answer........Most of them are.......Captured...... WE WERE NEVER READY FOR FREEDOM .......... . ..... . ... . ....... . . ... zakhele u are spot on with your contribution Tenders r just issued...no competition? "@Zakhele Tshabalala we are a very accommodating country 
4:36:53,4:37:53, ".. "It’s a wonder that DCJ Zondo’ hasn’t given up the will to live  " . ..... .... .? .. .. .. . ..... wel des is sackes You cannot base conclusion on certain individuals to judge a country 
4:37:58,4:39:16, #voetsekANC des is stopet These people don’t even lie very well ! We have a very very sick government .........will take generations to repair and come right etc... IF YOU CAN LOOK CLOSELY THEY ENDED UP STEALING WHERE THEY WERE NOT SUPPOSED TO STEAL THE ANC IS OUT OF CONTROL "? . .. .... ... @jasper dougal cannot agree more A 
4:39:23,4:40:35, "... .. . ....? ... ..... Indeed Zakhele PITY AT THE MOMENT THERE IS NO PARTY THAT WILL FIX THE MESS WE R IN agree If Zondo is the DJP I would hate to see the quality of the judges below him. the commision MUST protect this guy...otherwise what happened to Mpambane is definitely going go hamp "Would love to know Zondo’s thoughts when he gets to put his feet up at home  Val Speirs what’s with ? ... ?.. Please SA....we Don't want Commies/Socialists running our country..........Get rid of the ANC/EFF......seriously..... 
4:40:57,4:42:17, "You are not a joke to the World  " IMAGINE BEING ASKED WHERE U COME FROM .YOU CANT SAY U R A SOUTH AFRICAN AT THE MOMENT we need to stop the bus and start again what happened to Mpambane is going to happen to him...they are all watching n "look at Zimbabwe in this case MIKE ACTUALY WE NEED TO RESET THE GOVERNMENT totally "ANC does not represent you  
4:42:23,4:44:01, @Zakhele Tshabalala You assume politicians can solve our problems when it is they who have created them. The solution is to get rid of the politics and for us as individuals to take responsibility. "@Zakhele Tshabalala .......I feel the same way......it's so sad etc..........""Cry My Beloved Country""...." " DOMINIC UR SPOT ON LETS GET RID OF THE POLITICS WHERE DO WE START " All over the World rich elites are stealing from the poor Reduce the size and scope of government for a start. There will be a reckoning ZONDO REPEATS EVERY PAGE NUMBER. wHAT A BALL ACHE 
4:44:09,4:44:58, evening from Cuba "South Africa can do with 15 departments @jasper dougal ....They also need to be punished......etc Yes Work on helping people to regain their self-esteem. "..  THIS COVID HAS EXPOSED THE GOVERNMENT Bunch of crooks about time 
4:45:03,4:46:12, the democratic alliance is rotten to the core in terms of the PPE procurement "....... .. When people have self-respect they don't allow others to take them for a ride. in the Western Cape CORRUPTION IS NOT GETTING WORSE ITS BEING TELEVISED "... ... where is Kate Hoffman "...?... @L. M PPE procurement was worse 
4:46:28,4:47:58, Kate Hofmeyer should get the job SO THIS RAMAPHOSA GUY IS BUSY TAKING LOANS WHOS GONNA PAYBACK THAT MONEY Lets say Capitalism.....is the lessor.....of All the evils..... ConCourt dismisses Jacob Zuma's appeal in Derek Hanekom defamation judgment "@jasper dougal This corruption is based on soviet style communist rule where ""collective responsibility"" means nobody is accountable." THEY R TAKING LOANS FOR SELF ENRICHMENT "After this Commission  @Makhosini Floyd zwane therefore there should be a coupe `d` etat also JZ got a leka klap from Goncourt today 
4:48:22,4:50:12, how can it be soviet style when we are in a capitalist arena? I PERSONALY DONT RECOGNISE THE CURRENT PRESIDENT AS MY PRESIDENT The rested Mandela once said ''he does not put a lable to the governing model of the ANC'' but now it is clear capitalism You guy’s deserve so much better @Inspiration Afri In case you didn't notice we are governed by South African Communist Party together with ANC. @Zakhele Tshabalala that is beyond your control Look @ his expensive watch⌚ @jasper dougal .....Maybe the commission is just a smoke screen etc......so that the Commie ANC are Appearing to do something about corruption......I don't Exactl 
4:50:13,4:51:26, I agree with you there Sodi LM I AM MY OWNPRESIDENT AT THE MOMENT TILL FURTHER NOTICE Thuli should be the next president Can we not save whatever is left get those who stole into jail and recoup the money then we let the people elect righteous leaders zakhele why don't recognize the President? I CANT LET THESE DOM CROOKS LEAD ME @Zakhele Tshabalala you must be nuts name one communist programme dished out by them LOOK AT THIS GUY TALKING HES TALKING ON RUBBISH HERE AND ZONDO IS LITSENING 
4:51:42,4:53:49, LM LOL FRANKLIN BECAUSE HE DOESNT HAVE BACKBONE TO STOP CORRUPTION "Cyril is been controlled by others this guy's argument is totally logical if there are only 3 licensed Asbestos companies in SA how would he have found one once they got the contract! @Inspiration Afri ....Remember.......The Commie ANC Bra's ...have been brainwashed by.......the Commies.....think about it... let us support our garvenment to improve in their mistakes to report the criminal the racist democratic alliance was removed by the people at Nelson Mandela bay municipality facts not assumptions "Would love to know Zondo’s thought right now  
4:54:13,4:56:06, I dont think the DA can be described a being more racist than any one else especially the ANC and EFF Let’s bring back executions @Inspiration Afri Let me answer your question with one of my own. Name one programme aimed at strengthening a free-market economy. IM OUT GUDNYT @Inspiration Afri ...it's a know fact they are guided by Commie/Socialist doctrine/guidelines........it's in da heads Bra... free african trade the DA diplay the verwoerdian mentality zakhele never underestimate him LOL 
4:56:16,4:58:25, @L. M ....If you think so.......ne @Zakhele Tshabalala are you in Wuhan? lol really How come Zuma has never been recalled ? YES IF HE HAD A BACKBONE HE SHOULD HAVE CALLED ZUMA @Inspiration Afri Nice try but it's all talk and no action. The action is more like increasing tariffs on imported chicken if you want to look at international trade. Now we have to pay 50% more. He should have been summoned to give the rest of his testimony BUT BECUSE HES A LOOSE CANON HIMSELF HE CANT DEAL WITH CORRUPTION lol 
4:58:42,5:00:23, RAMAPHOSA IS A EMPTY VESSEL LOUD NOISE NO ACTION "Now falls back on ‘I’m an old man  TAX PAYERS WILL SUFFER BECAUSE OF CR'S LOANS.... WHO ELSE WILL PAY OFF THAT MASSIVE DEBT?! THE DEVIL IS REAL african trade agreement is not an international trade The beginning of the fall of ZANU today marks the beginning of the end of the ANC and to this corruption time to celebrate NERISA MY POINT EXACTLY WHOSE GOING TO PAYBACK The poor @Inspiration Afri Until we are all in one customs union african trade is international trade because excise duties are payable. THIS RAMAPHOSA GUY THINK WE R FOOLS 
5:00:43,5:03:41, HES A JOKE blame capitalism for that this commission will assit this government in recouping the lost fruits. it will cleanse itself @Inspiration Afri please try to find out what capitalism is - There are plenty of free economics courses. i am going into the asbestos industry some of these guys would drive around with R1M in the car..... "i live in a capitalist country  @ZAKELE YES THIS GOVERNMENT IS NOT ONLY A JOKE BUT A DISGRACE TO THE FULLEST DEGREE BUNCH OF CLOWNS IN A CIRCUS AT OUR EXPENSE @Inspiration Afri ......are u not happy then... 
5:04:03,5:07:48, happy about? How about...life and what u have etc etc... "@Inspiration Afri Just because you live in a capitalist country does not mean you understand what it is. Google ""basic economics explained""" IM DEFINETLY GOING TO START ASBESTOS REMOVAL COMPANY @Inspiration Afri .....think u confused my Bra... how does that correlate with capitalism Why audit what you know? These were public houses. The numbers were known & the roofing structures known. communism economics is not capitalism 
