starttime, endtime,message
time,24:06,message "I love how a broadcasting company such as the SABC with millions of rands and technology Seems they've never heard of Stereo sound "I also love the soft picture "SABC was captured by Hlhaudi...another Zuma appointee yes We are not safe Annoying very 
24:16,26:38, should probably just hide chat Gutpa Bots are very busy today Very Gutpa robots are very busy today i dont know if thats a virus or what😂😂 yeah but they just come in with new names Its probably Tony Gupta himself..... probably duduzane Thanks Thando - they are showing as blocked this side too now. 
32:48,35:09, 😂😂😂 "He is not making up story "with Zuma's voice .what is state heee? did the guptas captured the legislature 😂😂 WHAT'S GOING ON HERE? "The guy can talk models Tired blocking models 
35:42,36:57, yerr is this a hostile take over ? Why are people’s comments in codes now What’s happening🙆🏽‍♀️ Very hostile indeed you tube must act now This is sad Guys it’s not the same without the comments . 
37:15,44:13, Sabotage...SABC please act on the hackers Those who have Twitter please do send SABC Digital News a tweet SABC Digital please control the invasion of these bots "This is not ANN7 Aptul "guess who said this ?did the guptas captured the judiciary What’s this rubbish here Someone mentioned yesterday that the IEC was captured too Zuma infiltrated and corrupted each and every institution he could in SA @hilton module I remember very well when Zuma said that 
45:35,51:07, Someone cast aspersions on the new CEO of the IEC...and it may be correct This testimony about the OEC is a bombshell...watch the fallout soon nothing will happen to these crooks and zuma continues to laugh he he All have smallanyana skeleton says soo bathabile dlamini guys The elections were a farce...what about the boxes found and the bad ink etc...nothing was investigated The rotten 🦈ANC stinks from the head down Anyone who voted for the ANC cannot complain who said we are complaining? "Anc doesn’t send any one to corruption 
51:22,52:23, indeed makhosi Oh so you are not complaining that the country was stolen? do we have to await completion of the hearings /closure of the commission for justice to be seen to be done.? Complain for what exactly\ Not complaining is complicity any party is capable of doing such and even worse. But what is wrong if you want to have a different platform that will show a different version? Is zuma still refuting his special relation with the guptas You should be happy that you were propping up a corrupt party with your vote Zikhona Zindani 
52:40,55:06, "we are far from complain Future generations will be amazed of how some people flocked to the ANC in spite of state capture bunch of dumbasses here eeeeeeeh eeee "They will be no justice served after this ANC till jesus comes back. Being part of the solution and putting pressure on the NPA to do its job is crucial Oh I am very happy about my vote. very pleased with it. The right organisation is leading. now our hurdle is to deal with the aftermath of the zuma maladministration Spice Zondo haha Zokhona Zindani your ignorance is amazing to think anyone will be dealt with 
55:13,56:26, This commissions is an other wasteful and unaccounted expenditure. we must take law into our own hands and deal with dis criminals I also dont think this guy is telling the Trueth? The ANC owe us as citizens apology for what they did and also pay back the money they stole from our fiscas Focus on your party?What party?South Africa belongs to ALL who live it... This is guy knows his telling the truth "But you still vote for your Mafia leaders Doing same thing all over again is a sign of stupidity.ANC leaders are corrupt to the core People in ALEXANDRA are evicted just less than a month after voting for the ANC is the shame for Africans "i believe in traditional courts "Most of the implicated are still in the ANC 
56:31,59:13, "I am supporting all NPA what they will do "@Thando Nkutha How many years will this state capture last What happens if Zondo dies Tommorrow 4 years could be enough I really dont know how many more years this will continue. we kept asking urselves that last week "@makhosi nobhatayi that is exactly what Shamila Batohi said in her presser "Hai State Capture is honestly long dragging these people wll be dead by the time its time to act on them 
59:14,1:00:33, "NPA is useless .do u think if the guptas did this in China they would b in Dubai laughing like that . look at this churches in South Africa .will they operate like this if it was in Kenya  "It’s not just ANC leaders that can’t tell the difference between state & party "Ramaphosa might not even be president by then Evidence still remains @Cassius Mngomezulu zondo must be rush this thing we dont have another 10 years "Zondo's line of interrogation on quotes is trying to intimidate the witness  bushiri and this bo alph lukau pays the same people we elected to rob the poor with their evil ways of manipulating the poors But who will put the pieces together like how zondo is asking questions now 
1:00:42,1:02:17, definitely december 2020 end of story guys remember it was given 2 year only "@Solly 12 Exactly...they act on what they are told.Ace uses the line of party allegiance "We already know the tsotsis hiii whats wrong with remembering exact words like really Is he not supposed to remember why zondo is interrupting this guy or is he defending zuma who would remember the exact words of a conversation that took place 4 years ago Zondo is correct!! 
1:02:30,1:03:50, "I do "Ai mahn Ntate Zondo Zondo is losing it Thats what journalists do hehe zondo is becoming a problem here "I was about to say ANN7 Zuma designed to brainwash and steal even more from the simple anc voters Truth "The person who edited his book should have assisted 
1:03:51,1:05:05, @Thando Nkutha. He said there was no diary. Rajesh getting pireced on use of quotations put an Indian and Zulu together what mixture you get😅 even though we don't like what the judge is saying but is right "This exactly what journalists do "Zondo is correct I am systematically reporting this harassment bots ay zondo is grilling this guy. tjo what is this going to do to his credibility This is such basic knowledge!! me to 
1:05:06,1:05:53, We got the point let's move on Zondo is lecturing the journalist's work iam sure zuma is smilin right now by this Media should be held accountable!! "dankie Mr Judge unprofessional journalist Thanks YouTube for removing the bots and also exposing who it is well he did work for ANN7 MOVE ALONG ALREADY 
1:06:00,1:07:20, "Can he go back to India now zondo is running the showorld now what happened to this lady now "ooh my goodness The truth should be the bottom line- too many lies are occurring Zuma is watching this "This is really important becuase it borders on the credibility of this comrade CREDIBILITY is VERY important!! He should have said “ to the best of my knowledge “ 100% This guys is narrating what happened stop doubting him 
1:07:42,1:08:40, "people can say ""this is not what I said"" and put his entire testiony in jepoardy" Why is judge Zondo grilling this guy for quotations marks?? like really he is mumbling a lot Mumbling lol lol He sounds credible- he was trying to convey the Truth - not cover things up- Zuma is watching this and he's now smiling "@Zinhle Omontle because it's a legal issue "Is Zondo now saying because the quotes are not verbatim He never made notes as a journalists thixo 
1:08:42,1:09:53, "and the Judge is right Thank you let's move hez shaking "This guy may have a recollection of what transpired then. I guess Chair's issue is he cannot quote but to say: "" to the best of my knowledge Throw him out Zondo zuma is being defended here for free This man was only at ANN7 for FOUR months off course he will remember everything What happened? no facts written down tjooo 
1:10:01,1:10:52, uZondo wenzan manje Pipi time for Judge very likely @Tharaxis Nope....legal matters come later....this is a commision of enquiry? @Michael Wild 😆 he is a judge and he needs facts 5 minutes break for the judge aaaaaaaaaawwwwwuuuuu u Zondo Zumas defence is getting thin...you can see how his previous lawyers disappeared...he will have no place to hide only maybe Dubai 
1:10:53,1:12:09, 😃😃😃😃 no wait there are more that is coming email and phone Who is the victim?? "I don’t believe Mr Zondo is implying that he’s lying watching from Brooklyn in Pta "Zondo calling Zuma and he is like Judge wanted to peer one of the reasons I don't buy a news paper @Tee Makara you are correct @magda sequin lawyers will “ disappear “ when they’ve been threatened for defending the truth too remember 
1:12:16,1:14:31, dont trust this judge He is an authentic Judge he should have brought basic principles of journalism and give it to Zondo simple Zondo's attitude towards this guy is similar to that of Adv Pretorius as Agrizzi was concluding his testimony. Behaving like a defence attorney of thieves. If I was this guy I would be discouraged. It’s over for Zumagang. Please help me comprehend who is the victim? If Zondo doesn’t bring Zuma to testify then he can forget bout being Chief Justice Zonda is making sure it will stand in court. must remove the quotations he is throwing the book out of the evidence submission 
1:14:34,1:17:11, Who do the people want to defend?? went to get cup of tea what happened is this tea break? Thando Nkutha obviously u haven’t been paying attention to commission poor guy is risking his life and we still say he's lying wow i wonder 😂😂😂 jett888 do you know what is going on here? Defend the person trying to expose the truth! Help protect him!! "@michael mbatha I remember every persons biography is questionable 
1:17:36,1:19:46, we want our land The guy is knows how Guptas behave behind the Scine and board room Judges are human beings and also has biases it seems Thando Nkutha might help u to use your brain a little bit The Truth is what’s important- those who are brave enough for o expose it should be defended!! they are just clearing the smoke which is a right approach @jett888 100% correct Too much corruption by big elitist and corporations- please protect human rights! We all need to unite to defend the truth! ❤️🌹❤️ In a sense I agree with the Judge but he could have been a bit nicer and not so rough on the guy.He was very lenient to other witnesses like Manuel 
1:19:49,1:22:29, "These people have a backup evidence @jett888 Finish and Klaar Millicent blocked Whether Zondo is biased or not on asking the credibility of the quotes is immaterial. Remember Zuma & company will defend themselves. Their lawyers will definitely ask that question. when will Zuma be on the hot seat Propaganda is on the rise- the UN /NWO Depopulation Agenda is on the rise- please protect those defending our human rights and honesty. ❤️ Zumas lawyers was not up to the task in his last appearance..SC Trengrove was far above their argument Are the boys still at work? Too many people are being intimidated 
1:22:37,1:26:24, Bots* @jett888 true look what they are doing to Julian Assange and Chelsea Manning @khanyi what bots Are there interpreters there? Zuma will say I want testify in Zulu The President is a public figure- photos shouldn’t be hidden- @Magda Seguin you are so correct- we need to defend those exposing corruption!! Always! 🌹❤️🌹 "Zuma will say ""I want to testify with forked tongue""." CJ Moegoeng has stated after consultation that English only must be used in courts...the judge in the Zuma case overruled his Zulu request This affects all of us - whistleblowers and truth tellers need protection- corruption needs to be exposed But this is not a court 
1:27:06,1:29:28, I just saw this on YouTube. what's going on? can anyone explain @Solly 12 the TRUTH doesn’t need a “ court” it only needs to be defended Is this Judge a judge the people voted in? It will go to court...Batohi and Cronje was in fire in their press conference @Caitilin C same here- trying to figure it out- but this person seems to be willing to come forward to expose some sort of corruption Poor guy getting a bit flustered!! "In SA the judiciary is independant He looks like an honest man "Jett888 true 
1:29:43,1:31:14, "Yes we trust him Thank You @MagdaSequin 🙏🏼 wow this is the first time I'm hearing of this. why is this not on the national news it seems very important @barbara broadbent but he’ll be okay- anytime you are telling the truth- it stays consistent. 🌹❤️🌹 What crimes?who must go to jail @Solly 12 Truth or Honesty? "i agree @Solly 12 when you say “ him” are you talking about the man being questioned right now? You can follow it on Twitter too 
1:31:49,1:32:40, does no one remember this happening lol 🤣🤣🤣 What is the mans name being questioned? @MagdaSequin Twitter Banned me for a Honest Joke I assume he meant 'him' who is our ex president Magda Seguin everyone who participated in this grand corruption called state capture Rajesh Sundaram Rajesh Oh very!! really? for a joke? ZUMA IS CORRUPT 
1:32:47,1:34:32, @jett888 @khalid Mather in the USA- much of mainstream media doesn’t show all - so I have no idea what this is about I agree wholeheartedly @Solly 12 @jett888 watch and learn! @jett888 State Capture Inquiry of South Africa guys you're all seemingly new here @Magda Both in America We use humor sometimes to help ease the Truth from hurting too much It’s like the Steele Dossier- look at how corrupt that was and how much corruption to keep it under wraps- the truth will be revealed! ❤️🌹❤️ We have a very strong constitutional democracy..but the criminals still have ways especially when they have absolute power like our ex president 
1:34:56,1:36:25, if anyone understand please explain I'm confused. this sounds serious but what happened ??? How is it possible that there are people who haven’t been following the proceedings of the commission ✝️⚖️✝️ yooo @barbara broadbent I’m trying!! Just had some questions / comments to try to clarify - want to comprehend the positions/ beliefs I have no idea this was even happening. it hasn't been in the news at all Google Daily Maverick ...its an investigative website...also Amaghunbane u are correct solly You will get all the information on what is happening 
1:36:34,1:39:15, thank you @Caitlin C Are you South African? @solly 12 it’s called CENSORSHIP!! Alive and well in the USA no I'm English this commision started a year ago Admin....please block this rubbish adverts Jett888 I suspect it’s ANC supporters turning a blind eye hoping this thing will die down "@Anna M see I’m in the USA 
1:39:55,1:42:16, Been blocking this rubbish maan it keeps on coming @jett888 exactly @jett888 I think the problems you have in the States overshadows the problems in a small African country. @Solly 12 Metoo....lol @ Solly 12 exactly- corruption of the elite- who put themselves above the law - we need to expose them! Im getting the picture- @Anna M but we are actually ALL being assaulted! @AnneM. That is very Narrow minded of you USA getting ready for their next civil war? Americans actually care what's happening in the world and Africa Nude zombies are invading this peaceful platform today 
1:42:20,1:43:28, "@KQ Proud American Woman I've been to the States @AnneM. So True! "@Caitlin C Oh you from the world of ""NO COLLUSION!!"" ???" @KQ Proud American Woman Do they know that America is nothing without Africa lol lol ? when will this book be released It's The Fake News "Especially FOX news @Anna M- America elite- like HR Clin ton are corrupting many countries- Africa is so important! They are victims of our corrupt government 🌹❤️🌹 this man is being intimidated and threatened I was being sarcastic - I should have said that. 
1:43:45,1:44:48, @BuyaniMhlongo Your opinion? Or Fact? @Magda Seguin FOX is converted The book has already been published @KQ Proud American Woman Been to the USA many times.....Americans in general care only about America.....Many have not left their towns and states in their lifetime. Converted how? "@KQ Proud American Woman America take most of its raw materials in Africa (Oil ahhhh zondo Amanga Chief uyabona amanga anenyawo ezimfishane @jett888 thank you I'm glad it's not just my country who's not reporting it. I don't understand why this is so important of what's happened. 
1:44:51,1:46:46, "@Magda Seguin Even Trump's lawyer Bathathe Zobdo izinja zegame Justice Zondo wants to make sure this witness can be trusted. He seems to doubt a lot of the information he is giving as published in his book. "dcj @magda Sequin they are ALL propaganda! Only 5 Illuminati families own all the USA mainstream media- this man/ writer is being intimidated for exposing the corruption-I fear for his safety ❤️🌹❤️ @KQ Proud American Woman Are you from the US? "I am nearly finished reading a French book about Russia and the oligarchs...the US was infiltrated by the Russians a very long time ago zuma wants to now what wrong he did Your health is not important chief ijob ijob chief 
1:46:50,1:47:33, @jett888 bUT cnn is exposing corruption big time! Putin is the ringmaster..they di the same in the UK @KEITH I am a Proud American Speaks for itself✝️🤗 "Zondo shouldn’t be telling us about his doubts now But why does he speak like indian?That's what corruption can do. How can you trust someone who uses verbatim quotes in an ungovernable manner!! he is an indian "Zondo is being petty. The contents of the book belong to the writer "@KQ Proud American Woman ""NO COLLUSION!""" 
1:47:34,1:49:03, Guptas abuse our people who work there guptas came tooo loot sa @Bongumusa Manila do you really think this writer would put his life on the line to expose or lie about them if his information wasn’t true!! Gigaba has A LOT to account for..he is still on the ANC NEC The Guptas abuse Zuma someone hire this brilliant man South Africans should thank this man for his testimony..taking on the Guptas and Zuma is the same as Agrizzi taking on Watson "@KQ Proud American Woman ""Mueller report has ound no collusion. its a total exoneration!"" LOL" Zuma wanted to be abused - he had a trial run with Shaik. 
1:49:14,1:50:34, this is a book comissioner In the USA- mainstream media steers ALL information- the truth is NOT told- it’s like China propaganda! This man is putting his life on the line for the truth hahaha trust journalists to keep a secret @jett888 in RSA its different this is Mzansi he's safe "@jett888 My man and mentor Americans Were Harmed Fact! Honest! For a very long time! @jett888 Writers and Jenalists have rights and thos e rights are obeyed "Barr was so dishonest about the Mueller report 
1:50:37,1:52:28, This guy is talking wall & all.....he must just slow down! He does not have to be here and gains nothing. guptas have invaded the chat Why going to India not Soweto? @Musa Bakiti zuma was won that he must stay away from the business people back in 2013 but he never backed down so he allowed this to happen see his bank digit is growing without what he earned @musa bakithi true that @Keith Sindile dinabantu ALL U.S Government is run by the same CORRUPT elite puppeteers! Trump is a Trojan Horse- civilians are being destroyed right now! This world is in Trouble!! "@KQ Proud American Woman Who said ""no collusion!""??" Am testing you Eish the bots are back 
1:52:35,1:54:25, @makhosi nobhatyi this is what afrikaaners wanted to see happening @KEITH I don't need a Teacher or Test. Thank you. I'm an American LOL @Keith 😂 You know they don’t want this TRUTH EXPOSED! The bots and trolls will be here- can someone remove lomgupta flooding here. i miss mig33 Ok guys...I. off.Too much bots now.I suspect sabotage @Keith Where are you from? May I ask? They are ATTACKING the Messenger right now!! Just like Assange and all whistleblowers 🌹❤️🌹 
1:54:29,1:55:44, can anyone remove these links @Musa Bakiti iTS NOT ABOUT RACE. ITS A SHEER CORRUPT ZUMA THAT PUT US IN THIS ECONOMIC MESS. STOP THE RACE CARD NONSENSE! Admin!!!! "@Musa Bakiti you can’t blame afrikaaners here Zuma has all keys to open doors for those whom were disadvantaged so he just opened for him  His a bit emotional @Millicent Shozi The SABC Digital News moderator can remove them. Amen Keith Amen 🙏🏼 click on his/its name. block What a nonsense letter.....full of lies....respect for the Guptas.....wow 
1:55:45,1:57:01, Who is the man in the white shirt? He’s trying to discredit the author- he’s psyop "@KQ Proud American Woman From here so can we trust the book Please block the bots @jett888 Deputy Chief Justice Zondo - Chairman of the Inquiry no No NO NO chief answer the question @cerebis he’s trying to get out alive- there is nothing wrong w that I read Sundaram's book when it was published last year. All the things he is mentioning at the commission today is no shocker. It's literally a repeat of what is in the book. @Makhosini Nkosi Thank you 
1:57:12,1:58:51, eita Thanks @Shaun Lukhele but the guy is right..why does the dcj and the advocate want to grill him on this? @millicent Shizuoka - anytime someone seems willing to put their life on the line to expose a truth- seems pretty reliable ❤️🌹❤️ @jett888 Hmmm....maybe. He should have been scared after what happened to the guy that filmed a Gupta in Dubai?? If the witness had to write what he felt in his resignation letter he would not have been alive today What is the problem with Zondo today? @makhosi nobhatyi This Musa guys implies corrupt leaders should not be exposed. and...now he blames white population for the fact that the corrupt rot is on the open? Hehehe @jet888 thanks 
1:59:00,2:01:04, zondo is out of touch today he really is Bathong Ntate Zondo Exactly.!! "The judge is nitpicking when one leave his former place of employment he doesnt have to be angry or throw insult words or is that what dcj and the advocate want from him? Exactly Cerebis! Truth tellers are being eliminated or imprisoned DAILY! Citizens need to WAKE UP to the corruption taking place in government and corporations!! Keep eyes on this man to protect him @KQ Proud American Woman Just bought car parts from Arizona two weeks ago.... and fitted them already in the car. Leave it there please judge 
2:01:09,2:03:32, "Zuma must have called him during the break ""we Zondo! @Magda Sequin his goal is to discredit the authors book- he is damage control- he’s a puppet for the elite to keep truth from being revealed- The judge never questioned other witnesses from SOEs who resigned...YOH what is this? "@Keith S.Dinabantu what Zuma did to us "@KQ Proud American Woman Arizona and Miami coming out with different names. blocked them all yoh zondo u r captured today "i think this is a lesson for all of us Can he just say yes he was misrepresenting his true feelings and move on.He is not on trial here.He could not have written the letter any other way. 
2:03:33,2:05:50, @goolamv he is defending his life- his credibility- this is a David and Goliath type of situation- I’d be nervous too🌹❤️🌹 "We're being invaded today...""sexy girls."" LOL" gupta bots See - his letter to his employer shouldn’t be the issue- at all- Zombu ( ?) is trying to discredit him "@Makhosini Nkosi Yes sir. They are clever like ""google analytics."" They change names to remain on top of the game." where are the moderators... huh.... enc Where are the Mods here? Get rid of SPAM!! jhere jhere "@Makhosini Nkosi I did the same 
2:05:53,2:07:08, oh ok. thanx Keith. first time experience Judge Zondo treated a know Criminal like Agrizzi better than this guy....Why? He knew the whole arrangement was destroying his intergrity as a journalist. just tuned . I am curious as to what bombshell will Rafesh unleash today. CENSORSHIP is ALL over PEOPLE! We MUST defend SPEECE and the TRUTH!! Government is NOT to be TRUSTED! Unite!❤️🌹❤️ rajesh @Thando Nkutha true and they were indian family.. Agrizzi ubezwisa shame Agrizzi never said anything wrong about Zuma. 
2:07:21,2:10:09, "Indeed sir @Makhosini Nkosi  Zondo is using a proper approach of Law @Makhosini Nkosi But Zuma was part of Bosasa pay roll isn't sir? Oh ok Keith. ngiyabona @Thando Nkutha this isn’t about a “ Grudge”! It’s about the TRUTH and corruption being exposed- he’s brave @Makhosini Nkosi how is NewCastle sir?😀 @jett888 I blocked them all those stupid SPAM! they were strong arming this guy these guptas "If you see spam 
2:10:53,2:13:25, @mashudu tshikororo WHO’S “ Law”? The Elites or the common man? He’s trying to help cover corruption by discrediting this author who’s been targeted for telling the truth!🌹❤️🌹 "@Mwamuzi Shadrick I do Zuma style intimidation.KZN political killings are rife lol Buyani utsini manje. I am in limpopo bayaloya. Ah! Thank you for the “ block” advice! backed you up when you are dead? no man!! If he had mentioned his grievances in his resignation letter he wouldn't be here today Click on the profile and u will Get options to chose. Chose blocks and watch freely "as a Lawyer I would do the same in case he is cross examined 
2:13:27,2:14:53, lol Jett888 it works like magic. @khaya Nomoyi he’s going to get killed by the G family don’t you think? Manyi must be subpoenaed to testify "@Makhosini Nkosi oH yeah hence he understand better as a journalist and the fact that he wrote a resignation letter in a friendly way to play them mind games..i think this guy was right and i dont know why dcj and the advocate are making a meal out of this.. "Nda The Guptas used South Africans to terrorise this man brave man 
