author,message
nhlayisi owen magayisa,"Evidence is with ANC they must come and testify "I think it is important to be consistency with the matter at hand Agree 100% Food parcels.. Don't generalize on your narative. There are prominent black leaders with integrity... Guys let us not entertain people who are racist.. @Fils de l'homme.. what have you smoke again.... lol
Trevor Rolfe,why is this guy talking ? @sakhile mtshali Estina Dairy Farm! @sakhile mtshali eskom Brian Molefe 30million rand pension pay out for 18 Months work "lol! Our current Public protecor was appointed by JZ..... Tom Moyane "Those emails are irrelevant  Flashy cars! big banners! Local Artists at rallys The NPA was captured... they have no bite to their bark. Eskom is using emergency procurement procedures and its costing them a lot more due to the lack of proper management WEEDS LEGAL!!!! Wooohoooo!!!!! @Fils de l'homme Thats RAcist and not true at all! Not sure where your from but it seems your upbringing has skewed your view on race. I did @Fils de l'homme blah blah blah! How far back are we going to go???? does the Nguni Have rights to the land or are the Koi koi entitled to the land... technically Loooong time before my gran was alive... id say at least two to three generations ago... I really do not know @Greg Stewart 😞 why? lol @Jackson Mpala please explain how Zuma is Innocent Concourt he was found to have broken his oath of office to protect the constitution of our land Then you can believe what you want Zuma is very Smart! No Doubt! So are the others implicated.
Music,@sakhile mtshali are you saying there is no state capture?
Felix Motau,"The Estina dairy case is bumbling
Gambu,Why was Duduzani running? we want that basted here
simphiwe gumede,the govenor mcdonell case
Mkabayi kaSenzangakhona,the Gupta's were handed the country and its finances on a silver platter. the elected politicians are the ones at fault together with those who continue to vote for them.
iliketowatchducks,ignore the morons.
thubalethu,@Trevor Rolfe did you go to that school where the main war cry was Agelop Agelop?
Mutumwa Mawere,State capture - in what form does a state exist and what would capturing it entail. Is it the capture of the person of Zuma or a generic state?
Motopi Seleka Jr,#Shakile has a point the former PP' state of capture report makes a lot of allegations instead of findings..... the very report suggested that we should have this current inquiry which legal it too is an investigation exercise - but it too appears to be making allegations instead of answers the PP thought will be found in it. this Inquiry is overrated
ntselelechesa,I think Kaufmann is undermining our thinking capability; Countries in transition can invite the investors in a transparent way through their legitimate channels - FDI. Like he said I think he is not aware of and/or studied our current matter regarding STATE CAPTURE; ZUMA and his cohorts misdirected public funds to fraudsters for his indirect benefit through his son We would not have any problem if Guptas were here as investor without using the powerful STATESMAN - apex of our governance.
KT M,"Not semi desert 
Lucky123 Thwala,"SAOE can perform very well if we deploy competent people not thieves Zuma goes around and mislead student that there is no state capture
Kiren Thathiah,did you know that Fils de Homme had a very troubled childhood?
DUMISA ALWANDE,GUYS WHO IS TESTFYING NW ?
Eon ZA,It's easy. No country will invest in SA due to weekly disruptions in work and burning of properties. That's what he's actually trying to explain
James Sthole,this people did all this thinking African are illitirate many African states that were people take adva ntage
RJ Pebane,"just when is the gentleman going to be interrogated...?! he has been talking non-stop
Greg Stewart,SA = freebies and corruption nguni and bantu stole land from koi koi and san people - how far back do we go maybe the world should have exchange of prisoners - all africans to africa and all europeans to europe - really???? phew!!! 😂😂💦💦😂😂 "zulus zuma told students that he doesnt know about state capture it is an attempt to discredit him - hawu??? oh jackie jack?? jack daniels jacki coke gentleman jack jack and the beanstock jack be nimble jack be quick jack jump over the candlestick go jacki - go jacki
Martin Motloung,"I agree with you michael
michelle louw,"The research shows state capture and weakening of property rights go together. No surprises that as state capture becomes stronger
Melvict Melbourne,pott! was that now before 1652 or early 1800 Greg...as far back as when it is to the benefit of the local African The only thing Zuma is innocent on is been born a thief...that s his parents fault. Jackson must be one of Jacob's street kids "Jackson slim vang sy baas "Jack Corruption is a Western concept. Petrol is so expensive we'll have to crowd fund it I have a couple turtles and I have named one Zuma
Linda Damons,"according to the history ive read and to my understanding land trade was done back in the days and yrs before our grandparents were born @trevor 😁😁😁😁😁😁😁😁 yes zuma will deny state capture coz he can't spell state capture
Bsz Amalgamation,But yes he is inocent
Andre van Zyl,Jackson Mampara yes mampara Or he is a BLF member...
Athmanand Singh,Innocent until proven guilty Some if not all members of the Ruling Party had some knowledge of The GUPTAS therefore they intervened when the Banks closed their accounts
Kevin Davis,of corz Jacob Zuma is innocent the and have been asked many times what he did wrong and not even rhamaphosa can pinpoint a single failure and he has never ever been to court on a single state capture charge and Jacob hardly knew the Gupta s it's all a lie lol even nkandla is a lie there is no such place it's all lies Jacob is a victim and his son lives in a little apartment in Soweto not dubai Jackson may I ask u a question what level of education have you got lol dis you get past grade 3 like Jacob Jackson you should get a job in the London paladium telling jokes Jackson u r the only guy here with a bit of brains everyone else has plenty
John Ruiters,Didn't know u stil get such stupid people who don't believe
mandla motsoeneng,@jackson you acting a fool wena jackson his friends and son messed up under his watch he did nothing about as a head of state
Joseph Letsoalo,Truth be told...this zuma guy has looted and destroyed the coffers all our state entities and brought them all to bankruptancy....now everyone of us are paying the price of this fool's mistakes. we cannot continue being ignorant of the damaged the guy has caused for this country and our economy.... we can't continue defending this zuma guy and his cronies. They must be held accountable.
Cerebis,Can you image if Sereti was chairing this Hearing.?