author,message
Calm Relaxation Music Chilled,"Zondo please
Nonhlanhla Sinda,khoi what lie john it's alright David thts it my guy some ppl Here are captuted .. we are all human land belongs to no one but the most high Jehovah aseblief booooo boring land was meant to be shared not that it belongs to so and so brown ppl lets use superior logic..as the Eff normally say @pssy is no colour of a human being is the colour of fonts used here lol clearly Gwede is boring no wonder we digress our comments from the State Capture...now land THIS AND THAT vonyo vonyo black ... White this discussion is boring tsjo Oakbay ...now we're talking ...payback the money ahh Zizo come on
david jacobs,the land belong to no-one we all belong to the land cause we come from the soil yes rifa @Terence Tito The first people of africa
Nkanyiso Mathamba,Ingathi utat'uMqwathi ufuna ukulila nje? @John Doe you know where his grave is?
AFRICA AZANIA,la rasa
Wonga Masiza,That needs to be followed up....unhappiness amongst 3 individuals in the ANC. @Terence Tito Read your biblr..it will give you the only correct definition @Terence Tito It does not say white people either
Mxoliseni Mangqangqa,eff never lies today I've witnessed that
AYE!! its yaddy,VIVA ANC VIVA
Joseph Makofane,ANC took opportunity of Zondo commission to introspect and it's working
dezza derrick,so today they have the bigger tsotsi lol there still the biggest if we can access state capture here why not also live soccer games psl please don't bite me MR gwede why the boring long story who stole all our money that's all we wanna hear finally they got u mantashele
Mohamed Salieu Barrie,Malema is the next president of S/A
Vuyani Moerane,Mantashe what is he doing here yho?
Romeo Manqindi,whats the purpose of this section
Siyabonga Sihle,that is your gogo fairy tale @Terence Tito
MANJU SAINI,hii please can any one will tell me on what matter is this speech going can anyone help me to tell
mncedisi ncokazi,NP is the DA if you know your history....@JohnDoe @John Doe you just agreed with me... "@John Doe so why is Zille thinking that colonial policies were right? @ John can you just explain the Zille public promotion of the colonial policy if her party does not believe in them... "@John Doe i guess you cant defend that as your fellow counterparts are defending the land issue... the inevitable cant be avoided my man
Ziyanda Pamla,Urhorhozu thuni gwede ngathi utyumvubo ngesandla
Nokuthaba Moyo,Watching frm Zim
Glorify Gumede,'what did we know? what did we not know? what did we do? what did we not do? Zizi Kodwa @Nokuthaba Moyo welcome from Zim
Reuben Mpilo Mbangatha,The Lawyer appears to be giving Gwede too much respect..His line of questioning is just guiding him..There are no hard questions at all so far...Gwede is just enjoying himself here
Zolani Mnqika,SaveMYANC
Vukosi Chabalala,"Adv Mokoena is leading the evidence
pierre badenhorst,if wishes were fishes we would all be casting our nets
jjkrew,u cnt have equality without treating those around u equally
Job Mokolutlo,@Terence Tito. The narrative that whites found some unoccupied land in SA is nonsensical! It originates from their skewed history to justify their colonial occupation of SA! "Technically and politically
MSK,they took the land and our weed
Oupa Zwane,what do we want to acrhieve with the commsion His nit MJ Finaly the ANC has share with us its position and JZ refuse to implement the position
MJ Mogopa Keke,The chair is protecting matansh
Speckled Trim,Too much respect in this commission. Where is Malema? leading the witness Is this an ANC commission?
Luthando Ndabambi,"Zondo is doing welll in thia state capture commission thus far for my liking....I might be wrong but I think he does
Nicodimus Mojela,But this Zondo is annoying
Nkosikhona Ginya,"lol the chair is kind to everyone
Simlindile Nodo,well done SG and Chairperson
Nkanyiso Dlamini,He was deputy Pres..
Sattar Saleem Raja,by