author,message
Gugulethu Xhosans,@Herb Truck... i guess 30 June @Herb Tuck @Lazurus Ramoba thats your opinion Mr July is zoned hehe the knot has been untied. The report was to be used to legitimate the suspension of Anwat Dramat so that Ntlemeza can take over. """legitimize """ "The way Mr July is fighting to save his life in that commission
Mangalani Mangalani,@Pieter Engelbrecht This is critical for SA. We need rule of Law as foundation for this country. We need politicians/civil servants to understand they’ll be held accountable for their action. @Pieter Engelbrencht But we shldnt give in.
Lazarus Ramoba,I think this commission is just a waist of money
Lebo Lekalakalaheggyrrdffvgsfggge,🤔🤔🤔🤔
pedro neto,Zoned for preside president
Ntsiki Zitho,September
Bathandwa Mazeka,December
Peter Motsau,mere listener I am
Tyson Afrika,another masquerade... enjoy people.
Unathi Mntonintshi,July at the end of July!
LEEFAM MATHENJWA,Zondo is saving Mr July....the guy is only teaching The Chair how Ipid conduct their invetigation & report which is a waste of time
Muditha Perera,From Sri Lanka
Luyolo Sithole,gud afternoon guys
Joshua Borias,""" 2 UNDERSTAND WHAT CORRUPTION DOES 2 A COUNTRY
Carl Botha,@XhoiXhoi GrandSon Het jou tor van sy coke doppie afgeval? Number one had a call and Guptas landed at W#aterkloof? Why no long drawn out answers now? @Pastor J have a great and blessed weekend
Mthokozisi Mlaba,:dothefive:
Gerda 7,"Wow 49 farm murders according to police stats!!!Make love  Respect!!🙏 Anything is possible in SA Remember the Guptas landing at Waterkloof wth no documentation??
Dr Luvuyo Zantsi,July is not a push over. Zimbabwe and South African police do have meetings together Policing in a foreign country must be unlawfull @Pieter Engelbrecht There is a difference between structures like Interpol and foreign country police. @mandla nkosi Nathi Nhleko not Mthethwa. General Sibiya recently won a labour court case for being fired because of this rendition case. @mandla nkosi Nathi Nhleko was in this commission last week and he was asked about this "@mandla nkosi Ok A lesson to be learnt is that we should not conclude on guilt after listening to only one witness without hearing the other side of the story. @Anne M. Thanks. I havealready conceded the point to @mandla nkosi Nothing bad @Anne M. You were assisting. Sandie July Sandile @Albert Noah You're welcome July clears Nhleko The allegation was that Nhleko appointed Werksman as a hit squad. That is being seriously challenged.
NathiTheGamer99,lol
Bill West,Are they discussing immigration charges or state capture? At this rate the issue of prosecuting the thieves will never conclude Jonathan you don't need a crystal ball to conclude that What has this trial have to doe with proving the guilt of the miscreants?
Mohamed Mia,Yes Jonathan agree with you . Waste of time and money
THABO Mosiane,only State Security can give permission for another foreign security to work in our country through the permission of the president and the minister of police @Sal SA. they got permission from the state security and they were accompanied by the minster of foreign affairs and the general of defence force @Sals SA. you can go back to that case and check. it was published remember after it happened. hence anything that happens out your borders gets published 14 after the mission.
Josh Leonard,Mr Hulley is trying to hard.
Conproc zambia limited,just his hair do makes you know he has alot on his head no..this is so nice...... irrelevant he said
Leon Mbangwa,The head of Foreign Intelligence Services takes office sorounded by gross allegations of cross border crime. South Africa is not getting better We pray for Mr Mandilonga's soul. He died. Yes he did. @redeemed sinner Thus right. unfortunate that suspects of crime ran to the Commission and the evidence leaders failed to ask key questions. Now the commission evidence leaders are defending them @Daniel. Can't understand why McBride was even allowed to come and waste this Commission time. Hidden agendas at play @Daniel McBride will head Foreign Intelligence. I think the qualifying criteria for the position is how much have you lied without being caught. "DCJ you got to do something. Khuba lied to you. Sisoko lied to you The meaning of hit squad is misunderstood by certain people
Albert Noah,What's the full name of Mr. July? @Luvuyo Zantsi . thanks
Abineto Shumba,Judges have a very difficult job I will remain a mechanic 🤗
sifiso Mazibuko,corruption that is why it was removed
Danie Nilsen,bleachbit same as hillary clinten did it sounds to me this evidence leader are being paid by mc bride and company this is important people died here at least one yes it is true even corrupt ones as well closer to home africa is not a prism of an etopia in corrupt officials @Pastor J and the same to you
Aubrey Milford,Danie all people are important what make one person more important than other...and who decides on this? Thanks Pastor you too
Sithembiso Mahlaba,Judge Zondo won't find the truth in this commision
MeditationRelaxHub - Relaxation & Sleep,"hao bathong i just came in now so they stole the lights too?? but is this black screen necessary?
gapieo,"on chi nothing the farmers should leave south Afrika "boycott south africa again  boycott south africa we geven money to incompetent leaders geen cent meet boycott south africa like before they have not learned