author,message
Felix Muyoba,"dcj he is an indian but the guy is right..why does the dcj and the advocate want to grill him on this? zondo is out of touch today when one leave his former place of employment he doesnt have to be angry or throw insult words or is that what dcj and the advocate want from him? @Thando Nkutha true and they were indian family.. they were strong arming this guy these guptas backed you up when you are dead? no man!! and the fact that he wrote a resignation letter in a friendly way to play them mind games..i think this guy was right and i dont know why dcj and the advocate are making a meal out of this.. "@Albert Noah he is missing the point imagine it was a terrible working environment been watched all the time while doing your job hang on hang on
mbuso sibisi,zuma wants to now what wrong he did guptas came tooo loot sa
Musa Bakiti,But why does he speak like indian?That's what corruption can do. The Guptas abuse Zuma Why going to India not Soweto? @makhosi nobhatyi this is what afrikaaners wanted to see happening
Antonie Goosen,hahaha trust journalists to keep a secret guptas have invaded the chat
tabze,this is Mzansi he's safe @musa bakithi true that Agrizzi ubezwisa shame
Makhosini Nkosi,can someone remove lomgupta flooding here. i miss mig33 click on his/its name. block eita "Zuma must have called him during the break ""we Zondo! coming out with different names. blocked them all oh ok. thanx Keith. first time experience Agrizzi never said anything wrong about Zuma. Oh ok Keith. ngiyabona lol Buyani utsini manje. I am in limpopo bayaloya. lol Jett888 it works like magic. "Nda
Shaun Lukhele,I read Sundaram's book when it was published last year. All the things he is mentioning at the commission today is no shocker. It's literally a repeat of what is in the book.
Moses Magabane,What is the problem with Zondo today?
Khaya Nomoyi,Can he just say yes he was misrepresenting his true feelings and move on.He is not on trial here.He could not have written the letter any other way. He knew the whole arrangement was destroying his intergrity as a journalist. @jet888 I do not think so bcos he hax survived up to this stage of giving evidence. Why is the dcj not intervening and ask for clarity on the threaths he suffered as usual but choose to keep quiet? It seems like he is not interested about the abuse people suffered under the Guptas.
nhlanhla nkosi,gupta bots
monkey about,where are the moderators... huh.... enc jhere jhere
Jeremiah Nikani,just tuned . I am curious as to what bombshell will Rafesh unleash today.
Fickson Makhense,rajesh
Mwamuzi Shadrick,"If you see spam Click on the profile and u will Get options to chose. Chose blocks and watch freely
Sandile Mkhonto,you wrote the letter because they chased you out
Giju Varghese,Gupta physically abused a staff member
Coach,"maybe he sees an opportunity to market his book in SA
Selwyn Addinall,wish they can get the guptas back