author,message
Desmond Masilela,We back guys. Where is Adv Maseko guys? @Tumelo Moruthane. I also think so. ðŸ˜‚ðŸ˜‚ðŸ˜‚ðŸ˜‚ Mine is fine @Precious Ntshangase "@Precious Ntshangase. I'm using earthing earphone... @Thando Nkutha. Nami ithanda ukunginyayisa manje le Lawyer. Ingabe ubani losisi @eskimo_za. Eish bra dont even say that. she's killing my eyes. @Thomas Phekonyane. ðŸ¤› @SABC Digital News. what is this black out now??? Family business
MSG Rules,boom
Dams daily motivations Madamalala,Last day of Bombshell leave Zuma Alone Vote ANC
Yandi Masina,ðŸ‘€ @Enrico He's explaining that he didn't lie yesterday. That the paper didn't afford him the 48 hours. Zondo. He didn't give an incorrect answer. He replied and said he will answer their questions after 48 hours. And they didn't give him that. They rushed to print before the 48 hours. "@Mpura Carlos They asked Agrizzi if the paper gave him a chance @Beril Carey I covered my nose reading it. @Eslon Eslon Pistorius doesn't like Agrizzi. He's shown it from day one. He gets irritated and annoyed and always cuts him off "@Nthabiseng Malebo True. If whistle blowers get attacked like this @King Snitch He's not white. @rohan barnard WingsðŸ˜‚ðŸ˜‚ "@King Snitch Was reading his comments "@Eslon Eslon And yet everytime Agrizzi gives his personal opinions @King Vuka Stop ðŸ˜‚ðŸ’€ðŸ’€ @Thando Nkutha I wish he loses his voice and we get someone else. @Amanda I'd also sit still if there was a bounty on my headðŸ˜‚ "@Mooks689 Reminds me of the guy/chair at the British parliament. Their ""Baleka Mbethe"" The one who screams non stop. Google him." @King Vuka Is he/Viewing not that Human guy? @Sendo Sityebi You still alive Sir ðŸ˜£ðŸ¤”ðŸ¤” @Eslon Eslon The news outlets are leading with the race issue now. Nothing that was discussed this morning is even mentioned. @Eslon Eslon Yesterday's naming of journalists got under their skins. ðŸ‘€ðŸ¤” Blood Money. ðŸ‘€ It he done? ðŸ‘€ðŸ¤” Can Jacob go in next pleaseðŸ¤·â€â™€ "Grizzly Bear
Julia Ndudula,where is everyone?
Njabulo Khuzwayo,Nene is reacting to every word Whose going to be a president of this country after this whole mess? Viewing is drunk Why innocent? @viewing I don't care about the guns you load or not load King indeed @ @viewing shouldn't be listened I'm blocking viewing his stupidity is of another level @thando nkutha is viewing For these guys it easy to attack the whistle blowers but are failing to catch criminals to ever run this country called ANC That lady lawyer is hoootðŸ”¥ðŸ”¥ðŸ”¥ðŸ”¥ðŸ”¥ guys I'm guilty as charged Who is this guy with his bad hair Mahle loyamtana ngathi uzothi Baba Maka mansion akho okugeza â¤ï¸â¤ï¸â¤ï¸â¤ï¸ðŸ”¥ðŸ”¥ðŸ”¥ðŸ˜”ðŸ˜”ðŸ˜”ðŸ˜‚ Yea crcly the jackpot is 170 mill guysðŸ˜”ðŸ˜­ðŸ˜­
Malopo Rathobela,"Viewing I love this Agrizzi guy "I think it's time we respond using our own home languages "@Thando Nkutha  Also blocked Viewing "@david cele  "Viva Agrizzi "@Nthabiseng Malebo  "@S Ntapane  Thank you Mr agrizzi
lucky Molepo,are we back
Bas Mdaka,@Viewing rubbish Well done Agrizzi We are proud of you Agrizzi @Pitso Mosetlhe when? @Bridgette Kekana are you dom? History will remember you Agrizzi - you love our country We need more people like Agrizzi in this country - people who are honest WOW Agrizzi
Myka'Al Daud,Viewing is ICC not waiting 4 De Klerk and his ppl Land thieves must go to jail in Australia "How can you pay 4 what belongs to u "No Viewing u got it all wrong Foreigners will obviously pay if they want to use our land Stop your fear mongering propaganda Viewing I don't pay 4 what belongs to me but a racist like u must pay Without any bloodshed land will return to rightful owners No shooting Viewing u ll peacefully surrender the land And u ll surrender your tractors too Viewing Stop joking bloody land thief U came with nothing and u ll leave without nothing thereafter kill original inventors Viewing are u an ANC member? Stop lying u r ANC u won at nasrec Viewing
Mpumezo Haka,On twitter are ANC and Journalists roasting him for lying to discredit him loool This Zondo sounds stuoid naye...he did not lie because he did not respond to questions
muneri rembuluwani,it's like I missed out a lot
Kusta Freddie,"but how is this ""responding to ST or not"" relevant to state capturw?" I think Pretorius is trying to discredit Agrizzi's evidence because he implicated the commission's secretary
Chris Langenhoven,zuma must go to jail Hy Viewing stop jou K4@K @eskimo_za don't go there I am I white Man
Talloolah Moon,Yes. Orange for jz Grizzi being grilled Looking forward to Trevor King snitch! Hardcore
rohan barnard,wasting almost the whole day for this mamparra press of SA "Viewing wa phapha "Vewing ke mo blockile ko nna What are they doing now? I had to take a phone call. There's this thing called work interrupting my viewing "i'm not racist ðŸ’© is getting real now! what is makgoro comission of inquiry? @Michael Michael thank you so much for the clarification. ðŸ˜ƒ
Sicelo Jano,He supposed he went long time to jail u baba ka Duduzane there is enough evident "They messed up this country to much "But they were tooooo stupid real "Don't be a lecture here
Siyabonga Mndawe,BOSASA MUST BE HANDED OVER YO A YOUNG ANC MEMBER LIKE ME "I WILL IMPROVE an established business should not go to waste i think so too the country is anc david lol cant belive you just said that why are white people so angry? e.g VIEWING YANDI YOU KNOW HIM OR HER I BELIEVE YOU YANDI LOL VIEWING IS USELESS YOUR SO DUMB EVAN IF IT WAS TRUE WHAT YOU SAID YOUVE JUST TOLD US THANK YOU ENGLISH TEACHER WATSON IS WHITE PROBABLY HALF WAY THROUGH THE ATLANTIC WHAT HAVE YOU INVENTED VIEWING? WHAT ABOUT YOU WHAT HAVE YOU DONE SO FAR TAKE THEM @VIEWING GOOGLE AND YOUTUBE ARE SOFTWARE NOT TECHNOLOGY âœŠ
Malie Maqam,"Viewing all whom you've mentioned will go to jail with this racist called Agrizzi "Viewing what I like about this is that he exposed that it's not only Blacks who are corrupt "Viewing you are even hiding your name because you are a coward "It's a pity that we are dealing with one stupid who is a racist If you want to know the real history go to London Libraries they will teacher you the real history that is not distorted for propaganda "@viewing
Talent P Sibisi,Agrizzi boy tells us more baby Mr Zuma and your friends look what's you did but ANC will defend him check the space no one will touch this guy Agrizzi we need the truth here we don't scade of White Monopole here Baleka she's nothing and she will do nothing to us as a EFF here mnxn what's happen to the sound @Thando thank u âœŠ Baleka she think she's clever here not this time we prepper fo #Sona2019 this time cause we need Agrizzi This is Black People's Land not White or Pink people shirt here we tired of white monopole in South Africa now mnxn . Am not goner pay a cent for my Land Am done Agrizzi starting to hide something there Helen Zile maybe she's there hmmm People can u Vote for me as a money keeper @viewing he's staying @KZN Durban KwaMashu come en visit him @Kekana this is Money Bru kwaaaa nobody will kill someone here we don't need Gramma here @viewing stop viewing our post kwaaaaaaa @cele whose crying Ramanyusa where are hmmmmm @Viewing who told u Data made by White people fuseg mani mnxn @viewing who told u that's someone was playing with @viewing White people always still technolodge to Black People calm now Ramaphosa is look like old KFC eater Marikana vs Ramaphosa asikhohliwe @viewing please pay a respect to us a Black People u staying in our Land for free behave ok son @viewing get someone whose goner translate this for u (Umhlaba wokhokho wethu lona sowulwela and sowufela if sifela kuwona sojabula futhi ngoba izizukulwane zokwazi ukuthi salalaphi) @viewing u Racist get out on my side u Agrizi brother
jeevan singh,Please leave racism off this platform or leave. hi all is the picture frozen is it just me.
Kevin OConnell,Zondo is being fair with regards to this Press issue @Nthabiseng Malebo - I agree with you fully Eskimo - Cool Down ðŸ˜‚ @ Nthabiseng Malebo - Fully Agree @Emmanuel Phaladi - Agreed but this is about Corruption @Nthabiseng Malebo ðŸ‘ðŸ‘ @david cele - I agree with you @Sthakathi Khumalo Love it Great reply
andries mbethe,It's tough
Lesiba Chokoe,@david cele u can block this viewing Viewing is blocked
Lavhelesani Ramudingane,ANC IS NO MORE I THINK EFF IS FOR CLEVER PEOPLE ðŸ™ˆðŸ™ˆðŸ™ˆ WHO IS COMING AFTER AGRIZZI? I LOVE AGRIZZI AS WELLðŸ’žðŸ’žðŸ’žðŸ’ž WHOEVER IS STILL SAYING EFF STOLE VBS MONEY IS STUPID AND CAN'T READ. ADV. Terry's report never mentioned EFF AGRIZZI IS A HERO AGRIZZI MUST NOT BE ARRESTED AGRIZZI FOR SA PRESIDENT
Malebo,Why are you people fighting about race and â€¦.Lets stick to the point. If Agrizzi is willing to assist in any way. Why get a court order "Agrizzi was right when he mentioned to the chair before lunch Pretorius is making it difficult for Agrizzi If I was Agrizzi I would leave this country after my testimony. "Guys They are on an adjournment. The sound will be on when Zondo returns "Definitely Ramaphosa We are all racists mane. Get over it. Lets look at the facts of the testimony Pretorius needs to shut up now. "Agrizzi looks more refreshed after lunch break "Yes Watson has left the country just like the Guptas. We are all racist under pressure "True "They thought he was just a messenger "So Why are you all being so rattled by racism. You people (Nandos) all need to chill Why cant Ramaphosa pay the money that he stole. TRUE Do you know how Ramaphosa became so called rich "We all don't know how these thieves got their money So we cant come here and say Ramaphosa did not steal money Manuel is also corrupt. true "If I was in those circles "Ramaphosa is going all over the world to get investors "The VBS's real story is also going to come out haha They paid the wrong person to keep quite You are all so tense. We should all get together for a braai. Racist blah blah. Missing Agrizzi's point This country needs more people like this. people who will just call a spade a spade Eskimo needs help Zondo is out of order. He failed to protect Agrri Agrizzi is an honourable man
S M,Because not all whites were named
Bevil Carey,ROTTEN BALLS??????? Yandi hectic.......lol
Eslon Eslon,"chair plz protect Agrizzi Pretorius bullied Agrizzi and even make prejudiciary conclusion that Agrizzi motivation to testify at the commission was racism. Is that his position to make such a statement I wonder? @Yandy Masina "@Yandi Masina "@Bridgette Kekana The commission need to look into Agrizzi information not on the basis of his skin color or motivation like Pretorius wants us to believe "@Yandi Masina "@Yandi Masina SA Journalists are bunch of compromised and embedded individuals who's there to advance agendas of certain politicians and those in power "@Bafana Thebe
Isaac Tau,"This was an eye opener
Precious Ntshangase,We are back Volume is too low@SABC Digital News @dESMOND...U ARE NOT USING EARPHONES ARE U ?ðŸ˜ƒðŸ˜ƒ. i can hardly hear him @eskimo...i have her number ðŸ˜ƒðŸ˜ƒðŸ˜ @Desmnd. Cool There is double voice... Oh yes..Viva Babes Agizzi Viva Now i will bored without Agrizzi ðŸ˜“ðŸ˜“ðŸ˜“ Dankie man
SBH Shembe,We are back indeed safe as any rat can be Watson Crime Family If you are still stuck on the race issue then you have no idea what this universe is about .. "People are busy pointing fingers at Agrizzi
Pitso Mosetlhe,so Next on the stand is Trevor Manuel I hear... Trevor Manuel is next after Agrizzi NEXT WITNESS???????
Thali Favourite,is he safe? "how many pages are there  shame he is so cute and innocent loolðŸ˜§
Karabo Qokolo,this pretorius now is trying harder than required
LalaLee Melz,agrizziðŸ¤£ðŸ¤£ðŸ˜‚ he'll go bck to Italy with his whole fam... most def I would... he's aware he is not safe.. nthabi many will now come forward Malcom... in local municipalities even s ntapane amongst themselves.. tribalists of note
Mooks689,Viewing yes I rather pay lease to my government viva EFF viva Viewing is acting tough he is scared so death Viewing google Dr Mark Dean a black computer engineer who invented ISA bus. He holds three of nine PC patents for being the co-creator of the IBM personal computer released in 1981 howzitcal so this stupid called Viewing is using our technology Viewing ðŸ˜€ðŸ˜€ðŸ˜€ the land issue doesn't sit well with u I can see but watch the space
nepo .molefe,guys who is the lady on the right to Pretorious Yoh she's fire man fire ðŸ”¥ ðŸ”¥ ðŸ”¥ ðŸ”¥ ðŸ”¥ @precious this girl is fire I can't concentrate anymore "guys let's talk about this lady @njabulo brah like who is she and she's not wearing a ring ðŸ’ survival of the fittest there she is ðŸ”¥â¤ï¸ Yoh Yoh guys am I the only one dying here this woman is damaging me virtually guys the jackpot for the lotto is R170 million today leave the land play lotto ayi people on YouTube take each other too seriously AkA is getting roasted soon do you think he'll tell us the secrets of Bonangs weave?? @Vicky can I order ðŸ˜‚ðŸ˜‚ðŸ˜‚ðŸ˜‚ðŸ˜‚ðŸ˜‚ @chris ðŸ˜‚ðŸ˜‚ðŸ˜‚ just banter buddy don't stress corruption only knows a bank account can it please be my bank account ðŸ˜‚ "this guy was gonna get 5 million a year too keep quiet @Abongile Eve the one who ate the apple is the cause of all this nonsense ðŸ˜‚ "but he knows it so it's fine I would also be corrupt and am likely to be corrupt but I would steal 1 House and give back 9 "steal 1 House give back 9 "Im a consultant also the lawyer on the right is so beautiful wow fire ðŸ”¥ ðŸ”¥ Nthabiseng lol some things are just meant to be admired leave it there just look at it I need an ewallet from Agri
Dumisani Snr Mlotshwa,Well done Pretorious
Oshimana Trading,How safe is Aggrizi from those anc thugs? @viewing u are racist like Agrizzi @viewing ... this is Chinese superiority @viewing I ll block you from this dialogue
Nodz Heunis,lol eskimo Nthabiseng.. for sure!! @ Njabobulo lol no idea @ eskimo i see... Where is Watson? run boeta run! @ Abongile hes runing im sure Rashid thats true LOL Mokheleli hes smooth. @ Tumelo i agree Anne M.ðŸ˜‰ @ David Cele im sure he does not have a wife @ Bafana he knows EVERYTHING! @Tebaza al;l of them should be arrested
Dmitry Nikashin,"Zondo always remains so calm
The Vuka Experience,Have we been back long? @Yandi Masina sounds about white ðŸ˜‚ "Anyone defending Agrizzi @Viewing sizakunyisa thina vha! "Block Viewing hiding behind a fake page. If you wanna be racist @Viewing technology is an Asian invention not white. @Viewing even architecture is Egyptian and wholly African. Stop ðŸ˜‚ @Viewing is those coloureds that think they are white. Come get your people my coloured brothers ðŸ˜‚ "@Doom Ruler ðŸ˜‚ðŸ˜‚ he comes here with his dinner table facts ðŸ˜‚ @Doom Ruler comrade you have this guy under control ðŸ˜‚ "Anyone saying EFF is VBS @Viewing but the Xhosa fought the first frontier war in the 1700 with the Boer near the great fish river... but they came in the 1800? ðŸ˜‚ you are dumb "@Lavhelesani Ramadingane rubbish @Viewing whites have literally colonised 90% of the world. Who breaks down countries? @Yandi Masina looks like it. Who is next? Agrizzi is DONE
Craig Heath,Myka typical mentality who probably owns nothing Watson is a big Tsosti
Amanda Bentsile,Which one Akambi latata uhleli ecakwa agrizzi @King Snitch LOL @Malibongwe Mthimkhulu blocka lekaka
Doom Ruler,no need for threats in here.... The land Shall be shared @Viewing every race commits crimes @Viewing there are more blacks anyway sooo... Boere and English killed blacks and incited intercultural war go to the history books @Viewing anyway we are here for agrizzi... we can chat about land and farming blah blah on those streams @Viewing We landing for the land homie cleaning out corruption then landing @Viewing you have it totally wrong !!! the internet was invested by the algorithms of a Nigerian mathematicianðŸ˜‚ðŸ˜‚ðŸ˜‚ clearly your history book of European descent ONLY come on ðŸ¤¥ @Viewing nah bra... your history is fake news... you talking to someone who researches for a living @Viewing you are FAKE NEWS *Trump VOICE* @Viewing is that your response when you are losing the convo ðŸ¤£ðŸ¤£ðŸ¤£ðŸ¤£ðŸ¤£ðŸ˜‚ðŸ˜‚ðŸ˜‚ðŸ˜‚ someone get @Viewing a can of soda ðŸ˜‚ðŸ˜‚ðŸ˜‚ðŸ˜‚ðŸ˜‚ðŸ˜‚ this @Viewing ðŸ¤£ðŸ¤£ðŸ¤£ðŸ¤£ Day made @Viewing voodoo needs no gun homie a gun vs which craft??? @Viewing food for thought @david cele he is a computer thug ðŸ˜‚ðŸ˜‚ðŸ˜€ @Viewing whats your address bra? @Viewing ahahahahahaha why are you scared all of a sudden? you scared of being voodoofied? ayt... let me get your IP address quick and let the games begin clearly @Viewing maaaad shook @Viewing set up a meet? ðŸ˜‚ðŸ˜‚ðŸ˜‚ðŸ˜‚ðŸ˜‚ where did yol get this guy!!!!!ðŸ¤£ðŸ¤£ðŸ¤£ @Viewing uli'bambe linga shoni @Viewing why you so angry? we all out here relxed stop being angry @Viewing we gonna take land ... you must not leave SA...
S Nompozolo,Guys what did i miss lol ðŸ™ˆ Who are these watson people guys @david cele I AGREE. HE MUST BE PROTECTED
Bridgette Kekana,l like Agrizzi but he dropped yhe Kword they are going to judge him by this eo @SibisiðŸ˜‚ðŸ˜‚ðŸ˜‚ Watson was ceo at armscor eff is vbs @ Bas why are u saying that @Bas l wanted to say Kevin Wakeford the chief executive of Armscor l m waiting for Jessie Duarte s name 2 b call bcos her son in law is connected with the Guptas then they are all corrupt to y aaaa @David you are a liar Eff is vbs Anc are devils l think da it is a lesser devil
Abongile Mabona,I hear the Sheep is not indigenous to South Africa. I wonder where we stole it from. Where are these Watson? @Nodz Heunis beacuse This Agrizzi guy is on top of his game. See Mr Zondo Glasses are off now too much Evidence Who taught people corruption? and SONA is on its Way THIXO @david cele even worse after the evidence that has been put forward from this SC Inquiry. "@Viewing who said Xhosa came in the 1800s I refuse to argue with blind fools @david cele I agree with u...He is took a bold step
michael mbatha,That lady is average. There was a better one before in a bob cut much earlier in the hearings. This one is naaaaa
Nelson Musoliwa,I think agrizie is aware that he is to take as much as he is giving because beneficiaries of state capture will never give up without a fight as Joel warned Truth knows no color lets stay posted
Mfazozo Mthethwa,mmmmm
Anne M.,"@Bridgette Kekana yes "@diko tana no Viewing is a trol trying to get attention. @Thomas Mathada I agree with you. I think there's a lot we haven't heard about. @Frik Brits click on the 3 dots to the right of his name and you can report him @Frik Brits ðŸ˜‰ @Awande Mncwabe The prosecutor made it clear that Agrizzi will have to answer for his racist comments. It will be dealt with separately. @Awande Mncwabe ðŸ˜€ "@Lee news affairs Probably. I would
Jake,english can not kill people! is the is still the Zondo commision ?
RASHID SEIF,violence has n0 african roots unless history was not part of your studies corruption knows no colour "Guptas 
Johan Peens,I agree
Lee Majiya,sound please Thank you Mr Agrizzi for your corporation and for opening our eyesðŸ‘ðŸ‘ðŸ‘
Bonolo Easy Masomeng,Can you just leave Agrizzi to testify please.
Scyaa Glad's,petrol price likely to go up in Feb
Geomar Services,"Please
S Mhlabase Msibi-Gordon,what now????????
Sandile Mabika,"i am a racist  i dont have time to listen to racist people like the Liar Agriizi. agriiizing the racist
Ruaan Sauls,viewing is a bitter person...and stupid viewings is a scared boy...thats why he is hiding just ignore him man.
Siba Mfabe,"Viewing You not Logie Baird buddy "@viewing "@Viewing  "Viewing is a TV that has no aerial "@Mokheleli Teboho  "@Doom Ruler  Viewing you are losing viewership Baba!! His View is blocked Money started flowing at Johnnic. Viewless. did you know automatic shift and blood banks. black inventions "Street Robots Viewing... @Bronx Wavy included unwillingly. Eish
Van Lier Dreyer,go chair. sloooooww2wwwww this all bullshit hiding what
Tumelo Mokoena,just joined. Any names exposed today? @Anne M. ok thanks sister lets all stop watching the State Capture Commission. It cannot get any better after Agrizzi
Nolan Mutota,Hai mani Grizzman you are racist also
Lebo Pie,Azishe.... Dankie Grizzo...
rella makatsa,let's focus. this is not state capture on land NO TO LAND TALK HERE PLEASE
Denver,eish eish
Dries Koatsman,"This platform is for commenting about the commission not your stupid racist and land issues
Mali Mthimkhulu,Agrizzi is a strong man he was also part of the corruption @Viewing he is coming clean with lots of money from looting @Doom Ruler what is my IP address? Admin please remove @viewing from this chat and block him from Youtube for 3 months aDMIN PLEASE ðŸ˜‚ðŸ˜‚ Agrizzi planned this ahead of time. he was smart the law is all about being ahead nothing else Eff will heckle Ramaphosa in SONA they will ask him about Bosasa and andile Ramaphosa there will be no SONA You cant trust Mail & gurdian that is 1 corrupt news company you cannot rely on. same like Daily Maverick True @Kapn Krunch Ramaphosa did not steal to become a billionaire @Viewing Blacks have invented so many things but some of the inventions were not patented and the ideas were stolen @Viewing there is a student from the UCT who invented a water filtration system that was stolen by the Western cape government @Viewing yea do your research about many inventions blacks are smart
Kgomarediyakokotane Nna,this guy is so relaxed ðŸ™„
ahmed mohammed schoItz,Agrizzi for minister of corruption
Takalani Mathada,"I strongly believe Angelo has more to tell "One thing which didn't go down well with me is the fact that Angelo is a racist âœ
Lex Campbell,"Viewing gerrara here man
makhosi nobhatyi,Why proceeding not running? "There are still more witnesses who will come to testify This guy I salute him âœŠâœŠâœŠAgrizzi âœŠâœŠâœŠ Manuel is next he will expose Zuma
Kapn Krunch,ofcourse he has more to tell he is just condemning the small fry but the big dogs who pull the strings wont be named big dogs dont hustle for a few million they are billionaires they seek more then just money they are trying to create a better way of life with a more docile population and look how docile we all are we should be storming government we should be analyzing the documents ourselves and throwing people in prison left right and centre condemning the small fry means nothing they are expendable WE WANT THE MASTERMINDS you know that rhamaphosa got his money from trevor Manuel controlling the government employee funds and investing them through Alexander Forbes the big dogs wont be touched in this charade rhamaphosa didn't steal his money rhamaphosa was given it through a black upliftment program rhamaphosa got his money from trevor Manuel controlling the government employee pension fund and investing it with Alexander Forbes then trevor gave rhamaphosa a share of it that's how he got his money aka rhamaphosa didnt get his money through hard work he got it through a black upliftment program imagine how many other blacks could have been uplifted with that money that's in the billions payments that flowed from Shivambuâ€™s brother Brian to Floyd and the EFF that's evidence right there stop being so ignorant showing the eff benefitted directly from the VBS looting they want you docile they want you inactive they want you to accept corruption do you think this whole show isn't coordinated the people who will get burned from this are expendable it's like the Roman's entertaining people in the Colosseum back at high school my brothers used to say do you know who's the most racist people here its us because we even hate each otherðŸ˜‚ our very laws are racist affirmative action
Frik Brits,This channel need moderators for people that swear like @Viewing !! @Anne M. done Everybody is off the topic here Pap and vleis is the best thing for me too.
Awande Mncwabe,am i the only one whose still upset after hearing the clip that was played...i cant believe people are still racist in 2019...i dont get it. is it ever justifiable to be racist on the basis that you grew up in apartheid...as the South Africans do we forgive grizzi for the clip that was played? @Anne M thank you for your response ðŸ˜Ši must of missed that part.
Dan Bourne Yeshurun,@Awande they were kids in apartheid umm he's racist if Agrizzi can be President for being honest.... while being racist its cause and effect blacks never built a system of racism. they were jst included but she's amateur why should a non innocent man be president tho yes @Siba then blacks are called racist after being marginalised. thank you kapn
Andrew Mabele,Aggrizxi should be arrested for acknowledging that he is racist- Vicky momberg will be the case law
Phumlani Lukhele,@vicky ill have two pleaseðŸ› @vicky wheres my food bra @Vicky Kgoete bengicela uphuthu nesishebo senkomo...no-ice icream
Gert Marais,Awande this will never stop.
Nicko Opiyo,Why whites are always saying Malema is racists Malema say it as it is
Wildthing,He is bad. But he turned against his own. That is a lot
