author,message
Wildthing,wow too late all info is already with investigators. all they had to do was ask the current farmers in the area if A dairy farm was a good idea. and was Ace's daughter there They will need to look for photos
OMAR AREND,he needs life support before prosecution of these thugs
Nkululeko Zondo,This witness looks so troubled in his spirit.
kagiso william,The interpreter 👌👍🏼
Xolile Gaba,Corruption is being exposed
zipho mhlongo,eish ayii straight answer
Vincent Nunes,"@goolamv What do you mean by ""a big deal"" - she is Senior Counsel and undoubtedly receives high fees and (considering she is SC) ...." ....is highly regarded by her peers. Don't equate exposure in the media (ie. Barry Roux types) with success.
Washington Dube,straight answer
Jabu Malinga,"PP will never resign. just lik zuma "honourable ppl resign
Dams daily motivations Madamalala,yeah Guptas are here for money Not love❤
Ngwato Makanyane,u must speak true Mr motaung to help commission
Thabo Zuke,sisahamba kahle lol
dumisani zwane,"do you think there is catering in the inq