author,message
Colin Yates,C v
Freedom now,a country in trouble!!!!!
welton paulse,"fedility @Desmond Masilela . does that not have anything to do with President Ramaphosa? "This guy looks very much like Mo Shaik SABC as always is proven to be run by Palookas this guy is trying to confuse the commission Jirre SABC making us watching this in chapters SABC is captured SABC is making us watch in SEASONS And this guy talking in circles is not helping us "@Yin Yang someone at Eskom is poking the load shedding button I am telling you guys this is ESKOM's doing Wonder if he was using hands free mode when he received the call. "Someone at Eskom has their finger on the load shedding button "@SABC Digital News like President Zuma once said these Houses and HOMESES "@Kurt Samson  "@Kurt Samson "this guy is dressed by the Guptas Where are those whatsapp messages? Why is this guy staring at the roof? someone hiding in the roof with answers @Desmond Masilela or he is saying Oh Gosh they gonna catch me out @Sofia Sofia very much true Oh crap Koko at it again "@Michael Rijsmus I said it this morning @Sofia Sofia i think its more complicated than meets the eye the Mafia that ruled ESKOM was very much strategic "Problem with corruption of this magnitude @Felix Muyoba . so you say that ALL and I mean ALL Indians are corrupt? "@Felix Muyoba biggest mistake is we tend to generalize people to quickly and for no particular proven fact
Desmond Masilela,Fidelity is the company now know as G4 @Lucky123 Thwala . Yes lucky G4s. "@welton paulse. I'm not sure Why am i getting all this advertisement Guys are you all getting advertisement? This man is trying to avoid the question. @Lucky123 Thwala. This man think his clever. Look at his eyes. Something is wrong with the proforma invoice. People looting the money and they end up changing names. "so all these people that are mentioned here @Thando Nkutha. Then the whole team must come forward to tell us what they know. Aiboo!!!! SABC please fix the problem. I keep on getting advert here. "SABC we cant keep on asking one thing all the time I cant recall This black out is still persist? SABC please @Briony French. 😂😂😂 This commission is wasting time with this guy Guys we are in the middle of discussing this guy and the commission here. So this thing of race should be stop. please. SABC i thought you sorted out this Black out during tea break. He can not recall. That is his answer. @Felix Muyoba @Peter Staffen The man can not recall anything. "@Felix Muyoba Look now @Peter Staffen . I get your point. "This is why i'm getting confuse with this guy. if he can confuse the adv You transfer the money to someone now. They tell you it need 24hrs in order to reflect to the receiver. But this one just go direct with no delay. Mine too. @Kurt Samson @Felix Muyoba. Imagine sending such a lot of money and it reflect same time. 🙆🙆🙆 He accept it was a wrong procedure but he still continue to do it. @Felix Muyoba. Now the cuts from 659 let them in trouble. This is because of greedy of human being. @Felix Muyoba. Now they must feel the heat. @Felix Muyoba. I'm sure the chair will do so. @welton paulse 😂😂😂😂😂 Maybe someone is giving him answers. @Felix Muyoba. Lets hope so because this man is trying to hide the truth. Haiiiboooo!!!! another 728m except 659m!!!! So you mean they must just leave them? with no arrest? Then what is this commission for if no arrest will be done. @welton paulse 😂😂😂 The man is scared he think they might arrest him now. He ask the question but he fail to ask why this rush rush of money transfer because that was benefiting him. @Felix Muyoba. yes the suppliers must also come forward. We cant deal with this man alone when we see his telling liar. I would rather do the right thing than do corrupt and things that will let myself in trouble one day. His trying to build his version I'm not white but i can tell that not all white ppl are racist trust me. We must understand something here. Not all white ppl are racist. and you are not born racist but you are taught to hate black ppl. therefore ppl must not mislead other ppl.
Lucky123 Thwala,g4s speak to Mic my man. this bustered thinks we are stupid yeye phendula stosti. this is a problem can't recall he he fulling the system Mara sabc. let's get warrant search for his house we will get money hiding.
Jean-Pierre Le Roux,A CA with deep pockets "@Mzalwane Mzala  "@Mzalwane Mzala 
Mzalwane Mzala,Civil servants are stealing money and you blame the ANC. Mxm He was a politician I find this funny because all the ANC haters want to pretend as if they are now dissapointed by something. You hated the ANC for all these years and that did not break it. The 'broken' ANC's definition of failure in these elections is dipping below 60%.
Derek Main,@Yin Yang True that - either that or they are dof @Mzalwane Mzala Civil servants!?! That's almost as disingenuous as saying it's individuals and not the ANC @Mzalwane Mzala The ANC can't wriggle out of there responisbility for this mess so easily @Mzalwane Mzala What find very unfunny is that the ANC voters have supported this looting of our fiscus for all the years and don't see anything wrong with it. They are all complicit And BTW I haven't always hated the ANC - it was only when it became blatantly obvious that they were in it for self-enrichment only that I started hating them. "I don't think that Indians are any more prone to corruption than anyone else. As we have seen in the last few months "@Indoda Yamaqiniso Besides executing them @Indoda Yamaqiniso Well what's the alternative - just let them get away with it? @Indoda Yamaqiniso Sounds pretty racist to me "@Indoda Yamaqiniso It's like me saying ""All blacks are criminals"" It's a generalisation and since not all blacks are criminals "You also didn't say ""some whites"" - you said ""whites"" which implies ALL whites - thus a generalisation" "Who is ""they""?" @Indoda Yamaqiniso It's quite clear that you're an out-and-out racist @Indoda Yamaqiniso Show me one statement of mine that is racist. I can show you plenty of yours that prove you are a racist I rest my case How juvenile. How old are you?
Welcome Kamogelo,tm
Willem van den Berg,nope Desmond Install Adblock Plus in browser
Noreply Internet,These adverts are killing me
Robert Russell,And the thiEEFs are in waiting for their turn to eat @John James They keep playing me adds every minute or so.... Just watch the number of people watching.... it jumps around all over the place.... SABC has started to make money from showing adverts.... but they have cocked up the setup parameters.... that's why you get black outs as well get adverts way too often.... but get used to the idea
Bongani Mpapele,Hahahaha crystal clear lie R659m is not a high amount???
thabelo justice mulokwe,"these insignificant witnesses are coming here to do one thing
Tich Ziny,cant recall how my face looked like before more like con artists Bawethu! "@Bridgette Kekana
steven chisa,hey who ever is controlling this channel I don't know when u leave u home u says u are going to work to do this this thing today is a mess sabc must be desolved is so useless to really on it
Michael Michael,sabc technician this sabc drunk into 4 only 4 board member.this is boring.
funicanz,SABC Technicians... Seriously...
Thulani Bukani,Why does this channel keep buffering??? Jeeeeeeeeez!!!!!!! Is enca streaming? I can’t find anything on @enca @SABCDigitalNews come on maaaan!!! Tyini I even dropped my resolution all the way down but dololo I’m not getting adverts. I’m getting buffers the whole time. They’ve successfully halved the number of viewers. Mamela wena @sabc khazi. Susqhela wena. Utheni ngoku? Utye iyeza lohambisa okanye ungenwe yintoni? Does the commission play on DSTV?
Njabulo Khuzwayo,Why are we buffering😔 Come onnnnn sabc this not right m Christian W looooool sure we do😂 Walton paulse that's racist Buffering again I'm sick of this
Yonam Daudi,having difficulty to streaming today why sabc are you doing it purposely which other streaming services can we go to please still monopoly but insufficient because it is Tegeta sabc stuffed in still look of things sabc has lost the battle of fixing live streaming
Sandile Khowane,"SABC is not respecting us here
Ntokozo Kunene,this broadcast is a mess today. Breaks every 2 mins followed by ads and more ads.
Neil Fraser,Desmond - and what is the cost of this product by now to pay everyone to Jewish - and everyone draws a salary Oops - jeees Has anyone counted the number of people involved in a purchase? Get out of here Yose. Your derogatory comments not wanted
Epnet Streaming,Sorry for the blackouts we are experiencing EMF Waves SABC Yup the video has not been captured correctly! Seasons yes that is correct hehe ESKOM has also captured this video send pulses to destroy us Say what you like no one at SABC is watching these comments Whew I think 7 depsrtments EMF Waves are causing these blackouts
Abo Macala,He avoided the question
Wihan Booyse,i thought my internet was buffering
Michel Basson,i get a lot of Shoprite adds the whole time stuffing up everything
mike molefe,SABC must be unbundled into 3 units
M T,What the? Hi all - will check back later. This will make me strip my “bolts”.
Cassius Mngomezulu,i dont know Bathabile is married to Dlamini for your info no sotho
Suzanne,Just keep reporting and blocking Yose...
Fils de l'homme,Hello to all my BANTUS Hello to all Caucasians Morning to all the Coulies and hotentotes @Yose Human u r right about the African NAtional Crooks (ANC) why is South AFrican Bantu Corporation (SABC) having an unstable connection @Lucky123 Thwala SABC is South African Bantu Corporation @Robert Russell Vote for the FREEDOM of the TRANSVAAL @Van Rural Boy Myeki VOTE for the FREEDOM of the TRANSVAAL @Felix Muyoba waat gaan aan? @Munyaradzi Chivhumbu VOTE for the FREEDOM of TRANSVAAL
Peet Venter,My goodness! Can it take sò long to satisfactorily explain one point!
Makwa Choma,"Yose that is not true
Anne M.,Hop over to eNCA. They're interviewing someone at the commission Tea @welton paulse I'm going to watch the eNCA broadcast. No problems there
Sofia Sofia,Hi All is this over or just tea? Thanks @Anne M. How Ads ! how did that happen wer do they get stupid ADVs from ? seriously this one is a snail in peanut butter ! @Cebo Khumalo your point ? @Gcobisa ntsatha your point ? corruption knows no colour ! what's this nonsense with ads! This man is a liar and he should just leave the stand .... wasting my time with his BS @Sthakathi Khumalo I don't think its nice to make such comments ! lambaste this man not Indians on a whole . Absolout It feels like open season for liars at Eskom ! Eskom are like commercials?You can't believe a word they say ! I think if he spoke the truth he might have made sense ..... Did he resign from his position ? Or did he continue knowing what was happening ? @Bridgette Kekana @Felix Muyoba No human race is superior; no religious faith is inferior. All collective judgments are wrong. Only racists make them ! its because of people like @Bridgette Kekana and friends our beautiful country is in shams !
Briony French,How does adverts come through on a live feed?
Lindikaya Myeki,Fraudstars
Felix Muyoba,@Van Rural Boy Myeki agree @Tich Ziny true @Desmond Masilela these guys were all accomplices meeting at night? "@John James in the name of clients but the money was coming back to their pockets again it is a messy affair at eskom @Desmond Masilela he was an accomplice in looting eskom as well @Desmond Masilela i follow your argument @John James remember that suppliers will promise him that if you effect the payments as soon as possible we will give you a tip..and then he does that without thinking of the consequences "no man why such a hurry to effect the payments without following the accounting procedures? @Franco Gresele agree "@makhosi nobhatyi no man @Franco Gresele hahaha please you are too radical on this @Indoda Yamaqiniso true and this needs to be changed @Desmond Masilela those guys were all benefiting from that money.. @Desmond Masilela imagine.. "@Christian W hahaha "exactly they just wanted their cuts from that 659 million @Desmond Masilela yebo @Desmond Masilela i wish the suppliers are also summoned to this commision @Desmond Masilela perhaps they (suppliers) may open up more cans of worm just like agrizzi "hau "exactly @Desmond Masilela that is why we need the suppliers to also come and tesity..perhaps they will tell us that we paid him to effect that payment @Bridgette Kekana haha @Sofia Sofia @welton paulse @Sthakathi Khumalo given the guptas saga..i am in support of @Bridgette Kekana @welton paulse no..not all but some @welton paulse but remember the fruit of a tree doesnt fall far away from the parent tree..it might be true this guy was creating blank cheques for suppliers zondo is right..that is a blank cheque prinicple
Eslon Eslon,who's this guy. Just join in now what's his name and position at eskom? "@Desmond Matshela Koko!
Munyaradzi Chivhumbu,malema to rule SA land to blacks
Dams daily motivations Madamalala,Hi guys Is the Education they get when the were young Supremacy & Building Asset not House
Cebo Khumalo,So many Indians at Eskom😧?? "It’s actually a question "When we asked this question about the medical campus at UKZN
Sithembele Tutuse,these ads on my screen are disturbing
teniford jackson,following closely from Zambia
WEBSTER MTHULISI MNCUBE,lol
Sanele Myeni,KUSAZONYIWA APHA
Gcobisa Ntsatha,"wow
PETER STAFFEN,"Desmond Masilela he is also giving lots of other info 
Sthakathi Khumalo,"Amatsheketshe ayantshontsha suka The ears are even moving along with the hand gestures.. Gupta cousins.. ziyafana lezinja ziyeba suka!! Another Naidoo Indra Reddy looools!! Did you send an email or something? "Sofia Sofia Typical Gupta associates then Zondo got him!! He was indebt and needed money this one!! He was following instructions he says!! "Felix Muyoba I aggre Bridgette Kekana haaaibo bazokuthelekela
TOMÁS GAMER,absolutely "very clever these guys he knew exactly what was happening "these criminals should be tried in a Kasi Court this guy would win an oscar "criminal "so all this happened in his absence they will never be arrested? this is all a waste of tax payers money the leader of business at the time Cyril and Pravin and the rest knew exactly what was happening "gents and ladies "Indoda "i agree Magda "all i can add cheers
Pamela Sibuta,what's wrong with Sabc today ".
makhosi nobhatyi,If boss speaks it must be done quickly 😃😃😀
Indoda Yamaqiniso,It looks like 99% of the people at the management of Eskom are white and Indian; all foreigners on our land. It's all talk with less documented evidence here "It's Eskom More jails and even more money to keep them in jail. You must be special kind of stupid. do you know how much does it cost the state to run prison settlements? Sending a person to prison for stealing money is a stupid thing to do as you will pump more money to maintain him/her. I bet that's why we chose not to send Apartheid criminals to prison. "I do not mean anything You can turn to eNCA While the family rejoices that the killer of Reeva Steenkamp goes to prison and justice is being served; the reality says the killer is being rehabilitated with state money. Just a typical example right there. ...if you're smart "Corruption is strife with white people "Black diss one of their own together with whites and when it's a white person in the limelight How is the truth racist? "Hence I didn't say ""all white"" people are corrupt. I said corruption is rife amongst white people and they protect each other no matter what "This thing of being loyal to other whites If you tell them today that Apartheid was the most corrupt system they'd deny it. "Ahh... when you tell them the truth "Whites are naturally racists The most racist are always denying it. Your father
Kurt Samson,Anyone else also having issues with the feed reloading every time? "@Sofia Sofia I'm also getting ads loading frequently. Together with the constant video reloads "@JS Bach I generally don't mind ads
Carl Theunissen,@Kurt Samson Yes!! Irritating!!! @Kurt Samson Avast has an adblocker. Works like a bomb. 😂😂😂😂 Nee man SABC!!!
Brenda Hughes,@Kurt yes he's like a snake trying to slither his way out of this. Zondo is no fool!
Cerebis,"Yes Kurt
Thelsa,SABC Please . . . The feed and sound is captured. Can't somebody please notice it. Is there somebody competent who can actually attend to this ????
Christian W,we need a commission of enquiry into the sabc commission of enquiry feed
Rob Withers,"its called sophisticated cooking the books If you don't rush you will not get yr double check plus bonus "No one can say that there was a lack of discipline at Eskom
Indra Reddy,another Khumalo 🤣
Bridgette Kekana,wow so much money Strip.them their belongings I m waiting for Nomvula Mokonyane to wear orange overalls Gupta brother even his body language says it all he is a liar Zondo is not fool @SOFIA nonono even exploiters yes Ndoda yes Ndoda Agrizzi said he is a racist he did not denied it
Gabisile Mabuza,the 728 million includes the 659 million
Talloolah Moon,Indoda what’s your alternative suggestion Hi Bridgette. Yes! Thought Yes Indoda. So he is removed from society. And so should thieves
Charles Nkadimeng,He was going to be fired SABC please fix your bradcast He was going to be fired
Petrus Mthimkhulu,"liar
Diana Sekatane,the revelations are so shocking we are really in trouble.
sbabalwe dada,"SABC please fix your broadcast
Michael Rijsmus,This is shabeer sheiks BROTHER zONDO KNOWS HIS GUY IS A krook
Lindi 3H Brands,he thinks not following orders is expensive?.. i guess he doesn't have the benefit of hindsight
Magda Seguin,@Franco Gresele Vernie Petersen proved that not all people have a price.Your statement is misleading and provocative @ Welton Paulse you are right I think that as a nation we should stop navel gazing and demand that the ANC seek redemption and fire all the captured cadres...only then can we begin to heal The EFF and BLF have used racial hatred as a political tool and people are following their thetoric traps
rose wheeler,Indoda Yamaqiniso - that it not true
Ben Cole,Here we go again!!! Comments so easily gravitating towards race baiting and generalisations. See if we can all let 1 hour go by without falling into this pit latrine.