author,message
bubbles2675,were the proceedings not going to start earlier than 10 today?
Kwame Okyere-Boateng,Twas supposed to start at 9.30
Desmond Masilela,Judge Zondo is late with 5 min Kwaaaa @Jackson Mpala
Alex Mbontsi,Yes @Jack&Amy
Febes Escorial,ISA NANAMAN TONG WALA KWENTA
Terrance Phala,🤣
Fils de l'homme,"Hello to all my Bantu I like the level of intelligence in this cross examinsatin btfl ppl are speaking These two peopl r so bftl caucasian are so btfl Can a Bantu lead a nation or a tribe @Tony Jantjies give ma succesfful country run by a bantu? @welton paulse give an example @Tony Jantjies Kagame is not a bantu "Kagame is a Tutsi @welton paulse u r wrong @welton paulse My bantu maid didnt come as she gave birth so she is on leave so its hard times @Mosimanegape Bapo u r sick in the mind hi @Monique Jones i saw u on twitter yes @Monique Jones "@Monique Jones u r very kind "i know @Monique Jones @Mosimanegape Bapo venezuela is damaged "@welton paulse I love bantus @Mosimanegape Bapo u r sick "@Monique Jones u r not black @welton paulse Bantu cant survive without the caucasian @Mosimanegape Bapo why do bantus in SA have such an issue with caucasians? "@welton paulse Not at all "@Mosimanegape Bapo twenty four years that bantus are running the country "@Mosimanegape Bapo u must know that the bantu is incompetent bcz unlike the other ppl group on earth I just saw Peniaza Lizufi talk crap on TV These Bantus have a romantic connection with racialism @Mosimanegape Bapo do Bantus have high IQs? @Mosimanegape Bapo do u mean the pyramid scheme or 411 scam? "@Kingsley Mathe the reason they do it like this is to avoid social unrest if a political leader seems to be persecuted @Jackson Mpala u r a racist "@Kingsley Mathe it is not about Zuma only ? @welton paulse @Peet Venter is of higher quality than u @Kingsley Mathe No we dont but the inquiry gives to ppl the idea that there was a problem n Zuma will not have an argument to mobilise ppl @Mosimanegape Bapo if Caucasians didnt come u would be in jungle @Monique Jones why did u do it? "@Kingsley Mathe Today they are talking about Guptas and dudzane Gupta @Tshepo Mahlatsi nobody missed u so go away @TheChannel kuluma @Tshepo Mahlatsi I understand ur pain @Henry Mmbando u need to improve ur vocabulary and sentence construction @peter pott do u still smoke ur pot? "haha peter "Hello my Bantu @sakhile mtshali u huys have simple minds. if u dont see the picture being drawn than no body can help u I can prove that Bantus have no sense of the future I can prove that Bantus dont think about the future I can prove that Bantus wil not imporove the lives of S.Afrians in the next 10 years I can prove that Bantus only think about food and sex I can prove tht Bantus have no sense of No sense of future @Kingsley Mathe Bantu is a disctinctive word which separates u from Nilotics @peter pott No I dont smoke @nhlayisi owen magayisa Integrity is a white thing n not black @peter pott what was the question whenever Bantus need an expert they will look for caucasian @Kingsley Mathe The bantu have no plan for the future "@peter pott No I dont lol @Trevor Rolfe u know that I am right "@nhlayisi owen magayisa nothing @peter pott we also built the land @Trevor Rolfe u just dont want to be adamised but u agree with me @peter pott without us there would not be water "@Mkabayi kaSenzangakhona u r right Bantus must understand their limitations @peter pott r u the only one who is unaware that SA has water issues ? @Street Cred that is why white ppl have a burden to help Bantu so that they can improve "@peter pott gee @Street Cred u r right we need each other U guus know that Bantus have no sense for the future Bantus only think of the sex n food @Street Cred u fuuny "Guys I am back
nhla xwale,ya alot problem ya look the future gwede the know what is happen it's true
Frank M,Gwede Mantash Gwede is a very dangerous snake. he appears t be a very important in front of us who know nothing. O rite. @Tladi Maatla i think all the top 5 ANC exc. should come forward and stop acting as if they were not in this world. I DONT THINK HE KNOWS HE HAS SEVEN WIVES. @Fils de l'homme man people like you really i think we dont need people like you in this kind of group. we are here to correct the ANC that we love so much. if you still in the vir wooerd world lets start here right now. 😔😔🗨
Pumla Mtyeku,Gwede Mantash😱 am so crestfallen🙈
david jacobs,He and Duarte knows everything lets hope lol Gwede dont have struggle credentials joined ANC 1992 As per Julius Malema
makhosi nobhatyi,Relax Gwede is coming to answer here Zuma was messing around even though mantashe try to cover and protect party from embarrassment but Zuma continues doing wat he want in the hands of ANC by defending in him David Jacobs if you say Gwede mantashe has no credentials political if you correct what Zuma did to us as credential personnel? Zwane did what he did taking orders from Zuma of course Hahaha @venter This is coming to serious now Sakhile that is depending on state agency which failed to investigate Guptas and arrest them while they were here only when they left the country now act as if want to arrest them "Sakhile money was stolen from us as poor people money that was intended to used for service delivery had being used for Gupta account Trevor Rolfe I greed with 100% when it comes to bite to Guptas and Zuma broke Sakhile mtshali you are brainwashed and your argument is baseless and wasting our time Duduzane went to Dubai to hide everything on February he disappeared with Gupta "They bribed these people
Jeffrey Magongoe,so JZ clearly was not alone ANC sold out on this lets give JZ a break on this and look at the collective
Lindikaya Myeki,I hope that our lovey chair has a sober mind despite his yesterday's judgement on pot.
Dayle,JZ was used cause he is illiterate and was used by the COLLECTIVE... jail the whole ANC because they protected him while they ALL looted the country. He can't count to 7 EFF or ANC = Venezuela @sakhile mtshali ....which PP found no wrong doing.... the captured one by any chance????? @Mkabayi kaSenzangakhona on point @Jackson Mpala and you are MAD And I'll donate the tyre
karl mosweu,gwede is a sneaky character
Tony Jantjies,very sneaky klom skelms this guy auditing banks is huge yes Rwanda his is a decedent from bantus please ja imc steven bantu biko
Mzolisi Kolweni,what is a state? ohh i like this crook JZ He says there's no state capture guys He can lead both bru
Thato Motshweneng,the ANC of Zuma hated South Africans so much. "No
michael mbatha,"Hey Cameraman
Joseph Thobejane,guys u must know that's jacob Zuma it's a big big criminal including his son duduzane both of them they must be arrested. no ways
welton paulse,"Fillis "Fillis "No I am not wrong "Eish then i beat you to it IMC Inter Ministerial Commitee "@Fils de l'homme "Fils de l'homme "Fils de l'homme Peet i think he is backing off because you are old already and can die peacefully by yourself Mosimanegape Bapo he doesnt realiz we dont have to listen to them as we were forced to do in the apartheid years. "Fils de l'homme yet he doesnt know how to die @ Fils de l'homme hence your brother begging to be killed
delphin yvon Moukouma Mboussi,Fils of the man has a big problem with bantu
Lorna Kavanagh,zuma needsto be tried for treason !!! .... and some of his cronies in the ANC. Baapo surely you jest ?? Venezuela?? Bapo ....mmm ..it is not arrogance but intelligence
YouTuber Man,hello
Nkosinathi Ngubane,some people's minds ar speedier than th processes of th commission's .state capture concept may also b used to anti-market yr political opponents on public perception without veracity.
Monique Jones,Hi @Thando Nkutha Inter-Ministerial Committee! I knew that and I don't even live in SA! lol @Thando Nkutha don't block me now @Thando Nkutha I don't know @Fils de l'homme You did?!?! @Fils de l'homme ok @Thando Nkutha how are you this am @Fils de l'homme I'm black and that's all I can say for now. Shhh @Fils de l'homme okay What happened to ANN7? @Kingsley Mathe Even the website is missing! @Thando Nkutha you can ask for yourself. I wanted to know what happened to it since ENCA stopped streaming online 2 years ago @Thando Nkutha why? So you can ask me why am I interested in SA news? @Thando Nkutha I'm far away. Should be asleep but as usual I have a little insomnia @Thando Nkutha I know all my neighbors and you aren't one of them. I said I'm far away and should be asleep. That would give you some idea @Thando Nkutha @Thando Nkutha it's pitch black outside so no I'm not in SA @Thando Nkutha currently I'm in Cali @Thando Nkutha never been to Oz "All of mine are white "@Thando Nkutha I also don't spell neighbor "@Thando Nkutha I use a ""Z"" instead of ""S"" like in Sanitize or Utilize" @Thando Nkutha we don't queue up but rather line up @Thando Nkutha I don't know how big a hectare is but I know how big an acre and how long feet are lol @Thando Nkutha that's not relative to this convo @Thando Nkutha driving on the left is wrong Ok @Thando Nkutha I must try to go back to sleep while they are on coffee break or lunch @Thando Nkutha I don't dream about the Exorcist! "Wait! @Thando Nkutha you were the lead in ""IT"" weren't you? lololol" See I'm not going there with you @Thando Nkutha I'm a lady! I don't @Thando Nkutha but I'm a Marvel fanatic! G'nite or G'mortin I'm going back to sleep No love connections can be found on a YT or IG or FB or Twitter chat/DM
Nhlakanipho Cele,Inter-Ministerial Commitee @Thando Nkutha
Kingsley Mathe,"I am still waiting for someone who will come and say Mr. Zuma instucted me to do this and that "@Norman Zwane since the beginning of this inquiry no one have come out with concrete evidence aganst Zuma @TheChannel but many are already saying he is guilty "@Norman Zwane I already gave you an answer "@ Norma Zwane; I have read the terms of reference and they really circulate around the former president and the Gupta family "@TheChannel; in short @Fils de l'homme; who has given concrete evidence against Zuma since the begining of this inquiry? "@Monique Jones "@Fils de l'homme "@Monique Jones "@Fils de l'homme "@Fils de l'homme "@sakhile mtshali  "@Nelson Musoliwa "@makhosi nobhatyi "@Fils de l'homme "@peter pott @peter pott if we are serious about rooting out corruption and state capture then we should go that far @Andrew Mc Farlane; National Prosecuting Authority has asked for a postponement of the matter for three to six months as it said evidence was still being gathered for strengthening their case. "@Gambu "@Trevor Rolfe "@Fils de l'homme "@sakhile mtshali "@Fils de l'homme "@Fils de l'homme Judge Zondo was about to write something but maybe quickly asked himself why they brought this guy here "@Fils de l'homme "@Fils de l'homme @sakhile mtshali likewise am still waiting... @sakhile mtshali concrete evidence in the existence of state capture "@James Sthole "@Andrew Mc Farlane @James Sthole ??? "@Andrew Mc Farlane @Andrew Mc Farlane by explaining what you meant by Living on a closed island I shall return when he is done
TheChannel,You have to remember @Kingsley Mathe that like a tree the roots dont actually connect to the leaves. But the influence is there... Zuma is far from these right now @Kingsley Mathe @gaddafi tshazibane ANC had to be corrupt during apartheid "@Kingsley Mathe​ its okay for even Zuma to hide behind the law procedures but if you can cause amounts of smoke that he has @Kingsley Mathe is your view that there was no corruption? or are u looking at this saying everyone at that level is doing this? "@Kingsley Mathe unfortunately they will not go to Prison @Fils de l'homme that is what the HISTORY of a White person tells u
Creighton Schlebach,@Thando Nkutha ando I think it means Inter-Ministerial Committee in this context There you have it!!! The link between state capture and inequality!
gaddafi tshazibane,anc has been corrupt way back even in exile they were crooks were they will send soldiers inside to buy them crockets and heavy weights
Norman Zwane,@Kingsley Mathe : why is that so important? viz. someone who will say Zuma said this or that to them? @Kingsley Mathe: My queston again. Why is that so important to you? @Kingsley Mathe : Those are not the terms of reference of this inquiry but whatever floats your boat
Millicent Shozi,"fils your you still here fooling around
Peet Venter,@Mosinamengape I'll gladly offer you the opportunity to kill me. Please meet me at your closest police station with the weapon of your choice. I'll come unarmed. @Mosimanegape Bapo I'm giving you the opportunity of a lifetime. Please accept my offer. @Mosimanogape Bapo I'm giving you the opportunity to kill me. please meet me at your closest SAPS office. @Mosimanogape Bapo I want you to kill me as you said you want to do. Why are you backing off? @Welton Paulse I remain white. "I'm very happy with Malema's announcement that whites will also get land because SA belongs to all who live in it. I've never owned property and can now take part in ""illegal"" land occupation." "ALL govt officials should be forced to only use public institutions like hospitals ALL govt official should be forced to only use public transport. ALL govt officials should be forced to live in squatter camps. It is the fastest way to improve living conditions. ALL govt officials must be forced to buy their food from street vendors. It will grow the economy very fast. ALL govt officials must be forced to only drink tap water. SA will then have the best quality fresh water.
Mosimanegape Bapo,@Fils de l'homme noo you are listening to these things of the white lies. Venezuela is the biggest economy on the planet "I will only vote for the CIC or Thuma Mina "@Lorna Kavanagh aii this white arrogance @Fils de l'homme because you have cursed us with a smallanyana white witchcraft of poverty @Fils de l'homme they give us a nice tshikipa for voting "eish ja neh "@Peet Venter you racist "@Fils de l'homme thats where we get our power "@Peet Venter eish this one "@Spinderella yes brother @Peet Venter you must go to the europ police station @jenelle chetty land "@Fils de l'homme we have the highest "@welton paulse yes tell this old racist We wuz the kangz @Jackson Mpala just go vote DA like all the other cleva blacks only black people who benefited from apartheid and think they are fancy vote DA
fab planetearth,@mosimanegapo you are brain dead oxygen thief racist is the only line they have look at rest of africa - I rest my case lol hahaa bwahahaha just as I said see above
Thulani Bukani,@Frank. I blocked Fils a few weeks ago. I don’t see his things insensitive comments anymore. You should do the same. It’s useless engaging him.
jjkrew,lol racist always the fall back line if you cant beat them call them racist lol most of url wasnt alive during that era but url still remember the pain a eye for a eye will leave the whole world blind liberation comes with education so thats where the starting line should be yes but education is fundamental for the future
thinavhuyo victor,i think this platform it has nothing to do with race or colour
Vani Naidoo,"I hope this commission gets to the bottom of this
kenneth mampa,Zwane is a gupta stogie @ Sakhile plse call her State protector
Jackson Mpala,Zondo is a dagga smoking judge Zondo need to be investigated he is a confilicted man Zondo has been captured by dagga smoke "I was always wondering why Zondo loves food too much "Is there anything special about being white? I am black and i teach all white learners and by the way they call me sir "I am in class DA is the most useless political party in the world Zondo has a nose ZUMA IS INNOCENT SOME OF YOU SHALL TASTE JAIL BEFORE ZUMA WHICH COURT HAS FOUND HIM GUILTY THIS IS THE GATHERING OF THE ENEMIES OF ZUMA I DON'T BELIEVE IN THE SO CALLED STATE CAPTURE Zuma is going to to no prison Zuma is more intelligent than these educated fools bringing dagga in your bedrooms Tell me anyone who implicated Zuma i these testimonies Maybe eve as we speak Zuma is having a lunch fit for a president Gupta was a busihness man who just happened to have connection I believe all of you are also yeaning for connections Life is about connections and guess what Gupta had a connection Who ca reject a connection to the president This state capture is based on a lie Zuma is going nowhere
sibu zwane,@Jackson what he needs to investigated
Mr Sandile .Thusi,what's this guys name
Tobo Lwandile,when is advocate Thandi Norman SC leading evidence
Ewald Kruger,@Jackson Mpala is your school on holiday today? "@Jackson Mpala private school "@sakhile mtshali you have the time and resources to watch this 😀 @Andrew Mc Farlane or because his family received a house all is hanky dory. Captured by the free house. "Zondo now connecting the dots
peter pott,"aha! EFF "question is "Fils Fils! we have few international airports too. live if you so wish this slide sound similar to the one used to proof what happened after arrival of Boers in Africa😟 "my point is why is steinhoff accounts not closed Mathe! we need not go that far! Just use recent accounts we read of in our newspapers. No one can answer question I posed "today mathe! lol! they have destroyed the records my man! nkutha!who is everyone? Mathe! I agree "here. is another question. in the absence of Guptas now fils! you never answered my question on steinhoff? "Fils! lol. you don't know Fils! you don't smoke you said lol Fils! they are tolerant though. to see people who invaded their space and smile daily to them. this "the madala is promoting tourism now.☺☺☺for what they are paying him "Fils! can't be built Fils! Lesotho mountain provide water unstoppable to us Fils! there is no water crises here. management crises it is. "Thwala! those are adults university students "Sakhile "mtshali! and you can look straight into the eyes of a white boy who irritates you and tell him FU "can he also tell us schebach! we then agree that state was captured prior to 94 for inequality ran deep between color lines? louw! Is that the reason why land was captured from African ancestors? was motivated such move? Rolfe! let's live it to both nguni and koikoi to clear. What we know is that those of us with brighter complexion were not part of this continent
Onsen Zivavose,the state capture inquiry is the waste of state resources. the fact of which they go such a long process is an obviously and that need all this commission of inquiry while the country is under crisis.
Gert Pretorius,what on earth has injustices of the past to do with criminal behaviour... stop referring
Henry Mmbando,Tsepeso Tsekwat. where are you since our CO study at Mvumi hispital tz.? anxious to here from you.
Wilson Hishono,🤔
thamaha ratlele,This all anc doing openly in parliament
Suresh Ruparel,being indian myself i still state catch 5he culprits and jail them don't let anything get away but so do CARTEL'S economic LOOT Don't forget respirces control by cartels knowingly destroy economic system progress been denied rainbow chicken dumped so rates not go down was example now farmer's minerals 7nder value exported ♻
Johannes Makuwa,Gupta state capture 🚰
Ann E,"Malema just said he'll 'sort out' RUPERT & OPPENHEIMER
TG Swartlane,Thando what’s your IG? This mtshali guy is one who has benefited somehow
Nozipho Thembeka,It’s tea break ??
Ngcebo Mabizela,who is testifying next?
Charles Nkadimeng,all rise
sakhile mtshali,These banks are acting with impunity! we are not safe. I thought they will detail that trail of money being looted but they colluded to close account based on unfounded media report "there decided to affect 1000s of jobs based on unproven reports Stephanie Martins this is commission that is probing transaction follows "Yes I'm yet to see evidence of follows of billions allegedly stolen by the Gupta "The Guptas did take the banks to court Where is the evidence? "Lets not be emotional where is the evidence? i ask again "show me bank statements "nonsense "that is a lie show me the evidence of State Capture! are you awere the PP found no wrong doing in Estina? "Lets not be emotional Non of you can provide evidence that will stand in court. the journo that leak the emails is not testifying So was Thuli This Thando person is blinded by fake news We should have the Guptas behind bars by now if there was evidence @Thando Nkutha you are being childish . you are failing to prove proof and getting emotional @nhlayisi owen magayisa amandla "Just listen to these banks "How can say there was money looted when the Banks dont have that money We cant hear what was suspicious transactions that these companies where involved in. what is the crime @Michael Wild There is no proof of Gupta involvement there @Michael Wild "What is worry is we hear no detail what was laundered "If there was something "We know that Trevor Manual intervened in the appointment of Des Van Rooyen "@makhosi nobhatyi are you not aware of the meeting between CR @makhosi nobhatyi what is wasting time is listening to these banks lie that there was no colluding I'm yet to hear a sound argument to prove Zuma wrong on his definition of the state @peter pott is leadership what are you waiting for @Kingsley Mathe Its no enough to accuse him of handing the state to the Guptas without proving it beyond doubt "@Andrew Mc Farlane  @Street Cred is have not heard or seen evidence so far. If we can take Jonas to court he will not be about to prove the meeting too place "@Andrew Mc Farlane my mother was earning salve wage as a domestic worker what evidence sir ? i never accused anyone of State Capture "Are you suggesting i prove that it was not capture @Andrew Mc Farlane? that is easy
Andrew Mc Farlane,Msholozi will say this guy is misinformed... is captured @sakhile mtshali define impunity @sakhile mtshali I thinnk you should testify with all your evidence. @sakhile mtshali Im sure the Guptas also wonder what happened to all the money they looted from and subsequently burnt to build Duduzane's house etc in India and the UAE.... Only after a court case will the evidence be shown in public. Well then the corruption of the Apartheid times should be exposed. @peter pott what is your point? @sakhile mtshali just to be clear.. please define evidence @peter pott I ask what your race connotation is all about @sakhile mtshali just watch the commission..... plenty of evidence. If you cant see it then turn it off and have some lunch @sakhile mtshali people provided accounts under oath. It can be used in a court so it can be regarded as evidence @sakhile mtshali provide evidence to the list @sakhile mtshali yes the captured PP... The one who is a spy... the Zuma lacky @sakhile mtshali can you prove the ANC government has improved the quality of education for the poor since 1994? "@sakhile mtshali @sakhile mtshali and what do you define as normal? Someone who has open eyes and ears? Someone who can rationally think about information? "@sakhile mtshali if you consider the testimony of Mentor as well as Jonas @sakhile mtshali where is your evidence? @sakhile mtshali your testimony my brother.... @Kingsley Mathe of course. Living on a closed island may help... @sakhile mtshali but at the same time you are denying that state capture exists... you have not shown conter arguments to the testimonies @Kingsley Mathe just state what you need help on and I can assist "@sakhile mtshali prove that Eskom @Ewald Kruger he must be in the minerals dept and was left over after Zwane left I think our country is unique so we will have to work it out on our own
Stephanie Martins,Sakhile Mtshali i think you should listen to the testimonies again. you miss the part of bank client confidentiality. you and me are a 3rd parties as a result we are not privvy to that info. If the Gupta owned companies felt that the banks colluded they should have approach the courts. Not approach Jacob Zuma. Sakhile Mtshali some of us see it.
Nelson Musoliwa,What do these graphic illustration about state capture say to Zuma? Does he even understand when they say enablers of state capture. Waht a shame my former president
Wildthing,Sakhile wake up. there is one house in Dubai worth $46.000.000 all click on Fils de ľhomme and report it is a Gupta. trying to turn people against each other. "Sakhile they will start to ask the question on why 4 ministers went to Dubai in one week including Zuma for no real country reason. the answer they carried cash that will come out later And by taking 20% ftomeach contract like new trains that don't fit. but commission paid outside SA. Not paying Tax. moving it out of the country starts to weaken the country too. block fils "I work in company and need to report any gift over R500.00 to the compliance officer. if I don't I am fired. that could mean anything like sports tickets we know before 94 many things where run bad. But wil we in 2018 and have new rules to prevent going back and should also lock down Goverment right too. He just has. by explaining how changing ministers is part of State capture. finance minister comes to mind as one. No thanks Jack don't want jail time when it falls apart jacks that leads to corruption. that's why we here jacks an honest business person. Ha ha too late he is going down
Sthakathi Khumalo,"But Sakhile is right
Mike Cope,"Zondo is a great jurist This guy and his colleagues have been studying State Capture for years and in many countries. What he has to say is very interesting to me.
Mbongweni J.S.S,are u guys listening /watching the witnessing guy or u just fighting over-nothing ?
Lowkey Apparel,BORING!!!
